side,script,round
against,"Well, the idea of the SEC when it was created in the 1930s, was that it would be about putting information into the market and letting the market sort everything out, the SEC, his authority is very limited, so they’re a Keystone Kop without a billy club. And, it’s a good idea to consider that, again, and it’s a good idea to consider rewrapping some of that unwrapped regulation that we talked about, but right now Washington doesn’t have the tools, and doesn’t have the authority necessary, I think, to provide that kind of oversight.",2.0
for,"Well, you know, I go back again to the issue of incentives on international scales, financial crises do not occur everywhere, there are countries like Canada and many others that have better regulators and supervised financial system, and these things don’t occur. It’s not that Canadians are more moral or less greedy or less incompetent or more competent or more arrogant than anybody else and, same thing for Europeans and Asians and you name it. Human nature is similar. And by the way they are not crooks, you know, everybody responded to incentives, everybody wanted to maximize profit returns and whatever, that’s what market economies are all about, but we know that human behavior can lead to excesses in society, that’s why we have institution in society, otherwise the law of the jungle. And in this case of financial market you know that greed and excesses can lead to damaging effects, that’s why prudential regulation, supervision of financial institution, is so much more important so at the end of the day, it’s good public policy, it makes a difference between crisis occurring or not occurring, that’s the lesson of the last 50 years, it’s not about human nature, or greed or being criminal—",2.0
against,"But wait, let me just quickly fin—",2.0
for,As your attorney I would advise you to stop speaking immediately—,2.0
against,Let me just quickly finish. Quickly finish. That makes the job—,2.0
for,"—bad guys, I’m getting there.",2.0
against,"That— So, that means that the regulators, are not strictly out to arrest them or bust them, we have to set up a somewhat permissive regulatory system to allow them to operate, and then hope-slash-insist, that they actually don’t run the system into the ground, which, we didn’t do that—",2.0
for,"Can we do chickens and eggs now, because I’m getting bored of cops and robbers. The— Far be it from me to lecture an audience like this about American history but it seems to me that, the question wasn’t really framed quite correctly. From— That—thanks. The—from the very inception of the United States there was a profound tension, between Washington and New York. Alexander Hamilton’s vision of the United States as a financial power was not shared by all the founding fathers and indeed James Madison was extremely skeptical about it. That’s why there was consistent resistance to the creation of a central bank in the United States, that lasted right up until 1913 with the Bank of the United States being chartered and then gotten rid of twice, in the course of the 19th century, so— I think we need to see this as part of a long argument, within American political culture. How powerful should New York be. And should those other parts of the United States, let’s call it Main Street, should they in fact dominate. And I think what’s happened in the last 10 years, is that New York did get the upper hand. And I think the rest of the country, is ready for a backlash.",2.0
for,"Well, I just wanna say that while Wall Street certainly needs reform, it always needs reforms and it’s constantly being reformed, it has been for 200 years. But it doesn’t need reform as badly as Washington, specifically Congress. Which is a profoundly sick institution. Institutions tend to evolve in ways that benefit their elites, and if you want the poster child for that, it is the United States Congress. I also wanna just add one thing on the… People on the other side have been saying that Wall Street took all this—took their checkbooks down to Washington and lobbied to get the regulation they wanted rather than stricter regulation. And actually said, therefore, Congressmen were the victims of this. I’m sorry, but Wall Street was not debauching a virgin, it was paying a harlot. ",3.0
against,"Boy, how do I follow that one. Well, again, we’ve had a lot of lofty philosophical questions batted back and forth, but there have been very, very few facts put forth tonight. And I wanna stay with the facts. So we’ll just consider one instance, Lehman Brothers. Which when it failed, had adequate regulatory capital, and was still profitable in its trailing 12 quarters. Yet when the credit default swaps were settled for Lehman Brothers, a month later, its debts were marked down 90 cents on the dollar. Now its debts at the time in terms of funded debt were $150 billion, stay with me on this, numbers are important when it comes to Wall Street. So, 90 cents off on that dollar bill means the debt was impaired by $135 billion. Lehman bonds still trade around 10 to 15 cents on the dollar, six months later. There’s $20 billion in equity at the time, that tells us that the hole in Lehman’s balance sheet was roughly $150 to $160 billion. To put that in perspective the hole in Enron when the dust cleared, roughly was $60 to $70 billion. Lehman was twice as bad as Enron. We haven’t gotten to AIG yet, or Bear Stearns, or God knows what else. Ladies and gentlemen, malfeasance trumps incompetence for the purpose of this resolution, and I urge you to remember that when you vote.",3.0
for,"Well, you know, it’s not a debate about robbers and cops because there is a huge amount of evidence that actually, financial development is very beneficial for economic activity. Companies are more financially developed, provide lots of services, you know. Credit cards, mortgages, commercial real estates, insurance, risk hedging, you name it, it’s very important and beneficial but we know that when there is financial innovation sometimes becomes excessive, there is asset bubble, there are credit bubble, excessive restaking. People become greedy and all the rest, and you can have a system that is so regulated like some countries, like India, whenever there’s a bank that is ever failing, but you won’t actually, the market economy where sometimes, some banks fail. But you don’t want a system which everybody’s collapsing, you have systemic risk. And the distinction there is you want innovation, like in any country because it’s gonna be beneficial, but you want to avoid crisis, and to avoid crisis, you need appropriate rules, institution, prudential regulation of the financial system. Not too much, not too little, it’s a trade-off, it’s not a black-and-white. And the difference between a system that works, that has innovation and provides benefits, and avoids a crisis and one which crisis occur over and over again, has nothing to do with Wall Street or the greedy bank as you name it. Has to do with the quality of public policy. Proper supervision and regulation. That’s the distinction, has been always the case across countries, across history, so let’s look at the big picture.",3.0
against,"Politicians are accountable through the political system, you don’t like ‘em, don’t vote for them. You wanna vote for candidates who don’t take money from lobbyists, be my guest, that was a policy that got Barack Obama in part elected. That’s great. But the people who stole money, to send it to Washington, are the people on Wall Street. Is there one shareholder of Bear Stearns or Lehman, who wanted that money to be used to weaken regulation? No it wasn’t, there’s a huge moral hazard involved there. The same moral hazard that involved them paying themselves hundreds of millions of dollars. The return on investment for CEO pay is less than a piggy bank. And that’s because they’ve corrupted the system. They didn’t need any help from Washington for that. They did it themselves. So please, vote against the resolution.",3.0
for,"Well ladies and gentlemen, it’s not very often that you hear Washington D.C. defended, by a journalist, a former government attorney, and a short seller. The journalist told us it would all have been absolutely fine if the banks had been as run as—had been run as well as the airlines, when did you last fly Continental, Alex? Jim Chanos told us that corporate fraud is endemic in corporate America, and this goes from Enron to Madoff. What they agree about, and here they do agree with us, is that, in many ways, Washington is in hock to Wall Street. The difference is that Nell Minow thinks that Washington, the legislators, poor things, are the victims, in this strange case. Now, that is where we part company. On our side we see them anything as the victims, we see them as the key perpetrators. And let us not forget just how far this has gone. Who was, Nell, the second biggest recipient of donations from Fannie and Freddie? Yes, it was the President of the United States, Barack Obama. And let’s not forget that among the firms that contributed most generously to his campaign were Goldman Sachs, Citigroup, J.P. Morgan, UBS, and Morgan Stanley. What we need to contemplate, ladies and gentlemen, is the Latin Americanization of the American political system. This symbiotic and indeed corrupt relationship between Wall Street and Washington is the thing that is rotten at the heart of the United States, it is the principal explanation for this crisis, and that brings me to the key question you have to ask yourselves. Who has to defend the public interest. Is it the investment bankers, the hedge fund managers, or is it your elected representatives. Ladies and gentlemen, it is perfectly clear, that it is Washington that has failed to defend the public interest, and I fear, it is continuing to fail to do so. Please do vote for the motion.",3.0
