side,script,round
against,"John Donvan: All right. And Berkeley. John, I call myself a tech guy lost in academia. That's the shortest way of describing --John Donvan: All right. Ladies and gentlemen, Vivek Wadhwa. You know -- -- it must be because I'm an immigrant, I'm a tech entrepreneur, I'm a foreign , that I have a totally different perspective on this whole debate. In fact, when I first stepped into it, it was ripping Peter Thiel's head off in an article I wrote for telling kids to drop out of college because it didn't make sense to me. You know, as an academic for the last six or seven years I've been researching what's happening globally. I've been researching the impact of globalization on U.S. competitiveness. I've been researching American schools versus other schools, and so on, and what makes America what it is, you know our competitiveness, immigration, and so on, those topics I've been researching. And when I step back from that, my conclusion is that these people in America are totally completely out of touch. If you read my writings, you'll see that I've been writing very controversial articles, each of them rip into a different aspect of American competitiveness because we don't get it. We're sitting here in our own little bubble disconnected from the rest of the world. Now, let -- I'm going to give you three perspectives on this. First of all, about U.S. education itself, believe it or not, U.S. education is by far the best in the world. Everyone is trying to be like us. This is -- you know, I mean, people from abroad stake their life savings, you know, all the money they can possibly raise and invest it in sending their kids to America because we've got the best schools. What do gain from our schools? It's not the courses. It's really the knowledge. It's how to learn. You gain social skills. You learn how to interact with other people. You learn how to deal with failure, make compromises. You learn how to solve problems. These are sort of things you learn because our schools have a way of making you socialize, making you think, making you compete, and American kids come out the best and the brightest in the world. This is why America is what it is. Now, another argument we're discussing is well, some kids shouldn't go to college. You know, Charles has written a lot about IQ, IQ tests being determinants of who will and won't succeed in life. To me that's complete baloney. I mean, my whole life I've faced stereotypes because I happen to be like a -- you know, one -- a race that may not be very smart. In my youth it just be that my people were beggars and snake charmers, then we became low level engineers, now we're hotshot CEOs. In my lifetime I've seen the transformation of how people perceive me. So if I was going by these classifications of who should be and who shouldn't be educated, my people shouldn't get education because we don't really deserve it, we're not going to be successful, therefore, leave us out. You'll find the same thing with many other minorities in America.  I tell you if -- I know from my own children that they've gone through gyrations, so trying to decide what they want to be when they grow up. When they were young, they had some ideas. They don’t -- other ideas. Now, if I had to decide when my sons were 16 years old, whether they would go to school or not based on their aptitude, it would be the worst decision I could possibly ever make because I’d be wrong. Both of them decided to do completely different things than what they were talking about when they were young. Children don’t know. So who are we? Who are parents to try to figure out whether they should get education or not? America is what it is because of our education system. America started educating the masses, and its productivity rose. We became the most fiercely competitive land in the world because we educated everyone. Now there are a lot of people left out as Henry talked about, but the solution to fixing America’s competitiveness is to bring everyone up to educate everyone. Now we can debate what a college is. To me, a community college is a college. A college -- you know, Peter Thiel basically has lived in this bubble called Silicon Valley where everyone thinks -- when they think college, they think Stanford. They think Berkeley maybe, so, you know, one level below Stanford, but that’s it. And when he talks and when he gives all these great talks about education, he talks about $200,000 of debt, $250,000 of debt. I know some great people who have gone to community colleges who have almost no debt, who worked part time, been able to pay their fees off. Our community colleges in this country are also colleges, and they too are better than the best -- they too are better than the best institutions in most other countries of the world. I don’t know why we keep forgetting that. Now, I also taught, you know, I teach at several universities. I was at University, and my students brought up Peter Thiel. He’s quite a legend worldwide now. They were talking -- they said, “Professor, is there really an American investor who’s paying children to drop out of college?” I mean, they were so, so confused. At the end of it, we talked about it, and they said, “You know, this is great because we’re going to eat their lunch.” This is what they were thinking. They didn’t say it. But this is what’s happening in the world right now. Just as we had these stupid debates about educating our children, the rest of the world has learned our trick. India and China are now graduating 1.5 million engineers a year. They’re educating all their people because they know that it’s going to make them like America, and they’re going to eat our lunch. So if we keep having these silly debates about four-year degrees and this and that, we’re going to lose out. You talk about entrepreneurship, again -- again, I have a lot of respect for Peter Thiel while chatting with him, but, you know, he talks about entrepreneurs who can be pulled out of school and do very successful.  They’re 25, maybe 200, 2,000 people in America who don’t need to go to college. I have researched this systematically. What we found was that the difference between entrepreneurs in the tech industry, in the same world that Peter comes from, the difference between entrepreneurs who have a Bachelor’s degree and who have a high school degree is huge, almost two-to-one in terms of revenue and number of employees. In terms of success, that’s how much difference education makes. Now, the interesting thing is what we also learned was that it doesn’t matter what school you graduate from. The tech founders in America, the most successful people in America graduated from a wide assortment of universities. There are almost as many universities as there were entrepreneurs in the research we did. It didn’t matter whether you graduated from a community college or whether you graduated from Harvard. You could still make it big as an entrepreneur.  Because school gave you that basic foundation to be able to learn. Now, moving forward, the Indian and Chinese are going to be eating our children’s lunch, guaranteed. I mean, I’ve researched it enough to know that we have a lot to worry about. If we disarm right now and stop teaching them, we’re going to become like they used to be. They are absolutely going to demolish this country. And what’s going to happen is that globalization is going to wreck havoc on industries. Already we’re talking about manufacturing. We’re talking about several industries now going offshore. It’s going to happen more and more. We’re going to have to keep constantly reeducating our workforce. Ten years from now, we’re going to have to have massive retraining programs for our workforce. If you don’t even have a Bachelor’s degree, if you don’t even have basic education, you’re beyond hope. These people may be end up, you know, waiting tables at restaurants, but we’re going to have too many of those. We need to provide our workforce with a basic education. I say we’d have to have every American getting at least a Bachelor’s degree and encouraging them to do Master’s and Ph.D.s.",1.0
for,"Well, it certainly was not historically part of the American dream. So if you looked at how many people went to college in the U.S. in the 19th or early 20th century, it was a very, very small percentage. And it was -- this is a very recent phenomenon that this is seen as an absolute necessity. And I think -- I think in many ways I would actually flip it around, and I would say, what's gone wrong with the American dream that we have to have people go to college when that was never a necessity in the past. People don't need college degrees for many of the jobs that we have. There are many good jobs where you don't need them, many bad jobs. People get stuck with college degrees. But I'd actually flip it around. This whole question of what sort of a good is college. Is it an investment in your future? I don't think it's a good investment because it's costing toomuch, and there's no -- seemingly no accountability whatsoever from the other side on the costs. It was absolute good, any price. Pay no attention what the price is. Is it a consumption decision? And I sort of have joked that it's like a four-year party. And I think that's kind of true, but I think people are too stressed out to really have a four-year party when they're taking on a quarter million in debt and know they're going to be debt slaves for the rest of their lives or for the next 10, 20 years. And so I think the way to think of it is that it's basically become an insurance policy because the cracks in our society have become so big. And we need to be asking why are so many people having to pay more and more for insurance and what's gone wrong that we're paying so much for insurance.",2.0
against,"Well, I didn't think this was a debate about cost. I'd be quite happy to talk about cost. A lot of the sticker price is discounted, as you know, through very substantial financial aid. Plus I also took literally the topic of college which means lots of low-cost colleges Vivek and others and myself pointed out. I don't think it's a nightmare for people. I think most people come out of a college experience feeling better. In fact, there's even surveys about how do you feel. You feel better as a person. And it's quite positive. I think of it as a consumption good but not as a full-time party for four years. No doubt there are some people who do that. Woe to them. But it's a consumption good in that there's something good in and of itself of learning about beautiful things and learning more analytical ways of thinking. It was Steve Jobs himself, the late Steve Jobs, who said when he came back after dropping out of Reed and sat in on courses, he took a calligraphy course. And that calligraphy course gave him a whole new world of thinking about design. Who knows what, in the college experience will trigger for people thinking about the world in a different way. John Donvan:Let me go to Charles Murray and -- maybe we want to discuss what the metric is, how do we describe whether college is worth it. And your opponent is saying, you know, you can learn beautiful ideas. And I was an English major, and I speak English now superbly. It's been very practical and useful for me. But -- but seriously, is there -- are we putting dollar and cents measurement on something that needs to be measured more broadly than that?",2.0
for,"Well, I'm not doing that when I say that too many kid are going to college. I'm coming at it -- again, let's go back to the American dream thing. In 1960, which wasn't that long ago for somebody as old as I am, only eight percent of American adults had college degrees. So college was a big deal then. But 92 percent didn't, including most of the successful people in this country. Not having a college degree had no relationship to the American dream at all at that time. College did have prestige. But you didn't look down on somebody who hadn't gone to college. And one of the things we don't like to say any more, but it is absolutely true, is we do now. If you are just a high school graduate, you are a second class citizen in this country. That is a kind of destruction of the American dream that I think it's becoming like a caste system where if you go not just to college but to an elite college, the doors will open and you are going to be a success, and you don't give into that -- No, I'm not. The caste system is real. I mean, how many people out in the audience can tell to a fare-thee-well when someone says what college they graduated from, you know very well, you go clicking through your mind, and you can place that college as to where it is in the stratification. John Donvan:The argument that your opponents have made that a Bachelor's degree is meaningless, now you -- you meant that in the extreme. I'm sure you're -- you also said that it -- If that's the only bit of information you have about a person, you don't know a thing.",2.0
against,"I want to tell you, and mostly again because I am an immigrant, and I understand the American dream more -- better than most Americans do. Look at the rise of America relative to its education. We rose -- you know, in the '50s and the '60s, we were coming out of the war. It was a different era. Over the last 50 or 60 years, we've become ""the"" only world super power. Yes, the economy is in the tank right now. Yes, things are bad. We'll come out of it. This country keeps reinventing itself because it has smart people who can think outside the box that -- who can reinvent themselves over and over again. Yes, there's some outliers who can't. But the average American can reinvent him or herself, and that's what makes this country what it is. Bachelor's degrees, if we want to declare -- bachelor's degree is irrelevant, then let's invent something new. But we're not going to be able to change the system like that. Like you said, if we outlaw bachelor's degrees, we're going to declare defeat to the rest of the world because the rest of the world has caught the American dream. Those Chinese students I talk about, they are just like my students here at Duke and at Berkeley are. They're just like the students we meet over here. They read the books. They follow us. They understand what we're doing. They want to get those bachelor's because they want to get master's, and they want to get PhDs. That's how it is. So forget about our vision of the American dream. We're now a small part of the world. Our economy is becoming a decreasing part of the world. We're going to be competing like you won't believe over the next 10, 20, 30 years.",2.0
for,"Let me just tackle this whole globalization international thing. So I think there obviously are a lot of things that are very admirable about India, China. People have a great work ethic. They're thinking very much about the future. And I do not want to at all underestimate how serious the competition is or to encourage people to be complacent. But the proposition we're debating today, do too many kids go -- are too many kids going to college, and if you look at those countries, the percentage is much smaller, and it is -- you know, I looked these numbers up because I figured -- I thought you might make this argument. And the U.S. -- there are about 40 percent of college-aged students are in college. And of course there are a lot of them that end up dropping out. It starts at more than 40. But on average, 40 percent fromr in college. In China, the number is 20 percent. In India, the number is 10 percent. And if you want to look at China and India, it is a brutally selective system. Very few people can get in. People are worked incredibly hard once they're in college. And if we want to be more like them, the first thing -- simple approximation is you have far fewer people go to college. And this is true of any other country in the world you'd look at. And so if the U.S. should take its bearings from other countries, that is a very powerful argument for our side.",2.0
against,"Well, at one time, it wasn't so long ago, the United States was first in the world in post-secondary enrollment. And whatever post-secondary enrollments meant. And now we're -- we were 12th a few years ago. I think we've actually fallen to 15 to 16. If anybody thinks that's a good idea, they would think again. I want to add one more perspective getting back to the Indians and Chinese. Yes, it's a smaller percent of the population. But look at the industry in which everyone is moving, technology, engineering. 1.5 million versus about 100, 150,000 of ours. They're eating our lunch. You should -- you know, they have become -- India has become a $80 billion IT industry which came out of nothing at all the last 15 years.  By educating its people. Zero to $80 billion in 15 years. But there -- that's because they don't have the resources to do it. They're putting everything they can into education .John Donvan: So if you were king of the world, would you educate everybody in India? Would everybody go to college?  I would educate everyone in the world because it uplifts society. What it does is it improves -- because the low-level jobs are going to go away. Robotics are going to take over manufacturing in the next ten years or so. So those jobs which could be menial jobs that you could have non-educated people doing, they're going to disappear. It's become a knowledge economy where everyone has to now do intelligent things or they're unemployed.",2.0
for,"But look at the way the caste system persists because you have good jobs which is being a lawyer or a doctor or a scientist, and then you have menial jobs. Now, tell me where it is written that we ought to --",2.0
against,", Charles, you're creating a new caste system .",2.0
for,"But let me finish my sentence. That we ought to think about what is more intrinsically rewarding about being a lawyer than being a cabinetmaker? Why does that have -- should that have any privilege over being a cabinetmaker? There are a whole lot of jobs in this world which are wonderfully fulfilling that don't require a college degree and we talk about them as being vocational training. That is a kind of invidious caste system in education that I want to destroy by getting rid of college degrees. John Donvan:Charles, which jobs are you talking about because what the other side is arguing is that those jobs are disappearing due to automation and robots, et cetera. Wait a minute, skill jobs, listen, you want to hire a lawyer or a doctor you can do that in a nanosecond. You want to find good skilled labor? That's hard. Finding a good plumber, a good electrician to come and fix things, that's hard. We have a demand for a wide variety of skills -- -- a wide variety of skills that we aren't meeting because guess what that's demeaning those occupations.",2.0
against,"But now, Charles wants to overturn the wage structure of the world, not just the U.S., he wants to overturn the return to knowledge. I don't have any bias against craft skills and I agree that sometimes they're in very short supply and they get a good return, but we -- you know, if you believe at all in markets, I assume, Charles, coming from where he comes from and with his ideas believes in markets, people pay a return to something that they think is relatively scarce or that they value in some way. And sometimes it's a great scientist and sometimes it's a great artist and sometimes it's a great craft person. But that's the way it works, so you can have a lot of complaints about college and cost , but now he wants to complain about the world wage structure. But the jobs -- I said the jobs they're talking about, the plumbers and electricians, they're less than one percent of the U.S. population. What about the other 99 percent? What do they do?",2.0
for,"You know, one of the great television shows on TV is ""Dirty Jobs."" Any of you ever seen it? Every week they go to a dirty job but the thing is you find out a couple of things, there are a huge number of ways to make your living. They are interesting, they are fulfilling, the people who are doing the, you'd like to know --",2.0
against,One percent of the population --,2.0
for,"-- it is a great curative for the kind of way we are talking about the job structure, which has nothing to do with wages, it has to do with making a living in a way that is fulfilling and satisfying.",2.0
against,"There's nothing wrong with doing those jobs for people who want to do them. The issue is how do you pick a child who gets educated or who not gets educated, you basically want to do it based on IQ.Charles Murray: Of course I don't. How would you pick someone who goes to school?",2.0
for,I want absolutely open competition for every position in any kind of educational institution no matter what it's teaching. Where you got the idea I want to put IQ scores on kids' foreheads --,2.0
against,Look on the bell curve.,2.0
for,"-- say, ""You can go to college, and you cannot,"" I'd like you to read a passage of anywhere that I've said that. Well, you know, we can find all sorts of anecdotal things. We were told by the other side that we shouldn't look at anecdotes like Zuckerberg or Gates or Jobs and I agree those are exceptional cases, and there obviously are all sorts of people who have idiosyncratic things that can happen in college. They can also happen outside of college. Socialization does not have to happen in college. People should learn how -- you know, this is again a really bizarre recent phenomenon, you know, 92 percent of the people did not go to college in 1960, they were able to be citizens, they were able to vote, they were able to be -- you know, we wouldn't say nobody should have voted in 1960 because they didn't have college degrees. That would have been an invidious thing to say. Oh, I think there are extraordinary conflicts of interest. It’s like subprime mortgage brokers saying people should buy houses. I mean, the self dealing that is going on is incredibly severe in all of this. And I do think -- One other -- one last point. I don’t think you can separate the question entirely from the cost question. And so it’s like saying, you know, “Mrs. Lincoln, besides that, how’d you like the play?” So besides the fact that college costs you an arm and a leg, how much do you like it? And these two things are linked together.",2.0
against,"Well, we -- well, first of all, Northwestern, I can tell you, the full -- if you are a full tuition payer and you had no financial aid at all, you are paying about 60, 65 percent of the total cost of the university, and it leaves out a lot of other things that universities do, which lead to higher costs, some of which I approve of and some of which I don’t. But we’re the research generators of the world in American universities today. Bell Labs is gone. The big pharmas have offshored their research. We’ve adopted those costs. Now, not every university is a research university. It’s not a Northwestern or a Duke or a Stanford, but I want to speak to the question of cost directly since our opponents, though I don’t think it’s the subject of the debate. But you know, we don’t have to induce anybody to come to Northwestern. We get 33,000, 34,000 applicants for something like an entering class of 2,000 students. So -- and that is true of the elite universities. Not all universities look like that. That’s true. And there is this range of places, which we’ve tried to talk about. If you believe in demand at all, people are still voting with their feet. And by the way, it’s foreigners who are voting with their feet because they want to come to American universities for the Ph.D. level. We’ve talked about undergraduate education a lot. But there’s something else that universities do out there, or at least certain kinds of universities which are very, very important. It’s a very important function for the place that I -- College -- community college is college. Some common ground. I’m not so willing to consign the B.A. four-year to the dustbin of history, as Charles is. But I don’t think everything will or should stay the same. I don’t disagree with that. I don’t believe -- for example, take distance learning. I suspect we’re probably on the same page. I think you’re going to see more distance learning, even at the major four-year universities. It’s going to happen. People can take a statistics course online. I’m chairman of the board of a company called Ithaca Harbors where we’re doing research on how people learn online. Maybe they learn statistics online as well as being in a classroom. Maybe they can even do Econ 101 like that.  We’ll see. I’m for experimenting. Our law school went from everybody in a three-year law school program to some people in a two-year program. I think the great universities will change. They should change. Not everybody has to be in a bricks-and-mortar place. Online, for-profits, can be solely online or 70 percent online courses. So we ought to think about this in a flexible way. I don’t disagree with Charles and Peter on that.",2.0
