side,script
for," Well, I guess that would be Barack Obama. Of course, he was president even then -- president of the Harvard Law Review. We had very productive and pleasant interchanges. And I still have a lot of residual fondness from those days. This is Carrie Severino.  John Donva n:You are chief counsel and policy director of the Judicial Crisis Network. That's where you focus on judicial issues like constitutional limits on government and the federal nomination process. You've had briefs filed before the Supreme Court. You testified before Congress. Your group actually took a strong position when Justice Scalia passed away on how to fill that vacant seat. You argued that people should decide -- that the people should decide by how they vote for president in November of 2016. Question, is that a political argument you're making or is it a constitutional argument? Well, our main driver is constitutional. First, that we have a justice who is going to be faithful to the constitution and the laws. Bu t second, that we really need to defend the Senate's right to exercise their advice and consent given to them by the Constitution as they see fit. They don't have to be a rubber -stamp for the Congress. I expect we'll get a chance to talk a little more abou t advice and consent."
against," My good friend and former colleague Eric Posner. Tyrannophobia is the unreasoning fear that the president at any moment will become a dictator. And I wanted to mention to you, John, that I was gratified to see recently that a medical diagnostics website has listed tyrannophob ia as a real condition. Dizziness, nausea, and a propensity for saying that the president has violated constitutional powers."
for,"""The biggest problem s that we're facing right now has to do with our president trying to bring more power into the executive bra nch and not go through Congress at all."" Those aren't my words, though. Those are the words of then- candidate Barack Obama in 2008. He pledged, ""That's what I intend to reverse when I'm President of the United States of America."" Well, has he? My collea gue and I agree that Obama was right, President Bush did, in many ways, usurp the power of Congress as president. Unfortunately, President Obama continued in his footsteps, and his -- their successors show many signs of going in the same direction of tryi ng to aggrandize presidential power. We believe tonight that our position actually the easy one to prove. Perhaps you agree with us that when any branch of the government transgresses the Constitutional bounds set before it, that it puts the foundations of our liberty at risk. But maybe you think Congress has -- already has too much power under the Constitution, and the president actually should have some more flexibility and freedom of action. Maybe you think thatachieving his goals might be worth breaking a few rules now and then. But if you acknowledge that he has taken actions, whether you think they're good or bad, that the institution actually assigns to Congress and not the president, then you must vote ""Yes"" on tonight's propositio n, the president has usurped the powers of Congress. To usurp means to take power that doesn't belong to you. So under the Constitution, what powers do belong to the president? The president has the power to execute the law, but he cannot make law. He can't amend law, and he cannot repeal the law. Only the Congress has power to do that. He cannot spend money without congressional appropriation, and he cannot start a war. That's for Congress. He also can't make major appointments without confirmation by the Senate, and he can't sign a treaty without a two -thirds vote of the Senate. Unfortunately, many presidents have overreached these areas. We certainly don't say President Obama's the first one to do so, and unfortunately, he will not be the last. But because tonight's problem is really referring to the current president, we are going to have to talk about him in some specifics. So we're going to divide up where my -- my friend here, Michael, will focus on the international agreement -- arena. He's going to talk about immigration, national security, war, and treaties. I'll focus on the domestic side, on the president's appointment power, his expenditure of money not appropriated by Congress, and his unilateral rewriting of some laws. I'm going to start with what I think is the most open -and -shut case, and that is an appointment. As I said, high -level appointments need to have confirmation by the Senate. But there is an exception during recesses. The Senate -- the president may mak e recess appointments. But not any old recess will do. Super short recesses like, you know, we're taking a break for lunch, the president can't just throw in a bunch of nominees and call it good. And out of the thousands of recess appointments through the history of this country, none of them has been made in the way that President Obama did. In December 2011, the Senate knew he wanted to push through some controversial nominees that they weren't going to confirm, so they purposely did not go into a big break over Christmas break as they normally do on Decemb er 17th. They said, we're going into sessions every three days purposely and explicitly to block the president's recess appointment power. But the president said, ""It doesn't matter. I'm going to do it anyway."" He tried -- he put four nominees on and s aid he was recess appointing them when the Senate said it wasn't in recess. His excuse was, ""I refuse to take no for an answer."" That's hardly Constitutional reasoning. And unfortunately for him, ""No"" is exactly what the Supreme Court said. They said that unanimously. Every single justice, the conservatives, the liberals, the justices the president himself had put on the court agreed that he had usurped the powers in Congress. I hope you will agree as well. Another example of abuse comes up in the context of the Affordable Care Act, better known as Obamac are. On 43 different occasions now, this administration has rewritten or ignored deadlines, fines, taxes, and other provisions of the statute because the y wanted to ignore or postpone some of the politically painful parts of the law. People like the good stuff, but they don't want to have to pay for it, right? But the only reason the administration has gotten away with this so far because the court says the House of Representatives doesn' t have standing to bring this argument. So basically, they've gotten off on a technicality so far. A final egregious example has to do with this administration's bailout of insurance companies that if you're suffer ing huge losses under Obamac are, and the administration asks Congress for an appropriation to help pay them back for some of the money they've been required by that law to pay out, and Congress explicitly refused to do that. But the administration brazenly decided to spend $7 billion of your taxpayers money on that anyway. When a DC circuit court heard the case, they just recently came down with a decision that said that the administration had blatantly violated the appropriations power. The Constitution could not be clearer on this. No money may be drawn from the treasury. But in consequence, appropriations made by law, period. And it turns out, as the New York Times just uncovered, that the legal team from the IRS had already told the president he didn't have authority to do this. That is brazenly usurping the power of Congress. You're going to hear about a lot of different cases and laws tonight, but don't forget that behind the discussion there is a vital principle, and that's that the structure of our Constitution is what preserves our liberty. It's what gives us a country whe re we have the prosperity, the civil society that our framework intended. That structural Constitution is worth fighting for. If, after listening to our debate, you agree that on any one of these ar eas that Michael and I will talk about tonight, the president has usurped powers that the Constitution gives to Congress, you should vote ""Yes"" on the proposition tonight. "
against," Eric and I, we're here this evening to ask for your vote against the proposition that the president has usurped Congress' Constitutional power. And we're going to talk about a lot of different specific issues over the co urse of the next hour. But in the opening, I'll talk mostly about domestic issues and Eric will talk mostly about foreign affairs issues. I guess I want to start where Carrie left off, with the importance of Constitutional structure because I think there 's a point about which we all agree, certainly everyone on the stage and probably all of you in the audience, which is that the president is in fact a very important policy maker in modern government. That's not really what the question is tonight. The question is how we evaluate the power that the president wields. And that the motion on the table suggests that the president holds the power he holds because he's stolen it, unconstitutionally from Congress, right, in a power grab. A usurper is someone who seizes force, as Carrie noted, illegally, often -- often by force through seizing power. And the question tonight is why the president has the power he possesses. Now, the reality is that the president possesses power today not because he s eized it by force, but instead because over the course of the 20th century, Congress has lawfully delegated to the president power to solve important and complicated social problems. Over the course of the 20th century, people began to demand more from their governments. We went through a nationalization and a globalization of our economy. We went through a Great Depression, a new deal, a couple of world wars, a civil rights revolution, and people demanded that the national government solve more and more complicated problems. Congress quickly realized that it couldn't solve all those problems on its own. It didn't have the capacity or the expertise to decide, say, what the right level of sulphur dioxide emission was for trucks on US highways, or what the right way was to regulate Wall Street derivatives, to make sure that we don't have another financial calamity. And so, in statute after statute, Congress delegated power to the executive branch, to administrative agencies, and to the presiden t, to come up with solutions to these problems. Now, over the course of the 20th century, that did amount to a kind of Constitutional revolution, and it's made the president an important policy maker. And it does mean that the system we have today is really not the system that our foundersimagined, and probably would have been one that they wouldn't have liked. But the system they imagined, the system that worked for our agrarian economy in the 19th century isn't sufficient to tackle the problems we hav e today. Now, let me get me concrete. Let me talk about a couple of issue areas. So one of the most prominent arenas in which the president's been criticized is immigration policy. But the most important fact that I can tell you guys tonight about immigration policy is this: There are 22 million noncitizens who live in the country. 11 million of them are out of status. They're unauthorized. They're not here lawfully. That means half of the legal subjects who are regulated by immigration law are in violation of the law. That means that Congress asked the president essentially to do the impossible. To enforce the law fully, the president would have to deport 11 million people. But this president, President Obama, while he's deported more every year than any preceding president, has still managed to deport just 400,000 each year. That's a large number, but it's only 3 percent of the unauthorized population. That means inevitably the president has to pick and choose, has to decide where e nforcement resources will be prioritized and where they'll be deprioritized. And so the -- the signature immigration initiatives that President Obama announced, the decision not to prioritize the removal of so -called dreamers, right, immigrant s who arrived as children, or the parents of US citizens, that was just a way of bringing transparency and equality to a set of decision that's the president wasn't just empowered to make by Congress but was in fact obligated to make in order to enforce the law. Now, that doesn't mean that presidents have unlimited power because, of course, what Congress gives, Congress can take away. And Congress sets up the framewo rk within which the president must operate. Also it means that inevitably there will be d isagreements about what those framework rules mean. All of us who have kids know that whenever there are rules there are disagreements about what those rules mean. And sometimes the president's interpretation of those rules succeeds in the court. So with the Affordable Care Act, for example, one of the most high profile debates, one of the most high profile debates was about whether tax credits could be given to people who purchased health insurance on the federal exchanges instead of the state exchang es. The law was maybe confused on this point. There was striking disagreement among lawyers. But the Supreme Court sided with the president. But even when the president doesn't win at the court, even those losses, when a judge decides that the administration's interpretation of those rules that Congress sets toguide the president's exercise of power don't permit something that the administration has done, that's not a sign of usurpation, as Carrie suggested, it's actually a sign of legal compliance of courts because it's just more evidence that the president is, in fact, bound by these legal rules that Congress establishes. And for that reason Eric and I urge you to vote against the motion."
for,"Thank you, John. In preparation for this debate, I read Eric Posner's very interesting book on presidential power. And now I've heard Adam Cox. They seem to be coming at us from opposite directions. Adam Cox thinks everything the president has done is totally legal, authorized by broad delegations by Congress. In contrast, Eric Posner thinks that the very idea that the executives should be limited by laws is now, quote, ""obsolete."" In this book he identifies what he calls, ""multiple examples,"" in which the executive I'm quoting now -- the executive proceeded with dubious legal authority or simply ignored the laws and got away with it. In fact, he thinks the executive is now unbound by law. That's the title of his book, ""The Executive Unbound."" Now, Carrie and I agree with Eric Posner that the executive has frequently acted without legal authority. That in itself demands an affirmative vote o n tonight's resolution. The framers of our Constitution knew the dangers of an executive unbound and attempted to protect us, their posterity, through a written constitution limiting that executive's powers. Unfortunately, recent presidents and especially Bush and Obama have systematically breached those limits. Let me get down to some specifics, beginning with immigration. Now, as Adam Cox just explained, President Obama recently issued an order unilaterally giving -- he didn't mention this, though -- giving lawful status to some four million of those aliens who are here in violation of the law. Now, that doesn't mean not deporting them. That isn't just not prioritizing someone else. The actual terms of the order was to give them lawful st atus which includes the right to work, to sign up for Social Security, and to receive numerous other benefits. Now, obviously, Adam thinks this is good public policy. And he may very well be right about that. But it's hard to take seriously the idea tha t this is just routine enforcement discretion. For one thing, President Obama himself said just the opposite repeatedly when advocates were asking him to issue such an order. For example, on March 28, 2011, President Obama said, and I quote, ""With respec t to the notion that I can just suspend deportation through executive order, that's just not the case because there are laws on the books that Congress has passed. For me to simply through executive order ignore those congressional mandates would not conform with my appropriate role as president."" Well, appropriate or not, Obama did it anyway. But here's what's interesting. Even after he signed the order, Obama did not claim he was just exercising discretion under the law or prioritizing. He candidly stated, and again I quote, ""What you're not paying attention to is I just took an action to chang e the law."" Well, if you were paying attention when Carrie listed the various powers of the Constitution vests in Congress and not in the preside nt, that was one of them. He cannot change the law. Only Congress can do that. But what matters about this is that if Obama can change this law, a future president can use so -called enforcement discretion to dispense with laws he or she doesn' t like of any note -- of any sort. Tax laws, or trade laws, or laws about ethics in government. Eric Posner just wrote in the New York Times a few days ago Donald Trump as president could refuse to enforce environmental regulations -- and I'm quoting Eric here – “ just as Mr. Obama refused to enforce immigration laws.  Now, I don't think we have much disagreement up here that Presidents Bush and Obama both have usurped power in the national security arena. I just quote Eric Posner from h is book. I love this book. And Donald Trump will love it even more. It'll be huge. Quote, ""The Obama Administration has followed Bush Administration policies on national security with the single exception of tor ture, including the reliance on broad surveillance powers, detention, military commissions, rendition, and targeted assassinations."" He calls all these policies questionable under the law. Carrie and I agree. So should you.  Under both the Constitution and the War Powers Resolution, Congress -- not the president -- has the responsibility to decide on whether to start a war. But President Obama, on the urging of Secretary of State Hillary Clinton, took us into a war to topple the regime of Libyan dictator Muammar Qaddafi without even attempting to get authorization from Congress. According to the New York Times, June 18th, 2011, quote, ""President Obama rejected the views of the top lawyers at the Pentagon and the Justice Department when he dec ided that he had the legal authority to continue American military participation in the air war in Libya without congressional authorization. What will future presidents do with these expansive powers? Well, we don't know. It really depends on what the people decide, not just in November, but even here tonight. That's why this debate is so important, because the first step is to admit that there is a problem.  Recent presidents have usurped the powers of Congress. If we're not willing to say even that, we deserve what we get."
against,"My book, which Michael just endorsed – -- is actually quite consistent with Adam's opening statement. The book makes the point that Adam made as well, that our system has evolved a great deal. The original separation of powers scheme that Madison and other founders envisioned has changed a great deal. But that is because the world has changed. The United States has changed, and people demand more from the national government than they used to. I want to focus on, as Adam said, international relations. And let me hit a few of the most important issues that the critics of the Obama Administration have raised. So, first, a number of people -- and perhaps Michael -- he didn't explicitly mention this -- argues that the counter -terrorism operations in Afghanistan, Iraq, Syria, and other countries are a violation of the president's constitutional powers, a usurpation of powers of Congress. However, all of these activitie s have authorization. There was, first of all, the authorization for use of military force, which Congress enacted in 2001, immediately after 9/11. This AUMF, as it's called, gave the president very broad authority to engage in counter -terrorism operations against Al -Qaeda, Al- Qaeda affiliates, nations that harbor Al-Qaeda, and related entities. The second AUMF in 2002 authorized the invasion of Iraq. That AUMF continues to be operative, like the first one, and authorizes combat operations in Iraq and in Syria to the extent that there have been spillover. And then finally, and most important, the president has in the constitution two sources of power that are relevant here. The first is the Commander- in-Chief power, and the second is what lawyers called the ""vesting clause,"" under which the executive power is vested in the president. It is widely agreed among lawyers that these two powers give the presi dent the power to use military force abroad in limited ways to protect American interests, to adv ance American security. Presidents throughout history have relied on these -- on this source of power for military operations overseas. Michael did mention the Libya operation in 2011. This operation was not authorized by Congress, as he mentions. In this case, the president relied on his Constitutional powers. And in doing so, he followed in the footsteps of his predecessors. President Clinton, for example, used military force without congressional authorization in 1999 in Serbia. He also did in Sudan and Afghanistan in 1998 and in Bosnia in 1993. President George H.W. Bush used military force without congressional authorization in Somalia in 1991 and in Panama in 1989. For Reagan, it was Libya in 1986, Grenada in 1983, and Lebanon i n 1982. And these are only the most recent examples. Truman, for example, initiated the Korean War without congressional authorization, instead relying on hisConstitutional powers. My next example are the drone operations which Michael alluded to, he didn't refer to specifically. But a number of people have argued that President Obama has exceeded his Constitutional authority by using drones to engage in targeted killings, including of an American citizen, actually a few American citizens, but one in particular, Anwar al- Awlaki who was targeted. But once you grant that the president has military authority as a result of his Constitutional and statutory powers, it follows that he can use drones just the way he can use piloted aircrafts to launch military strikes. The American citizenship of Awlaki is legally relevant. It's often been the case that Americans in prior wars have gone overseas to join enemy forces. And when that happens, they lose the due process protections that one normally enjoys when one is on American soil. A nd then let me finish with two executive agreements that President Obama entered into. These agreements have received a great deal of attention, and again, people have criticized him for violating the Constitution. So the first such agreemen t was in 2015. It was the Iran nuclear deal. And the second agreement was in 2016, and that was the Paris climate agreement. And so what the critics say is that a president can enter into an international agreement only with two -thirds consent of the Se nate because, in the Constitution, there is a clause called ""The treaty clause,"" which says that when the president enters into a treaty he needs the consent of the Senate. However, there's a difference between a treaty and between the type of agreement t hat President Obama entered into. This type of agreement lawyers usually call an executive agreement or a political agreement. Now, in the case of a treaty, normally, a treaty will directly affect the rights and obligations of Americans or lead to direct legal commandment to an entity in the American government requiring it to do one thing or another. But in the case of these agreements, all that President Obama did was agree to use authorities that he had already has as a result of a statute. So in the case of the Iran nuclear agreement, he was required to raise sanctions against Iran under certain conditions. But there are plenty of statutes that allow him to do that, including the comprehensive Iran sanctions accountability investment act o f 2010. And in the case of the Paris climate agreement, what he agreed to do was to reduce greenhouse gas emissions. Well, he has the authority to do that under the Clean Air Act, which, as the Supreme Court has recognized, allows him to issue regulation s related to climate change. And to the extent that he needs additional authority under those agreements, he has to go to Congress as he has recognized. So the president has, in allthese cases, acting with authority that he gets from the Constitution or from Congress, and therefore you should vote against the motion."
for,"What it -- this language was specifically adopted by the framers here in Philadelphia in order to negate the possibility that our executive would do what the Stewart kings had done, which was to make pr oclamations declaring lawful things that parliament had made unlawful. This doesn't mean exercise as a prose cutorial discretion. Everyone has always understood that no law is always enforced against everyone. But it does prevent the presiden t from doing what President Obama did in the immigration context, which is actually declaring that activities of some people are lawful even though Congress made them unlawful. So it's faithful -- faithful execution does not mean a hundred percent execution, but it does mean not declaring things lawful that are unlawful."
