side,script,round
for,"Just got started, but we selected 24 students for the first two-year cohort. And they've been starting over the last month or two, and it's off to a really great start.",nan
for," That is correct. I'm going to start with that fact, actually, but yes, that is very true.  Let me actually just start with that question. You know, I went to Stanford undergrad, Stanford law school. Throughout the '90s, I had a belief that education was absolutely paramount. We should only hire people that went to the best schools. And -- and we discriminated on this basis very aggressively in hiring at PayPal. And I use this -- and I used to -- I thought this was the most important thing in our society. And over the last four or five years, I've gradually come to shift my views on it for a number of different reasons. The narrow technology context in Silicon Valley, that I saw so many very talented people who had not gone through college tracks and who had still done extraordinary well. In some ways, they were also more creative. They were not laden down with enormous college debt that was somehow forcing people to take better paying jobs that were more munitive but more boring, and track them into things that were not as interesting or important, that were discouraging people from doing things in nonprofit work or on the more entrepreneurial side. And this has become a more and more acute issue over the years because unlike the time when I went to college, the cost has gone up tremendously. The amount of debt that people leave college with have gone up tremendously. And so the choices are very different from the ones people had 25 years ago. College costs in nominal dollars have gone up by more than a factor of 10 since 1980. Even after inflation, it's gone up by 300 percent. Costs about four times as much. Inflation adjusted to go to college now as it did 30 years ago, it's gone up more than anything else in our society, more than health care, more than housing, more than any of a number of other things we think of as having been subject to runaway cost inflation and escalation. And as I looked outside of just the narrow Silicon Valley entrepreneurial context I've come to believe that the problem is much broader, it's not just the most talented people who are perhaps being misdirected and encouraged to go on a very narrow tracked career, but that this is a broader problem and that we are in fact experiencing something of a bubble in education, a bubble that is as pernicious as the bubbles we had in technology in the '90s and housing in the 2000s, and like those two other bubbles is characterized by two things, number one, runaway costs where people are paying more and more for something where the quality hasn't gone up -- in the '90s it was tech stocks, in the 2000s it was housing -- education, I'm not saying it's worse than it was 30 years ago but I don't think it's gotten much better, and secondly by an incredible psychosocial dynamic where you cannot question it. And in '99 in Silicon Valley you couldn't question the NASDAQ valuations, and in 2005 you could not question people buying houses, it was strictly taboo and forbidden, and in the same way this is the one thing people still really believe in our society. And to question the value of education is like questioning existence of Santa Claus with three-year-old kids or something like that. And while we're not trying to scare the children here or anything like that, we do think that we cannot afford to have a third bubble in this country. We had two already. They were catastrophically bad. They led to enormous misallocation of resources. And when we look at education more carefully there are a lot of worrisome signs. Student debts at this point total over a trillion dollars, and when you look at how well people are doing who come out of college, they are still doing pretty well, they're still doing better than they used to, but the outperformance has been going down, and going down since about 2000. And, you know, the law school context I'm quite familiar with, there are about 50,000 people a year who graduate from law school in the U.S., there only are 30,000 legal jobs available in the U.S. and I would argue we have maybe too many lawyers as is, but we're producing way more for a society that probably already has too many. The median wage for lawyers is 62,000 which isn't that great considering that you've taken on another quarter million in law school debt typically. Pre-med, only about nine percent of the people who study pre-med have slots available to them in medical school. The other 91 percent are wasting their time, and somebody should have told them that their freshman or sophomore year and not waited till their senior year or several years of post college to figure that sort of stuff out. If you broaden the ambit more generally, there's something like 17 million people in the labor force who have college degrees and are basically doing unskilled work or find the narrow and extreme statistics, there's something like 6,100 people in the U.S. who have Ph.D.s and are doing janitorial work. And so when we say that education is important and paramount, that is true but it can also be a distortion and it can be a distraction from some of the very real problems we have as a society. We need to figure out how do we create more jobs, how do we create more good paying jobs. We don't have enough of either in our society. And while education is linked to them, it's not this absolute thing. And we want to question this notion that education is an absolute good or an absolute necessity. And in fact when people say as our opponents do that it is an absolute good or an absolute necessity, you start ignoring all these problematic facts, you start making a lot of catastrophic approximations that abound. And that's what we want to sort of push back a little bit. Let me say one thing that we're not arguing for. We're not saying that nobody should go to college. We're not saying that college is categorically a bad thing. We're not saying everybody should drop out. We're simply saying that too many people are going to college, just like too many people are buying houses and too many tech companies were going public in the late '90s, doesn't mean there should be no tech companies or no houses, it doesn't mean we should shut down all the colleges, but we shouldn't -- we need to make this a much more careful deliberate choice. And what we are hoping to start with this discussion and debate today is a discussion that would encourage all of you to think more about your future. Do not think of education as something that's an automatic ticket to the future, you need to think about it yourself. If I had to do something over again, having gone to Stanford, I probably would still go to college even with the higher costs, if I didn't have any great ideas of what to do instead I'd probably still do the exact same thing as I did in the late '80s even with all the problems. But one thing I would try to do very differently is not accept the answer that this was the automatic thing, that this was the thing you should do without thinking, I would have tried to think about what I want to do with my life as a senior in high school and a senior in college and not simply have more education be the automatic default answer for everything. The question we want to push the other side back on a little bit is if education is an absolute good or absolute necessity, who is accountable if it is a mistake? And if these people are taking on these enormous debts are getting it wrong, where can they go to get a refund?",1.0
against," Well, thank you all for being here, especially Mayor Emanuel. Thank you for coming. You gave a great speech this morning on the budget. This is an important debate. It’s about the American dream. It’s about social mobility and American democracy. Because the answer to the question as to whether too many kids go to college is fundamentally about what kind of a society we hope to create. I care deeply about this issue. I’m an educator, 28 years at Princeton, 14.5 years as Northwestern’s president, now chair of a proprietary for-profit college, Rasmussen College, and a member of the Board of Education, appointed by the mayor for the Chicago Public School System. Sure, some dropouts make it big. But social and economic policy should be informed by data and analysis, not anecdotal individual life histories, no matter how compelling. Most people are not Bill Gates or Steve Jobs. We should not misread particular circumstances at particular moments in time as an indication of likely long outcomes. As Damon Runyon once said, “The race is not always to the swift nor the battle to the strong, but that’s how the smart money bets.” The argument that too many people are going to college is not new. In his youth, Richard Freeman, a Harvard economist, argued this in “The Overeducated American” in 1976. He was wrong then, and our opponents are wrong now. And by the way, he’s changed his mind. We now have studies and lots of information. Mr. Rosenkranz alluded to some of them, which should persuade anyone with an open mind that more years of school, post-secondary, are positively correlated with earning over one’s lifetime, and also correlated with lower rates of unemployment and shorter duration being unemployed when a higher degree is not obtained. 4.3 percent of college graduates are unemployed. More than triple that number of high school students or high school dropouts are unemployed. This is very compelling. There’s a clear wage premium to education. There’s also a social premium to society, not just individual. Society benefits through greater productivity, lower crime, better health, better citizenship for more educated people. And the wage premium to education has been growing since the 1980s, not shrinking. The question to be decided is whether it’s true that too many kids go to college. Fact: In 2010, about 66 percent of the United States population between 25 and 30 had some college experience. The rest were high school grads or high school dropouts. It’s hardly the case that everyone or too many are pouring into college. We need more, not fewer, college graduates. Going to college in the United States, by the way, means very different things. From two-year community colleges, flagship public research universities, small denominational colleges, elite privates, and for-profits. By the way, at the for-profits, the average age of the students is 28, and these are not kids. Many of them are single mothers. Many are minorities. They don’t choose to attend such a place for a liberal arts education or because we have great athletic teams or a climbing wall. They come to improve their careers, their income, their life chances, and they do. In his articles, Mr. Murray argues that too many people are going to college, and I feel he believes in innate qualities. He uses a language like, “He does not have it in him.” But how does he know this? What measures does he have for a great understanding of cognitive abilities or their impact? He believes, I think, that abilities are fixed. It’s a highly stratified view of the world and people’s places in it, and I don’t share it. True, plenty of people who graduate high school are not college ready. We know this in Chicago. But low college graduation rates and dropout cannot be attributed everywhere and completely to individual's intelligence or competence. Even some qualified students in high school may not attain to a four-year degree within six to eight years because of their lack of resources which compels them to leave and drop out. No doubt, some people don't have the smarts or the personality skills to succeed. But for many, their environment at pre-college school systems have played a big role in not preparing them. We should not be so ready to consign them to what Mr. Murray may feel is their fate. Neither they nor our society will benefit from pushing them into what, for many will be low-level jobs. Because for every college degree holder who is a janitor or a waitress, there are thousands of times janitors and waitresses who are high school dropouts. Mr. Thiel has acknowledged a correlation in his own writings between college attendance and higher income. But he doubts the direction of causation. That is, college may pay off for some people because smarter people go to it. In my view, whatever the direction of causation, you can learn skills at college and improve your life chances. And by the way, we have lots of studies, including studies of twins that Allen Kruger and others have done which shows you can isolate the college experience itself among all the other variables which count. And college does make a difference. Now, high school vocational alternatives are there, but they're not widely regarded as -- they're widely regarded as second best by the general public. Polls show that most Americans agree that everyone does not need to go to college. They support alternatives for other people's children. I wonder if those in favor of the proposition want their own children or relatives to not go to college. Mr. Thiel, Mr. Murray, I know Mr. Thiel has started this fund, and I applaud his generosity. It is very generous. Will he fund tens of thousands, millions? All the trend lines show a shift in the U.S. economy and its labor force towards more people requiring post secondary education because growth industries require post secondary education. We've hollowed out industrial jobs. The clear way to premium for college graduates is growing. It skyrocketed in the 1980s and 1990s. Advanced degree holders did vastly better, and their advantage continues to hold up. And by the way, for women, that wage premium is even higher than for men. I need to conclude, but I want to conclude by saying there are not many alternatives in the U.S. We don't have a vocational system like Switzerland or Germany. I'm not against building such a vocational system. I'd like to see more tracks that people can go to. But what we really need to do is do better in pre-K through 12. We cannot accept that too many kids go to college. In summary, those who go beyond secondary school are -- not all kids. There are not too many of them. I'm not willing to consign them to low-level jobs. We need to do better, and we can't give up on the American dream. ",1.0
for,"That's what I thought at the time. Oh, I now recommend that we abolish the SAT, because it turns out that if they give an achievement test, I probably would have gotten into Harvard that way too. And the SAT, as it now exists, has taken on a really bad number. I think we better get the topic straight. When I agreed to debate on too many kids are going to college, I thought of college as being four-year colleges leading to the BA. I didn't think of it as a whole range of community colleges and the rest. Anyway, that's the way I'm going to argue tonight because if the proposition were that too many kids are trying to get more education and training after high school, I wouldn't have accepted the position on the affirmative. Almost everybody needs more education after high school. What they don't need is to chase after this fraudulent, destructive,antediluvian thing called a BA. The thesis of my argument really is that the BA is the work of the devil. Let's go through each of those accusations. First, fraudulent. The BA is supposed to signify, in a very old-fashioned term, that you are an educated man, now -- an educated person. You know and I know that it doesn't represent that any more. The number of colleges that require the core courses that's go into a liberal education is virtually not -- don't exist. But it's much worse than that. If the only thing you know about a person is that that person has a BA, you don't know anything. If that seems too extreme, I can document all kinds of stories about courses in introductory economics which use magazine articles as the text about students who get a BA after four years without having to write a single solitary term paper, about exam scores which, by any traditional grading system means a D or an F. But guess what? They're transmuted into Bs. And why are they transmuted into Bs? Because the story they want -- have now is retention, whereby the point of a college is to bring in as much tuition money as you can. And you've got to retain kids. And in fact, if they want to drop out of courses and stay for five or six years instead of four, that's just fine with the college. You can talk to employers all over the country who will tell you about applicants who have BAs, who can't write grammatical sentences in their applications and sometimes can't read very well. All of these things do not refer to the products of a few diploma mills. I am talking about large chunks of the second tier and third tier state college and university systems. And I'm also talking about large numbers of courses and students in the first tier system and a whole lot of very expensive elite colleges. Knowing what major a person had doesn't tell you very much. Yeah, if it's math, if it's hard sciences, if it's engineering, okay. But what does it mean if you have a political science degree, spoken by a person who has a political science degree, if you're going to an employer and saying you ought to hire me. It doesn't really mean anything. Now, here is what you do know about a person with a BA if you know what school they came from. So if the applicant came from Harvard, you know a whole lot about what person was like at age 18 before he went to college. You know he had terrific SAT scores, and you know he had a terrific high school record or he wouldn't have gotten in. You don't know anything about what Harvard has added.And as a graduate of that institution, trust me, I am living proof of that statement in a whole bunch of ways. None of this should be news to any of you. The retreat of the academy from rigorous education is known to everybody who's in higher education. Except for majors in engineering and math and the hard sciences which account for just 12 percent of undergraduates, the bachelor's degree, all by itself, is meaningless. Okay, destructive. Even though we know that the BA is substantively meaningless, it remains true that for millions of jobs you can't get a job interview unless you have one. And the problem is that employers are behaving rationally when they do that because you've got about 32 percent of adults that have a BA. The employers know how clueless many of them are. Why should they go outside that pool and take even lower levels of population in terms of their ability. So they're being rational. But the problem is this: We have created a kind of self-fulfilling prophecy. We have created a culture in which not having a BA labels you, in the minds of way too many people, as being either dumb or lazy. And so a lot of ambitious kids who have no interest in sitting in classrooms for four years and accumulating these large student loan debts, nonetheless want the piece of paper. It is not surprising that we have all the horror stories which are documented in journal articles and large surveys, not anecdotally, of kids who take the easiest possible classes and don't study. They aren't there to get an education. They're there to get a piece of paper. It is hugely destructive to have created this kind of false credential. It is destructive to the majority of young people who don't try to go to college because they know college is not for them. It is destructive for about 40 percent of those who start college who never finish. But most of all it is destructive to America's civic culture. We have always prided ourselves upon the idea that everybody is equal in all the ways that count with regard to human dignity. We have given a meaningless educational credential a role in our culture that says otherwise.  I have time just to state the proposition and hope to have a chance to elaborate later, the four-year brick and mortar college is obsolete. Four years is almost always too long. There's hardly any profession that requires four years of class work. A lot of them require an apprenticeship much longer than that. The rationale for a big physical plant at a residential college is just vanishing. What's the rationale for having a library these days? It used to be central. Why should it be that the brilliant professor giving a lecture where he doesn't take any individual relationships with students but just giving a superb lecture, why is he giving that lecture to 150 kids who happen to be sitting in the hall, why isn't it being given tomillions? Distance education has all sorts of possibilities it didn't have before. The information revolution is giving us a cornucopia of new ways to help kids get an education. Well, that just begins to say what I want to say but what I'm really coming down to is nobody should go to college as the system is now defined. What we need is a transformation that gives young people a chance to tell employers or for that matter to tell graduate admissions officers what they know and what they can do, not where they learned it and how long it took them. ",1.0
