side,script,round
for,"Thank you so much. I'm a licensed boxing judge. I've judged 12 world title fights across the globe. I've even judged the world heavyweight championship WBC champion Deonte Wilder against Chris Areola July 2016. But this is even a greater fight. It's the fight for free speech in a free society. The arguments made about the civil rights movement, do you know what John Lewis said about the civil rights movement without the first amendment? ""It would be a bird without wings."" The first amendment was absolutely essential to the civil rights movement of the 1950s and 1960s. It was the precedent of Terminelo versus City of Chicago that protected the rights of an anti-Semitic speaker that protected the rights of civil rights activist Fred Shuttlesworth . We must protect free speech. Where else can speech thrive except at a college and university campus? What's the primary reason that people go to a college or university campus? They go to learn. They go for intellectual development. They go to confront new ideas. They go to develop the fully functioning human being. The first amendment provides that, a higher purpose of the first amendment is the right to individual self-fulfillment, the right to freedom of expression, the right to viewpoints. I close with the words of John Milton and Ariel Pogetika . ""With all the winds of doctrine are let loose to play upon the earth so truth be in the field. We do by injuriously licensing and prohibiting to misdoubt her strength. Let her and falsehood grapple. Whoever knew truth put to the worse in a free and open encounter. Keep colleges free and open. Keep them open to ideas. Colleges are not kindergarten."" Thank you.",3.0
against,"It's a pleasure to hear these great defenses of the first amendment. I think we have wonderful advocates for free speech. Remember, Milton said -- his call for free speech is only for Protestants. Catholics, he said, ""Then we extirpate."" So, everybody has their limit of what they -- everyone has their limit of who they will protect. And at colleges and universities today, it is very much the case that there is a strong bias -- sometimes on the faculty, often on the faculty, often on the students -- towards the left. This is not new. This is perhaps something to do with the age of students, but something to do with the politics of our country right now -- our country by which I mean, sorry my Canadian friends, the United States. I have started a program at Wesleyan University to bring more conservative thinkers to campus, more conservative professors. Army generals or colonels who are retiring from the armed forces to teach courses in international relations and political science, because I think our conservative students need to feel they too can express their views. And I'll close with a story not from the annals of the law books, but from a student of mine who came to talk to me this year. And she said, as a religious student, she did not feel that she could go to class and be taken seriously. She felt that when she went to her English professor's class and she said, ""I am a believer -- I am a student of faith,"" the professor thought, ""Well, you're an absolutist. You can't take ideas seriously."" She wasn't saying -- the student wasn't saying that. The student was saying, ""I could take a discussion of religion seriously, but don't dismiss me because I'm a Christian. Don't dismiss me because of who I am."" She has no problem with the rough and tumble of intellectual debate. She has a problem with prejudice that retaliates against who you are and punishes you for what you believe. We need spaces for those students so they can recharge and be ready for the next debate. Thank you. I think it is happening. I think the MeToo movement is a good indication of that. I mean, that's -- a lot of sexual harassment is verbal, right? I feel like it's the workplace needs to change. If anything, we've learned in the last that's evident.",3.0
for,"That's a good point. I mean, there needs to be some change. You know, the one thing we went back to there was a -- we're going back and forth about harassment. Well, and I did agree with something they said about the requirement to show -- to prove harassment you have to show that the harassment is severe and pervasive. And I sometimes go back in my mind I think it's okay to have the severe and pervasive requirement but perhaps recognize that sometimes there can be a single actor too that's egregious enough that would constitute severe and pervasive harassment. I mean, that's a very difficult issue. It's a very difficult thing to prove.",3.0
against,"It's not -- not only about the specific incident, right, it creates everybody in the room will know about it. People in the department know about it and it creates -- it pollutes the marketplace. It's like having somebody who comes to the marketplace and is an egregious polluter and that's something you need to protect against.",3.0
for,"Yeah. I mean, well, first of all, I mean, the work setting already is much more stringently regulated when it comes to speech under the equal employment opportunity act and other laws. Yeah, you can't put sort of like a swimsuit calendar or something, you know, in your office whereas on campus you could and, you know, I think that's probably the right thing. We want more freedom on campus. The campus has a particular role, you know, in our society that the workplace doesn't, so I think that's probably appropriate. I mean, one thing that worries me is there is this pattern of private actors, you know, increasingly punishing people for speech. You know, losing his show on CNN, because you know, he had a Tweet, you know, that they didn't like politically. You know, and a number of other examples. ESPN anchor, and so I think, you know, there's part of it that's good which is greater awareness of conduct that can make the workplace, you know, uncomfortable for others. I think the conscientious of that is a terrific thing, but I think there is a risk, you know, that we are in some instances going too far in terms of constraining speech. And the real risk I think, too, is the people losing jobs for social media posts. Some of those social media posts have nothing actually to do with their day-to-day work and so to me that is a troubling trend. That actually would be a great intelligence debate if they haven't had one.",3.0
