side,script
for,Hi John. I think the Affordable Care Act wasn't just about health insurance. It was a really important step in a large fraction of the U.S. economy which will be felt in years and decades to come.
against,"Well, nothing quite as dramatic as finding Pyongyang on a map. But I'd say probably make American real estate great again. Exactly. And create lots of jobs for Trump supporters."
for,"I think that the main fallacy of Donald Trump in terms of the coverage -- and I think a lot of public perception about Trump -- is my advice is, look what he does and don't listen to what he says because I think his actions speak louder than words. I'm one of these people who would love to take his thumbs away, so he couldn't tweet so much. But, look, I mean, his actions I think were -- are important and not his words."
against,"So, my book offers 10 radical reforms. That’s 10 radical reforms to meaningfully change democracy, liberal democracy, so that we can actually generate sustainable long-term economic growth in a more equitable fashion."
for,"Because, John, great civilizations have been brought down by issuing too much debt in an incautious manner. Let’s not do that. No. John, I think that the way to think about this tax cut -- I think the word “reform” is somewhat overused in this context -- this tax cut is focused on old capital. There’s two kinds of capital in this economy. There’s new capital; there’s new investment. That’s what builds companies; that’s what builds jobs. I’m a professor of entrepreneurship at MIT. That’s -- I work with entrepreneurs all the time. They’re unimpressed by this tax cut. Gary Cohn, who’s a senior economic adviser to Donald Trump, spoke to a group recently, a group like this, and asked them how many -- actually, a group -- this kind of numbers -- a group of CEOs -- asked them how many of them are going to increase their investment and create new jobs as a result of the tax cut. Very few of them raised their hand, and he was shocked. But the reason is that this GOP/Republican tax cut is focused on old capital. If you own a building -- for example, a large building with a lot of apartments in New York City, should you be so lucky, then you’re going to do very well from this tax cut. That’s old capital. That’s capital that’s already in place. The new capital, the capital that builds companies, the capital -- the support that we get for research and development -- that is not going up. I think that’s going to get actually squeezed when you take the entire tax picture. And when you consider, John, all of the issues here, including the distributional impact, including the incentives to ordinary working people to go to college, to get more education, to invest in themselves in order to participate with new capital as partners in economic growth, this tax reform at best is a zero. I think it could be somewhat negative. If you own a building around the corner or down by Central Park, congratulations. John, I declare no. Let me get out of the way. This tax cut’s going to shovel $200 billion into the economy this year. That will help the economy this year by a small amount and a transitory amount. What it won't do is improve our outlook for long-run growth. Simon got to the very core reason for that. It's a windfall for investments people have already made. It's not very much of an incentive for new investments. The United States already had a very high corporate tax rate, but also had a lot of loopholes, and that meant that the effective corporate tax rate wasn't actually very high. In fact, under this bill the tax rate on research and development will go up, and so we're going to have less innovation and less research. In addition to that, this tax bill will balloon the deficit. The deficit next year will be more than a trillion dollars. It will stay more than a trillion dollars going forward. We've had large deficits before when fighting wars, in very deep recessions. We have never, ever had a deficit anything like this as a share of the economy in peacetime. So whatever benefits you get from the rate reductions will be more than outweighed by the deficit reduction. The last thing I'd say is this isn't just my judgment. This is the judgment of the FOMC, which hasn't changed its long-run outlook. None of the major investment banks have. A survey of 42 economists -- zero of them said it would have a large impact on long-run growth, because they all understood it's a benefit for old capital that will swell the deficit and cost us in terms of research."
against,"Well, I'm going to declare yes, partly because I want to make this debate a bit more interesting, but also because -- But also because I'd like to shift the perspective. As it happens, if you look at the long run I share many of the concerns that Jason and Simon have raised. I think many aspects of the tax bill are not desirable. It is indeed very slanted towards, as Simon says, making American real estate great again, particularly in New York. However, I would also like to say that in the short term there are benefits coming down this year. I do think it has helped to ignite animal spirits . And as someone who did indeed train as a cultural anthropologist, not an economist, as somebody who’s in the information game and spends a lot of time as a journalist overseeing a newspaper, looking at sentiment, I actually think that sentiment matters a lot. This has helped to ignite animal spirits. It has also helped to create a sense of optimism, and there's also a sense of narrative around what's going on with the economy. There hasn't been a sense of clear-cut narrative for a long time. So, for all those reasons I do actually think that, in the short to medium term, it's already delivering a boost. However, I do share the concerns that they have echoed about the long term. So, that's a kind of qualified yes, at least to inject a bit more debate and dynamism into this debate, and I'm sure the next speaker will have a thorough yes."
for,"I'm going to say no. No, I'm only kidding! I’m only kidding! I helped write the bill, so of course I’m a yes. Look, I think that giant sucking sound you're hearing is the United States is sucking capital from the rest of the world. I agree with these two gentlemen that capital is the name of the game. Whoever has the most capital wins. We have made dramatic improvements in our global competitive situation. When we started writing this bill two years ago the whole idea was, how do we make American businesses more competitive? I do believe that our highest-in-the-world corporate tax rate was one of the dumbest things in the world. It was a head-start program for all the countries that we compete with. We've fixed that big time. We've gone from the highest statutory tax rate in the world to below the average. That's going to bring a lot of jobs and factories back to the United States. We did the repatriation, so countries can bring -- companies can bring -- we don't know how much, $1 or $2 trillion dollars back to the United States. That's a huge benefit in terms of money being invested here in America rather than being in invested in India or China or Mexico or other countries. The -- we also reduced the small business tax rate, so right now, as of -- prior to January 1st, the highest tax rate on small businesses was 40 percent. It's now down to 30 percent. There's an old saying: “When you tax something you get less of it; when you tax something less you get more of it.” We're going to see a lot more jobs, we're going to see a lot more investment, and I think that confidence that you talked about, which I agree with -- that optimism is in no small part a result of this tax bill."
against,"I'm going to go with no. The -- of course, one of the problems with being the last speaker is that a lot of the comments have been made. But perhaps let me just underscore what I think is a lot of smoke and mirrors with short-term focus, which is driven, really, by a political cycle that actually rewards and encourages people to focus on the short term. If you focus on the short-term, as a household or as a corporate, you are missing the broader point. The future generations are going to grap -- are grappling or will grapple with a tremendous suite of challenges many of them we’re fully aware of. What I'd like to do very quickly is just list for you -- and I'm sure a little bit later I'll be able to go in great detail -- of some of the challenges that we're facing today. Technology and the jobless underclass. The risks of income inequality widening. The fact that demographics are growing at rapid clip around the world. We have 8 billion people -- it will be 11 billion people by 2100 -- and we don't know how to manage that population. Issues around natural resource scarcity, concerns around debt -- which were alluded to earlier. It's burdensome and it's not helping us in long-term, in terms of how we generate long-term economic growth. And then finally, the fact that productivity has declined in many of the most developed countries around the world. It's these suites of -- this suite of problems that are continuing to be a drag on long-term economic growth. And if you believe that a short-term tax is going to actually solve these problems or, actually meaningfully turn things around, you're sadly mistaken."
for,"Certainly. Sure. So, I'm of the view -- and I don't know if Donald Trump agrees with this -- but that growth is everything, that growth solves all the problems -- and the very problems that you're talking about. It may not solve every problem you're talking about, but if you have faster economic growth and prosperity, it makes all these problems easier to solve. And the deficit is, you know, Exhibit A is on this. The forecast, when Donald Trump entered office, was we continue to have weak economic growth, as we did for the last 10 years. It was 1.8 percent growth forecast. We went to Donald Trump and said, ""Donald, if we get 1.8 percent growth for the next 10 or 20 years, we're screwed."" And we have -- we can't -- we're America. We can't live with 1.8 percent. We got to get it up to 3, to 4 percent. I believe we're going to do that with this bill. I think we can get -- we already have had 3 percent growth. And the debt, as a share of our economy, does not go up every year. It goes down every year if we can get to 3, to 3.5 percent growth. And that's -- that would be my kind of response to this issue of -- that you both raised about debt. Sure. First of all, we have to understand the sources of our growth. The primary source of our slower growth than we had in the past is demography. In the 1980s, the baby boom generation was going through their prime working years. Starting in 2008, the first baby boomers turned 62 and started to retire, as they became eligible for Social Security. If we were able to reproduce the same exact productivity growth that we had under President Reagan, under today's demography, we would have a 1.7 percent growth rate. Thinking you can have a 3 or 4 percent growth rate is a ludicrous fantasy. If a company did that, it would go bankrupt and out of business. The United States is big, strong, able to borrow quite a lot. But I wouldn't want to test the proposition of what it would be like . The second thing I'd say is to say that this tax cut pays for itself is to make a statement that has zero support in the economics profession. It's akin to saying -- -- the earth is flat."
against,"No. I was going to say one thing about the other way to get around big rapid growth is to have lots of migration. If you don't have lots of babies -- -- you need lots of migration. And that policy's not exactly on the table right now. Especially if you come from “s-hole” countries like I do. Oh, I'm sorry. I meant house. Exactly. I had one point to make about the debt, which is, the other aspect about debt that people just are not talking about at the moment is that the only reason why debt has been moderately manageable recently is because interest rates have been incredibly low. If you believe that there is going to be growth of the sort that you are arguing there is going to be, then interest rates will almost certainly go up. And if interest rates go up, if they go from 1.8 percent to 3 percent, say, you're basically looking at a doubling of the annual cost of the servicing that debt. Anyone in the room has got credit card debt or mortgages knows how it works. And so, there's a fundamental intellectual conviction. If you think that there's going to be great growth, rates go up, and then the cost of serving that debt gets harder and harder."
for,"So just to develop that point. Animal spirits, Gillian rightly emphasizes, come in two forms. One is, let's invest -- and we may see that in stock prices. There's also animal spirits in the bond market. So, what does the bond market say? The bond market is worried about inflation for exactly these reasons. When the bond market worries about inflation, interest rates go up, and that's pressure on Steve -- I hope you're right, Stephen, because then we're all going to live better. But I fear you're up against the same economic realities, the same constraints as we've all been up against. And by the way, the Obama administration broke 3 percent -- in fact, broke 4 percent growth for at least two quarters I think in 2014. Quarterly growth tells you nothing. The long-run growth, that's what we're talking about, is exactly as Jason said, is driven by demographics. And the budget's going to matter. The debt is eventually going to catch up with us ."
against,"Not at all. And I think just picking up on the demographic point, just to underscore how difficult and how challenging this is in the U.S. context, we need to think about not just the quantity of people in the work force, but also the quality of the people in the work force. You don't have to believe me. Go and look at the OECD PISA statistics. This is a survey that the OECD, which is a club of wealthy advanced countries around the world, that basically looks at how these countries are forecasted to grow over long periods of time. They have an annual survey, the PISA survey, that looks at how people, young people, perform in mathematics, in science, and in reading. The United States, 10 years ago, was in the top three. Today, it's ranked in nearly number 30 around the world. This is not an investment -- this has not been an investment particularly in minority groups who will be the majority in this country by 2050 by some estimates. And you cannot have a country long term that is expected to be successful just because you have the short-term tax cut. When you have underinvested in a population that, if you expect is going to contribute to long-term economic growth."
for,"Well, which challenge are you talking about, I mean, in particular? That the -- I am of the belief that we are at the beginning of a productivity revolution, you know, that we could see the greatest period of, you know, productivity in history. I mean, we're seeing it in automation, we're seeing it in robotics. And that is part of the -- I think the explanation about how you get to higher growth. I think you're going to see, you know, dramatic rates of increase in productivity. Productivity is related to capital investment. Now, of course, we need more human capital investment no question about it. And the other point I would make -- and this is where I, you know, probably disagree with Donald Trump -- we -- look, we can have an increase in our labor force. There's 7 million Americans who would be and should be working but aren't working because we've seen the decline in our labor force participation. We've got to find ways to drive those people back into the workforce. But also, I mean, you hinted at this. We have an opportunity now to attract the best and the brightest and the smartest people from all over the world to the United States. Donald Trump, I think, quite correctly, wants to move us towards a merit-based immigration system where we can get, you know, the people who have the highest skills, highest talents, the people who have excellence in whatever area it is. That gives us a great advantage to achieve this high rate of growth. I mean, first of all, I think it -- On Dambisa's point. I mean, how you're going to address an issue like preschool, where the United States is 22nd out of those OECD-rich countries behind some less than rich -- fully rich countries like Mexico and Chile that have gotten into the club without having adequate resources. It's not something we can do. I want to get back to the animal spirits question, because that's going to come up in the session; I’ll bet the next one as well. Animal spirits -- first of all, they're not self-sustaining. They can help you for a bit, but then, if they're not justified by real activity, they can send you crashing back down. They’re a little bit dangerous. Second of all, I'm not so sure how much of them we do have in the United States. John, I don't know what you invest in; maybe you invested in U.S. equities over the last year. If you did, you did pretty well in the U.S. stock market. You would have done even better in the U.K. stock market, the German stock market, the French stock market, the Canadian stock market, the Japanese stock market. U.S. growth this year came in faster than anyone expected, which is a great thing. Came in four tenths higher than what the IMF was projecting. Germany, France, the U.K., Canada, Japan -- they all came in six tenths, eight tenths, 1.1 higher. So, you’ve seen a lot more animal spirits in the global economy. To say it's all due to a tax cut here in the United States I think is ."
against,"I just want to come back to this issue of animal spirits again, because I have enormous -- It basically means how you feel. If you get excited, you want to rush out and buy a new car, a new Jacuzzi, whatever else, start investing, that kind of stuff. And I have great respect for economists and their wonderful models and all their numbers and all their data, but at the end of the day, most of us live economics through not just our wallets but through stories. And I strongly believe that one reason why the Democrats lost the last election was they had no clear-cut story. Trump, for better or worse, had a story that he could tweet out, if you like. And I do think when I talk to business leaders today that what is going on in their minds is a story about American growth coming back on to the radar screen. When I talk to, you know, households, when I talk to people, you know, who are not grown-up economists sitting in debates like this, there's a sense of, actually, the story is changing. And you might disagree with that; you might say the data doesn't back that up; you might say they're going to be disappointed. But right now, if you look not just the stock market, if you look at polls of consumer confidence and corporate confidence, it has risen dramatically, and that is a story that really matters."
for,"Well, I'm an emphatic yes. I think that when you ask the question, why did we hit this inflection point -- and I don't think there's any question as we look back. There was an inflection point in the economy, and it was November 7, 2016. And you saw what happened to the stock market; the stock market rose 700 points the day after the election. And the -- and it's, you know, been on a boom ever since. We’ve ratcheted up growth from 2 to 3 percent. I think we can get 4 percent this year. And that didn't happen by accident. I think it happened because of -- partly because of the anticipation of this tax cut. But I think an even bigger factor was that, as my buddy Larry Kudlow likes to say, on November 7th, 2016, the war against business was over in Washington. And that is -- a good example of that is what Trump has done with regulations. And it isn't even so much the pullback of regulations -- because there haven't been -- that many regulations have been pulled back, but some important ones. It's more that Trump has just slammed the brakes on the regulatory process in a very, very efficient and productive way. And that has, I think, unleashed a lot of activity by businesses in terms of their capital spending, in terms of their hiring, and so on. Look, regulation can strangle businesses, and it was excessive under Obama. This is a president who is -- if you ask me one, you know, one word about Donald Trump, he is pro-business. He is pro-American business. He wants to make us number one. Pulling back on those regulations will be another factor that has a very positive impact on our future growth in this country."
against,"I declare yes, but not emphatically. And this is going back to what we talked about a moment ago. This is, to me, once again, smoke and mirrors. We were promised a group of policy changes which actually swept Donald Trump into the presidency. We were promised infrastructure reform. We were promised tax reform, including repatriation by corporates at a discounted rate. We were promised healthcare reform. And on the back of that, we have basically seen the market decide that the promises of deregulation were going to be so aggressive that they were going to support, at least in the short-term, economic growth. The truth of the matter is, as I mentioned earlier, these are Band-Aid solutions. We have not yet heard much in terms of infrastructure. And just to put a finer point on it, Japan -- just to remind you, the -- candidate Trump promised aiming for a trillion dollars of spend. The Congress -- well, certainly the Republicans were saying that they only wanted 600 billion. I just want to remind you that Japan had multiples of that, in terms of infrastructure spend, and it did not translate into economic growth. We have not even yet heard anything about that infrastructure promise. Today, a lot of people are hanging around, saying monetary policy is loose. We're still seeing lots of promises in terms of fiscal policy and the path of deregulation. And that, to me, is not founded on a solid ground. I believe that the deregulation is the promise; it's not yet actually happened. And therefore, I believe that deregulation will be ultimately the downfall of this economy."
