side,script,round
against,"   Good evening.  I’m glad to be in, uh, beautiful New York City once again. I wanted to, uh, first of all, thank everybody here and, and for the invitation to share a few moments with you. It’s important that we discuss in a civil manner and, uh, that we talk about the truth about this immigration situation. And I want to find out in the audience, uh, how many Native Americans are here? How many hundred percent Native Americans that are indigenous, that could trace their roots to the tribes that were here thousands of years ago? You know, maybe I might be the only one but I’ve gotta admit, only my dad’s side of the family -- eight thousand years. And on my mom’s side of the family I can only go back to the 1600s. And so it’s just to kind of say that even though this is a great country and I love the United States – I’m a U.S. citizen. I was born and raised in San Diego – my family came from Mexico and it came like most Mexican families. It came legally. And it came, like most immigrants come to this country, looking for a better opportunity. And it was driven by economics. My dad’s job had an opportunity in San Diego and, and we moved to San Diego. And I was born in San Diego. It’s very important that we look back on the history of this great country. And I don’t think that we’ve had a lot of welcoming, uh, to immigrants, especially if you look at it from the Native American point of view or the people of color point of view. I don’t see very much diversity but we’re all the same race – the human race. And I think it’s important that we treat each other in such a manner. And Cesar Chavez was mentioned a, a moment ago. They’re one of our biggest supporters, the United Farm Workers. And I ask you in your prayers to pray for Elena Chavez who was diagnosed with colon can…cancer just a couple of days ago – Cesar Chavez’s wife. And, uh, they’re, they’re big supporters of our movement and they’ve helped us in, in the efforts that we’re continuing, to have more humane laws. Ethel Kennedy, uh, Robert Kennedy’s wife, is really the one that inspired me to come out of the shadows when we started our work as, as Border Angels back in 1986. And you’ll see some information on some flyers I have in the back for our all-volunteer organization. What we’re best known for is putting water in the desert – putting water in the desert to save people’s lives. But that’s not the only thing we do. We also were instrumental in the massive demonstrations last year which had three and a half million people take to the streets and say, We want humane and comprehensive immigration reform. We don’t want to have any more deaths on the border. We don’t want to have this hate radio and hate television that many of you are familiar with, that’s really sprung up in the last several years. Border Angels is a non-partisan faith based organization and our mar…what our mission statement says, ""If I was hungry did you give me to eat, if I was thirsty did you give me to drink?""  In October of 1994 the United States government decided to build a wall between the United States and Mexico. We protested against this wall. What the government said it’s gonna stop the flow of migrants. And I said, Why would it stop the flow of migrants? The United States invaded Mexico in 1846, took half its territory and there was a treaty that was signed – the Treaty of Guadalupe de Hidalgo – where people were supposed to be able to go back and forth, freely. That was never honored. But there’s nobody alive today that was there when the United States invaded Mexico in 1846. What country has not committed sins? Every country. Every country has racist, every country has people that misinform the public. So let’s stick to the facts. And I want to tell you a couple of stories. In October of 1994 the government put up this wall, called Operation Gatekeeper. And it’s been estimated by the flyer that I have in the back that four thousand five hundred people have died in the last thirteen years. And that’s an estimate, according to the Border Patrol. But I think the number is closer to ten thousand people. It, whether it’s four thousand, five hundred or ten thousand, people should not be dying because they’re coming here for a better opportunity.  She crossed with two of her children, Jesus and Nora. Jesus, a fifteen year old little boy and Nora, a seven year old little girl. She crossed from Sonora to Arizona. And she crossed the only way she could because poor people cannot get Visas. So when people tell you, Why don’t they just get in line? – What line? There is no line. So she crossed. She crossed with an unethical smuggler, like many of them are – and we’re opposed to that, of course – and a group of migrants. And what happened was, they ran out of water. The smugglers said, ""You’re slowing us down. You gotta cross on your own…"" They left, she left her behind with two of her children. She literally died in the arms of Jesus, her fifteen year old son. And her sister, his sister Nora was watching this. Two children in the middle of the desert were wandering around with their dead mother there. Thank God the border patrol found them and sent them back to Mexico. Their grandfather, Cesario, who is from Zacatecas, says, I don’t want to leave my daughter out there. So he went out looking for his daughter. He found one body, another body, another body before he found the body of his daughter. So if Cesario can find three other bodies, how many bodies are out there? We think it’s approximately ten thousand people that have died. Not only men, but also children. Marco Antonio Viasenor – he died. He was a five year old little boy. And when he ran out of water he asked his dad for water. But his dad didn’t answer him. So he asked seventeen other men. They didn’t answer him. Cause all eighteen men had died, including Marco Antonio Viasenor, in the back in the back of a semi-truck in Victoria, Texas. This is the real story of what’s happening right now. It’s inhumane and we can do better than that as a people. We are a great people and we are a great nation. There’s a lot of myths and mis…misinformation that’s out there. And we’ve heard some hateful terms, even in the discussion today -- sucking in, homegirl. This type of terminology to dehumanize people is unacceptable. Jose Luis Cisneros was attacked by three American kids – a hate crime, which is at an all time high right now in the United States. We see the vigilante groups, like the Minute Men, which President Bush has called vigilante, uh, hate groups. Today is like yesterday. Second and third generation immigrants and half of them are not from Mexico. It was referred to Mexican immigrants. Half of the undocumented people are not from Mexico. They come from other parts of the world for economic opportunity. They assimilate. They learn the language, just like your, like you did in, in the, in the many years that you’ve been here. There was a man that said, They’re not learning the language, they’re not assimilating. They want to just practice their own culture. We gotta stop them. ",
against,"…of the world’s population, uh, uh, environmental damage is caused by American companies. We could do better than that. Crime, the Department of Justice issued a study in which undocumented people are less prone to commit crime and less violent. Criminals are lazy people. Why are they going to cross a border to commit crime? It’s legal versus illegal. If we use that premise all the time we would still have slavery, women could not vote, we’d still have children working in factories. We need to build bridges of communication and triple fences of su…se…of separation. What good is it if we gain the whole world but lose our souls? There’s three and a half million people that have marched for immigration reform. Your grandchildren are going to ask you one day, What did you do when they were raiding families at three in the morning, when, when two people were dying every day crossing the border? The whole world is watching. Do the right thing. We need humane and comprehensive immigration reform. We’re a better country than that. We’re a better people than that. And it’s important that we practice what we preach. We should love our neighbor. And we were, when we were told to love our neighbor I’m sure it didn’t mean to kill ‘em. Thank you all and God bless you.",
for,"Apparently I’m here to argue that we should not love our neighbor. But that won’t be the substance of my talk. Uh, the other side is claiming that, uh, the flow of people into the United States is inevitable, that it’s like the tides or continental drift and that we need to lie back and pretend to enjoy it. The fact, though, is that there’s nothing inevitable about, uh, the flow of people from abroad. It’s an artifact of government policy. The analogy they often use is to the fifty-five mile an hour speed limit on an interstate and that it’s unnatural and therefore it has, that’s why people are violating the, uh, speed limit. The fact, though, is that an interstate highway is engineered for a particular speed. It’s designed for seventy mile an hour traffic -- the, uh, angles, the sightlines, the width of the shoulders. No economy, our economy is not engineered for any particular level of immigration. It can adapt to high levels of immigration, even higher than we have now. It can adapt to dramatically lower levels of immigration. The question is, what are the side effects, what are the consequences, what level of immigration do we want? Through our elected representatives we’ve made a decision – incoherent sometimes as it is – about what our legal immigration policy should be. Given what our legal immigration policy is it needs to be enforced, whatever it happens to be. If it’s changed, if the numbers are increased, decreased, what have you, the, the law needs to be enforced if it’s to mean anything. And there’s two ways you enforce immigration law. One is the conventional method of arresting and detaining and deporting people. We do that. We don’t really frankly do as much of that as, uh, you might think, but we do some of that and we need to do more of it. But at least as important, if not more important, is the other element of enforcement of any laws -- but specifically in immigration laws -- is to deter lawbreaking, to dissuade those abroad from sneaking in or overstaying their Visas and to encourage, especially the more recent illegal immigrants, to leave and go home. Um, and the welcome that we have, in fact, extended and been extending to illegal immigrants for many years now, uh, it subverts that second element of law enforcement. So what that means is we have two choices -- either focus even more on rounding up, arresting, detaining and deporting people, leaving that as our sole approach to enforce immigration law – or just give up enforcing immigration law and have de facto open borders – which, despite all the disclaimers, is what the other side wants. Now, um, just enforcing immigration law in the conventional way – border patrol agents, uh, immi…uh, immigration agents inside the country raiding work places and homes – relying only on that kind of enforcement can’t work. Uh, we haven’t actually done all that much of it, uh, but however much we increase it, it can’t be the sole basis of our immigration enforcement approach. We need to have, uh, deterrence and what you might call encouraging voluntary compliance. After all, the IRS doesn’t arrest everybody. It doesn’t, it isn’t in everybody’s, uh, accountant’s office, making sure the rule, the, the forms are filled out properly. Uh, a few people are made examples of, and everyone else - most everyone else, uh, in our country remarkably compared to most places - complies with the law more or less, voluntarily. And so, what is it that we are doing? What is this “welcome” that we are talking about? What does it consist of? What are we doing to essentially subvert enforcement of our own immigration laws? Some of these things you have already, um, you are familiar with, of course. Uh, Mr. Rosenkranz referred to, uh, Governor Spitzer’s rule on driver’s licenses. Uh, the driver’s license is, in fact, our national ID system. And anything that makes it easy for illegal immigrants to get licenses, means it makes it easy for them to live here and to embed themselves in our society.  In 19… It was only in 1986 that the employment of illegal immigrants was prohibited by law. Before that, it was explicitly permitted in something called, not coincidentally, the Texas Proviso, where employers were held, uh, unaccountable for employing illegal immigrants. We did change it in 1986. But contrary to Dan’s claims, we have done nothing to enforce it in the past 20 years.   We have gone through sort of, uh, cabooky efforts at finding a few people, as Heather mentioned. Uh, in 2003 was the low point of enforcement. And three employers, in the entire United States, were fined for knowing employment of illegal immigrants. We don’t even do basic things like tell employers, that they have submitted a fake or stolen Social Security number, uh, from an illegal immigrant employer…uh, employee. And that matters, because the majority of illegal immigrants work on the books. They actually gave their employers a fake or a stolen Social Security number. We don’t even tell employers and hold them accountable for making sure that that information is correct. Another example of the “welcome” we extend immigrants is, uh, bank accounts. The Treasury Department, just a couple of years ago…told banks inexplicitly, in writing…that it was OK for them to give bank accounts to illegal immigrants using, um, the Mexican government’s illegal alien ID card. That that was explicitly permitted by the law, and they shouldn’t, uh, be dissuaded from doing that. Um, another example. In state tuition. Now, there is not that many illegal aliens going to state universities and getting, uh, in state tuition subsidies. But symbolically, it’s very important. It is another part of the “welcome” that we extend illegal immigrants, which subverts our efforts to make whatever our immigration policy is stick. What we really need in ending this “welcome” is to pursue what I’d like to call a “firewall” strategy. Make it not just difficult to get in the country, which is something we need to do, but also make it hard to gain access to the important institutions of our society…so that it becomes as difficult as possible to be an illegal immigrant. So you can’t get a driver’s license, you can’t get a job, etc. Only in that way can we successful dissuade new illegal immigrants from sneaking into the country, and persuade some significant portion of those to leave. That’s… I describe that as an “attrition” policy. In other words, not magically eliminating the illegal immigration problem, but causing the illegal immigrant population…",
for,"…instead of growing every year, to start declining every year. It’s a realistic approach. It’s not a pipe dream. Heather mentioned the Pakistani illegal immigrants after 9/11. But, um, the New York Times and the USA Today just in the past couple of weeks have written about how the new, very modest but real, increases in immigration enforcement are in fact impelling significant numbers of people to get the message - that the party is over, and it’s time for them to go home. It works. Our research shows we could reduce the illegal population by half in five years, through normal law enforcement methods - not tattoos, not machine guns, not landmines - normal law enforcement, consistently applied. And that’s the key. Normal law enforcement, consistently applied. And not welcoming illegal immigrants with one hand, while we - in some instances - make it harder on the other hand. We need a consistent, unmixed message to illegal immigrants. And you’ll be surprised…",
against," Good evening. While superficially the topic tonight is about “undocumented immigration,” the debate taking place in this country is really a deeper one. And it’s about whether immigrants - legal or not - are bad for America. And if you listen closely to Heather, it’s about whether Latino immigrants specifically are in fact destroying the fabric of our culture. Now, everybody here actually on stage agrees on one thing, and that is our current immigration system is broken. What we disagree about is what is broken about it, and how best to fix it. If you vote for us, it’s because you share our belief, that immigrants are in fact integral to who we are as America, and that they and their children are integral to the betterment and future of our country. Indeed, our core values as a nation are constantly renewed by immigrants, who come here seeking freedom and fairness, and opportunity for themselves and their families. The vibrancy and boldness of the youthful “can do” attitude, the spirit of America, is refreshed by immigrants who have the courage, the strength and initiative to leave their homes and their loved ones - and in many cases, uh, as Enrique said - risk their lives to be part of the American Dream. Throughout our history, there have been people arguing that immigrants are “taking jobs and failing to assimilate.” That immigrants from certain religious, ethnic or racial backgrounds are “culturally unfit or unwilling to be Americans.” That they bring “ignorance, poverty and disease, and threaten the dominance of English.” That’s what was said about the Know Nothings who argued about the Italians, the Irish, the Germans, the Jews, and even the Asians in the last century. And that’s what’s being said by the restrictionists today. Yet, in every case, immigrants and their children built businesses, they learned English, they joined the military - often in the face of discrimination against them, because of their religion or because of their race. Current immigrants are learning English even faster than the past - and are helping to drive the creation of small businesses here in New York and around the country. And as we stand here debating tonight, immigrants and their sons and daughters are in Afghanistan and Iraq, defending American values. And I am talking about immigrants who are not even yet citizens. Now, restrictionists have consistently been on the wrong side of history. And if you vote with them, it’s because - despite our long experience as a nation - you share their doubt about the power of American culture and American values. Rather than dealing with their very discomforting dislocations - and they are scary, brought about by globalization and the new Internet driven economy - it’s easier to blame immigrants and target them for their fears, as if, if they all went away, magically we wouldn’t have these new challenges. They hope to keep jobs in America by building high walls. And if we follow their old school, isolationist prescription, America’s ability to generate jobs and compete in the global economy will fail. Before computers and the Internet maybe, and the globalization of corporations, it might have been possible to lock those jobs in. That’s no longer the case. Even agra business, is moving across borders, with American companies buying farmland in Mexico, because they can’t get the workers they need here in the U.S. And what about…? What does that mean in terms of our food security…that we can no longer fully feed ourselves? Vernon talked about “class.” Well, it’s true that immigration challenges at all levels, actually. The American Bar Association magazine this month featured a story on the outsourcing of legal work to India. Because the reality is today, with the Internet, even if you keep immigrants out, it doesn’t mean that the jobs are staying here. All of us agree that a system which results in a huge number of undocumented… undocumented immigrants who are extremely vulnerable to the exploitation that the professor talked about, is not good. Because many restrictionists believe that immigrants are the root of these problems, their solutions tend to be reactionary policies that foster division, and actually backfire on communities and American citizens. I want to be clear. Despite the back and forth, we are not arguing for open borders, and we are not arguing that our laws should not be enforced. What we are saying is let’s be smart. Let’s talk about what laws need to change, so in fact they are enforceable and they make sense. Laws only function when they are humane. And right now, our immigration laws are not humane, and they do not make sense. As Dan said, we don’t provide a realistic number of visas or permanent green cards. The backlog for spouses and children to join with a legal permanent resident is now five to ten years. Is that smart? That’s why we have so many undocumented immigration. How many people would wait ten years to be with their spouse or child? The backlog for high tech workers to get a green card, once they have already proven their value to our economy, is now five to seven years. The number of visas available for temporary, low skilled workers is 5,000 a year. Now we could debate what the numbers should be. But I think most of you would find it strikingly unrealistic to say, that 5,000 is the right number. Restrictionists talk about attrition through raids and hostile policies. And what they really mean is making our community so uncomfortable that people who - as was pointed out by Mark - are finding much better wages here, are gonna be forced back across the border. We believe that it makes sense to reform the system to provide sufficient channels for legal entry, bring the current undocumented out of the shadows. Nobody really believes we can get 12 million out. And more vigorously enforce existing anti discrimination, wage and hour, health and safety laws in the workplace. The restrictionists don’t talk about that. That is why undocumented get exploited. That’s why employers like to hire them. Because we are not enforcing the wage and hour, and health and safety. Ten years ago, there was one inspector of restaurants in New York for wage and hour. That is ridiculous. We can reduce incentives without punishing everybody. For example, what is going to happen now, Bush… The Bush administration is going to now require employers to match their Social Security numbers. And if you don’t… Uh, if you have a “no match,” you have 30 days to clear it up. 30 days? The Inspector General of the Social Security Administration says, “We have at least 17 million errors in the data.” There is only 12 million undocumented. So what does that mean? That means a lot of us…",
against,"…are gonna get caught up in that system. So what we are saying is, let’s have reasonable laws. Mark talks about “licenses.” Well, we are not giving licenses to immigrants to help them. We are giving licenses because we would prefer that everybody driving on the road can get insurance and take the tests and know the rules of the road. By not providing them with licenses…with driver’s license, we are only punishing everybody else who is on the road with them. At bottom, the question is - do we really want to be the kind of community that refuses emergency health care to someone because they can’t produce a birth certificate or a green card? Do we want to be the kind of community like Riverside, New Jersey, that found that their economic revival of their downtown was reversed overnight when they decided it was best to pass hostile symbolic measures? And now Main Street is boarded up, and property values have tanked.",
