side,script
for," To my distinguished opponents, I see your Dr. Evil and your Dr. Pol Pot, and I raise you a pope and a poet. Specifically, Pope Gregory the Great, and the great poet Dante Alighieri. Because after all, one of the things we have to figure out here, is what do we mean by evil. Well Google encourages us to think algorithmically, after all it’s built everything that it has on algorithms. One of the simplest forms of algorithms, the if-then statement, or if you prefer, the checklist, Dante offers us such a checklist in The Divine Comedy. I know you know it, I know you know it with me, so say it along with me, the seven deadly sins, luxuria, gula, avaritia, acedia, ira, invidia, and superbia, right? Well, okay, you didn’t say it along with me. To walk through, I can show you that Google has at times committed every single one of these seven deadly sins. The first, luxuria, which translates as extravagance or lust. I spent a bit of time on the Google campus out in California…they get massages. Right, the people who work there get massages. That is, that is corporeal lust of the highest order. Or at least for a bunch of geeks about the best they’re gonna do. Um… Number two, gula or gluttony, the other thing about the Google campus is they get incredible food, all they can eat all day, no matter what they want, there is so much food that they never need to say no, that is the very definition of gluttony. Number three.  We’ve already heard from Randy about the greed embodied in the Google-Yahoo advertising deal…that is one of many examples of Google overreaching to corner a market, or completely undermine a market, in an effort to maximize its returns. Number four, acedia, sloth. Now I could talk about how lazy and self-satisfied Google was in its effort to roll out an on-line video service. The early days of Google Video were very much a matter of figuring they owned the video realm and they weren’t actually gonna do anything new or fantastic until these whippersnappers at YouTube came across with their Flash video platform, and basically ran around them to the point where they ended up having to buy that company just to keep pace. But there’s actually a better example of sloth and that is Google itself, its very nature, its very model of advertising is based on free-riding. Google makes money off of our work. We blog, we put our skate—our cats on skateboards and record them for videos. We do all of this work, and then Google harvests our work, runs all of this content through this computers, spits it back out at us, with almost no actual value added and what we end up getting is a tremendous amount of money, based on free-riding, the very definition of sloth. Wrath, ira, wrath. There are a number of high-profile cases of people who have been involved with Google through their Ad Sense program, through which they’ve agreed to place ads on their own blogs. I think Jeff is one of these people but not one who has suffered the wrath of Google. Many of these people have found their accounts shut down, their revenues stopped, for reasons that can never be explained, but they did something to violate Google’s policies. But they get no feedback and no response, and no justice. And then there are hundreds of small companies all around America, that have found their ranks decimated, their Google ranks decline significantly, because again, they tried to optimize their results, they were just doing what a company should do, trying to get more attention for themselves. And Google’s algorithms, its faceless, soulless algorithms came at them with wrath, another of the seven deadly sins.  Google has over the last few years engaged in a series of efforts to try to muscle in on the markets of other successful companies, Microsoft being the most prominent. Google has recently tried to push its suite of services that directly compete with Microsoft Office. Of course they have at various times threatened to muscle out eBay, muscle out PayPal, muscle out Amazon, in various ways. Number seven, the one I want to talk about the most, superbia, pride, or hubris. Now, let me remind you of the actual motto of the company, it’s not “Do no evil” or “Don’t be evil,” it’s actually, “To organize the world’s information to make it universally accessible.” What could be more hubristic than that. What could be more prideful than that. General Motors doesn’t say we’re gonna organize all the places in the country and make them universally accessible. General Motors says we’re gonna try to sell cars. Not that that’s the best example to use this week, I understand. Nonetheless, no company besides Google would ever come up with a motto or a mission statement like that, but let me tell you something that Sergey Brin, one of the founders of Google said a number of years ago, during an interview when someone asked him, what would the perfect search engine be like. And he said, without missing a beat, it would be like the mind of God. Ladies and gentlemen, that’s more than hubris, that’s blasphemy. Now the particular kind of hubris that energizes Google is of course, a sense of techno-fundamentalism. The notion that you can always invent something, to solve the problem that the last invention created. And that faith in technology, that technology can cover all of our sins and all of our faults and fix all of our problems, is again the ultimate hubris, it’s the hubris expressed in the myth of Pandora for instance, the myth of having too much knowledge. There are so many examples in human history in which techno-fundamentalism has led to great suffering. Not that Google is about to lead us to great suffering, but they’re still committing the sin of hubris. Now hubris is actually the most serious of the seven deadly sins. As Dante explains to us, it was the sin that Lucifer committed. Lucifer was a good guy. Lucifer fell, because he thought he could be as effective as God, as good as God, and thus, he became Satan. The very notion of the “Don’t be evil” motto, is itself hubristic, is itself, evil, because it is itself a violation of the seven deadly sins. One real-world example, let me finish with very quickly, Google Book Search. Google has been trying to scan in 36 million books from libraries around the world, in an effort to essentially corner the market on digital book access, for a number of years. Early on, four years ago when it started this project or got public with this project, it claimed that everything was cool as far as copyright was concerned. In other words, copyright only applies to mere mortals, not to superhuman supercompanies like Google. Well, it turns out Google wasn’t right about that, last month Google ended up having to settle, and wrote a check for $125 million to publishers and authors , because it turns out, they weren’t quite as on the ball about copyright as they thought. "
against,"And I guess in both full disclosure and a plug I should say I have a book coming out called, What Would Google Do?"
for,That’s blasphemy!
against,"You're just jealous. Massage would feel good right now, wouldn't it? We should remember where this pledge came from. The chiefs of Google have said that the real purpose of the “Don’t Be Evil” pledge is to give employees the license to remind their bosses of this in meetings. So, a geek can stand there and say, is that evil? The kind of thing a geek would say. And it’s, it’s useful. Imagine, ladies and gentleman, if we had that phrase, “don’t be evil,” chiseled over every door on Wall Street. Would we not have a better world today? In this poisoned process that led to the financial crisis, if just one, or two, or five, or ten people had said, Hmm… taking poison mortgages, or giving them, is that evil? Creating poison assets and selling them, is that evil? So, I think it’s important to just recognize that the rule itself is good. The fact that Google asks it is good. And we should wish that it shouldn't be special subject of a debate that a company promises not to be evil. The fact that it’s special is, itself, a virtue. So, I would like to match the seven deadly sins with eight, I’ll beat you, virtues of Google. And let’s remember that virtue does leaven evil. We all mess up, right? So virtue matters. So number one, Google has opened up, as my colleagues have said, the world’s knowledge to the world, or stipulate China, most of the world’s knowledge to most of the world. Now, in fact, I went to Google, and I asked Google how fast does an eye blink. And it told me in point three seconds that an eye blinks in point three seconds. Your life is richer now because of Google. Number two, Google respects the wisdom of the crowd. We are too often not respected. There’s a snobbishness about my old colleagues in big old media. Google doesn't have that. Google learns what it learns because it trusts us. Isn't that nice? Shouldn't companies do that? Shouldn't politicians do that? Wouldn't trust matter? Google in its very essence trusts us. Number three, Google takes the wisdom of the crowd, it knows we have wisdom, and it gives it back to us. It gives us our own knowledge. Look at the Google flu trends search. It lets us know how often we search for a flu, and how the flu trend is coming. That is our knowledge, not Google’s. Google shares our own knowledge with us, it gives it back, it does add value, if not flaming cat videos, to our own wisdom. Google connects people. This is so important. We often are accused on line of being anti-social. I think we’ve become hyper-social. I think we’re more connected. I met Esther and Siva because of Google, because of searches. I looked at Google, and there’s Siva on the other side. And so I think the importance of Google connecting people cannot be underestimated. Our children today connect in ways across cultures we don’t even know, yes sometimes it makes us nervous, but I think that it can only be good. Admit it, how many of you have searched Google for an old girlfriend or boyfriend? Aw, come on, you liars. Now, part of the problem is, I can say this because I have gray hair, that probably, the probability of finding someone is inversely proportional to your age. But young people will stay connected to their friends for the rest of their lives. Imagine the impact that will have on friendship and society, and Google is the mechanism that makes that happen. Five, Google creates platforms, it is a platform that enables us to create. A recent poll said eighty percent of Americans think they have a book in them. We should be glad that most don’t come out. But we have seen in Google that it is an age of creation, and Google creates the platforms, the tools to let us create, the means to let us pay for that. I think that’s very, very important. Six, Google does have ads. Last year I made a big four thousand, five hundred dollars on Google ads. I shouldn't quit the day job, I know. But, if you want to compare, my dear colleagues on the other side, the view of Google toward its advertising structure, compare it to a monopoly newspaper, which set the price, which set its own rules, which allowed you to only do so many things with their space, well, no, we can do what we want with our ads. We can start whole businesses with it. We can create movements with it. We can be found with it. That’s important. And I believe that Google ads will help support the future even of news. Seven, Google.org, the foundation started by Google, is supported by one percent of the equity, and one percent of the profits of the company. And it is trying to solve, with hubris, the problem of energy and global warming in one fell swoop. But I’ve learned that they're doing it in a unique techno-smart way, the way engineers do. Engineers solve problems. We have a problem, they're looking for the solution. Politicians are trying to get us on energy with regulation and taxes and prohibitions and slaps on the wrist. Google is giving this investment, and innovation, and invention. And if it can solve the problem of power cheaper than coal, then we don’t have to save anymore, we can use as much as we want. Google understands abundance. Finally, eight, Google has a new model on how to treat employees. We get, they get, massages. Finally, I want to say that Google teaches us to understand our new world in new ways. And if we are too critical of Google I think we give up that opportunity to see this new world and understand it through the lens of Google. In this new economy, I don’t think companies will be built anymore by huge capital, making huge acquisitions, they will be built, as Google has, through networks and platforms. We have a lot to learn from Google. As we try to understand this new world of links and connectedness and platforms and networks and generosity and speed, we would do well to ask ourselves, “what would Google do?” Google is not evil. In the examples it gives, and in the fact that it vows not to be evil, Google is a model to us all. Our world is better off because we have Google. So please, have a moment of decency, and vote against the motion."
for,"I’d just like to point out that our opposition tried both tactics to persuade you to vote against the motion. They said that evil means Hitler, Pol Pot, and the worst gulags of the Soviet Union. And they’ve also said, they mean by evil something that’s a much higher standard. Now, I would like to think, and I would like to ask the opposition if they don’t think that when Google made their motion, made their motto, “don’t be evil,” that they were not holding them to the standard that they shouldn't be as evil as Pol Pot, Hitler, and the worst of the Soviet Union, and if anything better than that, they would get a pass on the “don’t be evil” motto."
against,"Now, the question is as to the motto, and I would, I spoke to both versions, the actual, genuine meaning of the word evil, but what they may have meant, which is the sort of corporate greed kind of thing. Greed, which as Siva pointed out, drives them, wrongly apparently, to compete with eBay and Microsoft and Amazon, that's not an indictment of a company to say that they're competing with others, trying to serve consumers better than with whom they, than with whom they compete. By any standard Google is not violating the “don’t be evil” policy that they put forward. Yeah, the purpose of this motto is that these guys are smart, and they are aware of the possibility of evil, they're aware that their extraordinary success and their extraordinary ability to collect information gives them a lot of power, and they do not want to abuse it. The other thing I’d like to point out is that Google, using Google is voluntary. Pol Pot, all these dictators, they were not voluntary. Google, whether it wanted to be evil or not, is constrained by the forces of competition, and it’s well aware of that. It has to earn your favor. It discloses to you what it does with your information. You can go and search your web history. So there, they're using their power to do good and to make the world more transparent."
for,"Yeah, Jim, you’ve fallen into my trap. Of course. So, you’ve fallen into my trap by citing the fact that every company should be expected to compete, and should, in fact, probably be extravagant, be gluttonous, be greedy, be slothful, be wrathful, and be envious, and of course, hubristic. Every company should, because that’s what companies should do, they should compete, they should win, they should crush…"
against,"No, they should win, they should not crush— MAN Siva, you’ve fallen into your own bog—"
for,"And by that, by that I say, it is for the companies to violate the seven deadly sins, and not to pretend they don’t, and it is for popes and poets to warn us against it. hate to be a textualist, but I brought the registration statement with me, right, let’s see what it says. Don’t be evil. We believe strongly that in the long term we will be better served as shareholders and in all other ways by a company that does good things for the world, even if we forgo some short term gains. The question is, when does Google, faced with a conflict between what’s good for the world sacrifice its own interests. I don’t think it’s doing that."
against,"Let’s look at Yahoo, may it rest in peace. Shall we have a moment of silence for Jerry Yang, dearly departed.  Yahoo was the last old structure, the last old media company. Google is a new company. Eric Schmidt was asked recently by Jim Kramer how much they could make by putting ads on their home page. Some untold billions of dollars, he said. They chose not to do that. Is that good versus evil? I actually argue it is, because Google recognizes that it’s not an end, like Yahoo. It’s not an old media company, it’s a new media company that gets us to what we want to get to. That itself is a virtue. I think the problem we’re having here is defining the fall from grace. And if we all define it the way that you are trying to hold Google, then we’re all going to hell, because— That word evil does it."
for,"So, Jeff has compared Google to Wall Street firms and said, wouldn't it be great if Wall Street firms had that motto chiseled in their buildings. He’s compared Google to newspapers that have local monopolies, and pointed out that newspapers, of course, fix prices on advertising. And now he’s compared Google to Yahoo. None of that matters. It does not matter that any other company behaves badly, or behaves in an evil way, because none of those companies ever were foolish enough to chisel such a motto into their buildings or their financial filing statements. Now that, the fact is— …that Google has set its own standard, and has not met its own standard."
against,"It has set its own standard, and I believe it has met it. It has aspired to do good. It has, as I said, engaged in an evil world to make it better. To me that’s the opposite of evil."
for,"It was an aspirational statement— …and just as many of us make promises that we have to acknowledge we are unable to keep, Google has been unable, virtuously and continuously, to keep its aspirational promise. I think it’s a good thing that Google made that aspirational promise. The question is whether it ever violates it, and the answer is plainly that it does."
against,"It, no, I'm—a little access is a good thing, but I'm arguing something more important. It’s not collaborating with the regime, it is… It is infiltrating the regime, it is spreading information within China, it’s exposing people to the virtues of knowledge. It’s changing their expectations. It’s creating more transparency. Long run, you will see that Google is going to change China by opening those cracks. Every time you open a crack and insert something in it, it starts to crumble. No, we believe in disclosure regardless. Even if you wish that Google did differently in China, and I, frankly I do, I wish they’d use their power. The important thing is to realize the basis upon which they made this decision. And they used their “don’t be evil” pledge as a basis to debate and decide this. They made their decision not out of pure greed, but out of the belief, agree with it or disagree with it, but out of the belief that they were trying to do good."
for,"Yeah, I’ll— don’t want to argue that, that making this material available is an example of evil, what was evil was the hubris in arguing that they could fly above the basics of copyright when they do it. And Larry and I have had this argument going on for about four years, we don’t want to invite everybody else into it, nonetheless, we— We’re at, we’re at loggerheads on it. But I do want to point out that of the hundred and twenty-five million dollars that Google willfully paid in the settlement, people don’t give away money for nothing, they basically were paying the authors and the publishers ninety-one million dollars to settle the damages that were claimed by the authors and publishers.  Simple math. No something for nothing. The extra services that Google is now providing will take up thirty-four million dollars of that that hundred and twenty-five million. So, in fact, the settlement was a concession that they probably had flown too close to the sun— Yeah, don’t focus on the dollars, focus on a different issue. So the basic structure of copyright law is, subject to fair use, you have to get permission. Google has done something incredibly clever, evil, I don’t know, in the settlement which is, by turning it into an opt-out class action, and now I just said a bunch of legal words that you're not going to like, they’ve effectively changed the default position with regard to how copyright’s consent system works. That’s either brilliant because of the orphan works problem, clever, or evil, I don’t know.  Very much so, I think. Maybe the public interest at the same time—"
against,"They also served the interests of people who want to read books that were no longer available, and authors to get payments. "
for,"Thanks a lot, she’ll love you for that. In the case of John McCain, I'm actually with John McCain in wishing that YouTube would exercise a little more judgement before it automatically pulled the, the campaign videos down, although I understand the practical reasons why that’s important, and I understand why, under the Safe Haven rules, they would have the knee jerk reaction. But Google actually could afford to review some of those videos in the middle of a political campaign to make a judgement about whether they were fair use or not, and I wish they had. MAN But complying with—"
against,"With all respect, I think you're showing little faith in mankind. It’s not Google you have a problem with, but man. Yes, even in a financial organization there can be someone who would ask the question, force the issue, is this evil? And similarly in Google, there is not only that, but there is also the self interest that Google does have a brand and a reputation. And if Google messes with us, we can use the internet and find ourselves on Google to get Google back. And we will. So Google, in its enlightened self interest, I believe would not mess with us. JOHN DONVAN OK, just a time check on where we are. We’re about halfway through the head to head discussion. Just a reminder, I'm John Donvan, your host and moderator of this Intelligence Squared US Debate where the motion is: “Google Violates Its ‘Don’t Be Evil’ Motto.” “Google Violates Its ‘Don’t Be Evil’ Motto.” We have three debaters for and against, and we are, at this point, taking questions from the audience, and we have, yes I see you Madame."
for,"Yeah, so on the question— On the question of demise, I think that the question is, is Microsoft, who wanted to buy Yahoo before, still a natural purchaser. Obviously the scuttlebutt in today’s newspapers and online is that the change in management yesterday may increase that possibility. So if you ask what the natural deal is, that’s the natural deal. It’s not obvious to me that deal will actually matter. Maybe Esther’s in a better position to talk about that, but that seems to me the most natural next move for Yahoo."
against,"Yeah, it’s, there are other acquirers, such as AOL, but I think the most important thing to learn from this is that companies that get into trouble usually are not murdered by Google or anybody else, they commit suicide."
for,"Oh, I think, yes, I think that Google’s international reputation would have soared had they stood firmly against the Chinese censorship. It would have been in their long term interests, as many of the other measures that Google has made had."
against,"As a shareholder question, this is very much like the question of people who complain about Google but don’t do anything about it. Shareholders are free to sell, and they would if Google was evil, if they were violating their motto. Unfortunately, they wouldn't actually— Shareholders hold. Yeah, I know. I don’t, unfortunately, I don’t think the shareholders would have sold if they thought Google was evil. They're free to. They're free to. I also don’t think they would have applauded had Google stayed out of China. They probably would not have noticed, to be candid."
for,Someone’s been selling Google’s shares—
against,They’ve been selling everybody’s—
for,"Well, exactly. But people have been selling Google shares for reasons they don't disclose.  It’s a simple signal they send to the market. Nonetheless, remember that a publicly traded company that’s doing very well can afford to hold out a motto like “Don’t be evil.” When things get tough, and as Harry’s brought up, they have to make a decision between revenue and egalitarianism, they're going to pick revenue, as they have every time."
