side,script,round
against,"All we are trying to debate tonight is, what kind of country do we want to be? How do we want to enforce these laws? Restrictionists, for example, object to allowing undocumented immigrants to have bank accounts and pay taxes. They say “that’s welcoming. ” Yet, without bank accounts, these immigrants are vulnerable to criminals who know to rob their businesses or invade their homes because they know they will find a lot of cash. And how does it help Americans to stop immigrants from being able to pay taxes to help cover their share of the cost of building roads or running schools? Isn’t that one of the reasons restrictions give for what they feel is unfair about undocumented immigrants in the first place? Which, by the way, do pay taxes. And in fact, in a recent study that was done on Long Island, for example, immigrants were paying much more of their share of taxes than they were actually using as benefits. So let’s jettison the old way of thinking, because it really hasn’t served our country well. Let’s ask ourselves…",
against,"…do we want to be a country where we turn teachers and co workers, ministers and nurses and neighbors into immigration police? Or one where we have sense… sensible, realistic immigration flows, with a well trained border enforcement agency, who are held accountable for following their own laws? One that continues to hold agencies accountable for following the rules when they make decisions about people’s lives, or one that illuminates the systems of checks and balances and sacrifices due process along the way? If you vote for our side, it’s because you believe that it’s time for us to stop scapegoating immigrants, and instead focus on how do we fix the real problems? How do we fix the push that pushes immigrants here? And what do we do with immigrants once they are here, to make sure that our communities are healthy and thriving, and that we continue to be able to compete well in the global marketplace. ",
for,"Uh, the current situation we have, of massive user immigration system, breeds widespread cynicism throughout the country by illegals and by citizens about what are American values? Illegal immigrants know they are exploited, but they have no choice but to take the jobs that are offered to them; they are still better what they had where they came from. Citizens are appalled with the lack of concern by their own government… country, uh, on the…about the unfairness of the competition that low wage workers are confronting with the presence of illegal immigrations. Perversely, we has set up a system, where those lawyers - uh, sorry - where those employers who try to follow the immigration, uh, laws of the United States are, are…or who, uh, or law… are put at a competitive disadvantage by firms that are allowed to violate the laws and can under, uh, uh…underbid them and under…and undersell them in the labor market. Currently, by the way, because we don’t enforce our immigration laws, we are, we are basically, well, rewarding law breaking…and, uh, and those who follow the law, they are actually punished. Many years ago, the famous CBS correspondent Edward R. Murrow said, “The duty of journalists is to separate slogans from policies.”",
against,"Well, thank you all very much. And I want to pass on my, my love and my, uh, support to, uh, the fact that, that we are all here today. And, and I appreciate the fact that we would going to be able to debate this. Remember that, um… What right do we have to deny anybody to have a better life? What right do we have? We want a… We have a solution that six… Like, three and a half million people demonstrated when they marched in the streets last spring. Like, 65 percent of the country, according to a Gallup Poll, supports it. It’s comprehensive and humane immigration reform. I, I, I keep on repeating this. Many of you, in your history, are familiar with the politics of hate. Shouldn’t somebody have stepped in and said, “We have got to stop this?” Love is in action, and not in words. It’s important that we go and, and demonstrate the best of America. The best of America - the diversity. The whole world used to hold us up and look at us and say, “That’s what we strive to be.” That’s not taking place right now. We want to get back to that. And we can. Sleight of hand. Well, the sources that I have are Business Week, the Wall Street Journal, the Good Book. And I am talking about serious…",
against,"…serious, uh, documentation, and not using this type of rhetoric, this type of dehumanizing language, which only promotes the politics of fear. We want to have the rule of law. I believe in a, in a law from, uh, above - but I also believe in the laws of a country. But remember, sometimes laws are wrong. And we had slaves in this country, and that was a law. Women could not vote, that was a law. Child labor, that was a law. Somebody had to stand up and say, “This is wrong.” And that’s why it’s important that you vote against this motion. It’s wrong what is taking place. And we have a lot of work to do. There is not easy solutions. But you have got to look at yourself in the mirror and say, “Hey, I did the right thing.” When your grandkids ask you, “What did you do when all those people were dying, when the families were being raided, what did you do? Did you do the right thing?” And let’s build a better America. And it’s the immigrants that build a better America. Give those people a humane way in which to enter, and not die at the border - as two people per day are dying. Two people died today. We cannot continue to allow this to happen. We have a lot of work to do - a lot of work to do within this country. It’s a great and generous country.",
for,"And I am a bad person. I would love to debate what the level of legal immigration should be, how we should organize it, who we should pick, who we should not. In fact, I have a book coming out in the summer that, uh, addresses that very question from Sentinel, available in July. Um, but that’s…",
for,"Yeah, and thank you.",
