side,script,round
for,"Free time, I wish. I am busier than ever—writing, litigating, debating, and occasionally taking walks on the beach in Florida. My partner is a real American hero. He served in the military. And now he does a great job in defending the military, the distinguished professor, Michael Lewis. Well, it gives me a perspective that most people that write in this area don't have. Most lawyers are military lawyers first. I was a combatant before I knew the law. I first encountered the law when I was learning ROE in the Gulf War. I hope so.",nan
against,"Yes, you see how well that went. Not exactly. That was in 1937. My partner is also a genuine American hero, the inspiring and remarkable Hina Shamsi of the ACLU. I represent the families of three U.S. citizens who were killed as part of President Obama's targeted killing program in Yemen in 2011. These family members want toknow why their sons and grandson died, and one of the people who died is on Anwar al-Awlaki, who's referred to in your program. One of the other people who died was his 16-year-old son whom no one has accused of wrongdoing but who was blown up by a drone while he was eating dinner at an outdoor restaurant.",nan
for,"Thank you all for coming, and thank you to the National Constitution Center for hosting the debate. The president does have the power -- the constitutional power -- to target American citizens overseas in the exercise of his war-making power. Now, that war-making power is not unfettered. The Founding Fathers saw to it that only Congress may declare war. Now, while formal declarations of war have not occurred since World War II, major military operations, such as the Gulf War, the 2001 Afghan War, and 2003 in Iraq -- all only happened after the executive was authorized to use military force by large bipartisan majorities of both houses of Congress. Now, the AUMF -- the authorization to use military force -- in 2001, which is the basis for President Obama's continued use of his war-making power against Al-Qaeda and associated forces -- our opponents will say, was only directed at those that participated in or planned 9/11. However, since that time, the judiciary, in the line of habeas cases from Guantanamo, has determined that the scope of that authority actually is Al-Qaeda and associated forces. The thinking behind this is that when you're dealing with an enemy like Al-Qaeda, that is diffuse, that is splintered, you are not going to require the president to return to Congress for authorization every time a new group with a new name shows up in a new location -- as long as they are still trying to kill Americans in this country or kill American troops and contractors in Iraq and Afghanistan. Further, since that judicial gloss has been placed upon the scope of the authorization, Congress -- the Senate Armed Services Committee -- held hearings last year on whether the AUMF should be revised, repealed, or retained. And at the conclusion of those hearings, they left it as it was and so, at least implicitly, have accepted the scope of the authorization that the judiciary has put on this. Now, once the executive has received the authorization to use military force from Congress, it is then the exclusive province of the executive branch to determine when, where, and how that war is fought. Congress tells him who we are declaring war on. We declare a war on Germany, he can't go fight France. But it is up to him how he fights Germany, where he fights Germany, who he targets. That is exclusive executive decision-making. And no other branch has any constitutional basis for challenging that decision-making. And this is true, even when we are talking about targeting Americans. During World War II, the United States Armed Forces killed a number of American citizens that were members of the German and Japanese armies. But in today's war, we are being told that although those people -- the Germans and Japanese that we killed without questioning whether we were invading or infringing upon their due process rights. We're told that today, because our enemy doesn't wear uniforms, doesn't carry arms openly, hides amongst the civilian population and uses human shields, in other words, because they undermine all of the basic tenets of the laws of war, that they should be afforded due process rights that an American putting on a German uniformdoes not have. Now, the president does have a duty, under international law, to distinguish between targetable individuals and civilians. But he does not have a duty under either international law or the U.S. Constitution to distinguish between targetable Americans and targetable non-Americans. And as my partner will argue, such a distinction would be immoral. Now, you will hear our opponents argue that this authority of the executive is geographically bounded by “hot battlefields.” You can only use this authority in “hot battlefields.” That is a term that does not appear anywhere in either international law or in the U.S. Constitution. And yet because internal armed conflicts have been determined to exist based upon a level of violence measure, by some commentators in some courts, they are trying to impose that view of international law on our president. However, the U.S. view of international law is consistent with that of many other nations that face non-state actors that have committed terrorist acts against their citizens and then tried to seek sanctuary by crossing some international boundary. And just as Columbia and Turkey and Israel and even Iran reject the notion that you may gain such sanctuary, the United States also agrees that the laws of armed conflict go where the participants in the armed conflict go. And because this is an armed conflict, there are no due process rights available. Lastly, we are going to hear from our opponents that there is insufficient transparency on the part of the administration. They are not telling us enough about how they know what they know about our enemies and what they know about our enemies and why they are targeting our enemies. Now, of course, if they reveal this to the American public, they are also revealing it to our enemies. And to say that the due process rights of our enemies must be vindicated by telling our enemies what we know about them and how we know it does not -- well, let me say that it is obvious why there is no constitutional requirement for such disclosures. Thank you.",nan
against,"Good evening, ladies and gentlemen. Today the president is claiming an absolute power that would have horrified the Founding Fathers. He asserts the authority to kill American citizens without judicial review based on largely secret law, entirely secret evidence, and he asserts this power even with respect to Americans who are found far from any conventional battlefield. Noah and I are here to argue against the proposition, because the power that the president is claiming is unlawful and it is unwise. In our system of checks and balances, the president cannot be the judge, jury and executioner. Now, for very good reason, our Constitution and international law strictly limits the government's power to kill people without judicial review. In areas of actual armed conflict, under the law, the government can kill people without judicial review because of battlefield requirements. Outside that context, extra judicial killing is legal only if it is a last resort and only if its in response to a truly imminent threat. The government can't kill Americans simply because it believes that they may do something dangerous at some point far off in the future. This is a democracy. It's not Minority Report. So in every context, the Constitution, outside of armed conflict, the Constitution requires the government to prove its case to a court before it delivers a death sentence. That's because even the most serious allegations are not evidence. And due process requires evidence, not just allegations. Now, the president, and our opposition, seek to circumvent due process in ways that strike at the heart of our system of checks and balances of what it means to be a nation ruled by law, not men or women. First they want to redefine the battlefield so that it covers the globe. That's not just wrong. It's a very dangerous proposition. And Noah's going to address that more. Then they want to redefine the law. We only found out after the leak of a so-called white paper which purports to summarize still-secret legal memos that were written to justify the killing of a U.S. citizen, Anwar al-Awlaki. The white paper acknowledged that he wasgoing to be killed outside of recognized battlefields, but argued that the killing could be lawful in response to an imminent threat. It then redefined imminence to mean its very opposite. The White House now says that it can order the killing of an American it suspects may some day present a threat even without evidence of an actual plot. This is a radical reinterpretation of the law. What should trouble us as much as these legal shenanigans is that the actual full standards for killing Americans far from any battlefield are still secret. The government refuses to disclose to us its killing memos. Was Anwar al-Awlaki truly an imminent threat? The only way to find out would be for President Obama's Justice Department to present its evidence to a court. This the government refuses to do. Instead, the Justice Department has made a profoundly disturbing argument and claim. It said that the courts have no role to play in deciding whether al-Awlaki's killing, far from a battlefield, was lawful. Now, you may hear a lot tonight from the other side about why we need to trust the government when it comes to national security and threats. But one of the core lessons of the last decade is that ""trust us"" is never enough when the government claims power over life and liberty. Do you remember when the Bush administration claimed that the people at Guantanamo were all terrorists, the worst of the worst? Remember when President Bush's Justice Department fought for years to prevent any judicial review of those claims ultimately without success? And do you remember what happened next? As the courts finally started reviewing the Bush administration's claims, it turned out that more often than not, the evidence that the government relied on was overstated, it didn't exist, or it was just plain wrong. The result was that the Bush administration itself released the majority of people at Guantanamo. When a president wrongly detains people, there's always the possibility of judicial review and release. There is no appeal from a drone strike. Many Americans were outraged when President Obama claimed worldwide authority to detain people, suspected terrorists, without charge or trial. We should be similarly outraged when President Obama claims something far more radical: The power, worldwide, to kill people the government unilaterally deems its enemies. Now, our concern here tonight isn't just for citizens. Four Americans have been killed in the targeted killing program. But thousands more non-citizens are dead. Several hundreds of these were far from any battlefield. They include a grandmother, for example, who was picking vegetables in her garden. And there are many more horrific accounts of similar tragedies and wrongful deaths. It isn't surprising then thatmilitary leaders warn that President Obama's lethal program is creating more enemies than it kills. Unlawful killings will never lead to security no matter how many of them our government commits. Think about the world we're creating. If the U.S. can carry out targeted killings in Yemen and Pakistan, why can't the Russians, the Chinese and Iranians do the same, Russia in Kiev, London or Washington, D.C.? This is not the world that we want to live in. And Noah and I hope you agree with us and vote no to the motion. It's a proposition that is un-American, unlawful and unwise. Thank you.",1.0
for,"Thank you. Under the precise motion before this house, our opponents have the extraordinarily heavy burden of showing that under no circumstances should the commander-in-chief ever have the authority to order the targeting of dangerous terrorists—regardless of how imminent the threat may be, how impossible it would be to capture him—if that enemy happens to have been born in the United States or naturalized as an American citizen. Consider the implications of that extreme position. It would mean that if Osama binLaden had been born in America, had been planning the attacks on 9/11, were targeted, it was impossible to arrest him, and the only way to stop him from carrying out 9/11 would be to subject him to a drone attack, under the negative of the resolution, the president would lack that authority. That just makes no sense at all. Of course what they're going to try to do now is try to modify their extreme position by saying that the president would be authorized under certain circumstances, they've already conceded in the battlefield if it's an American, they've already conceded apparently if the judiciary agrees, so they've already undercut their proposition considerably. But consider the implications even of their modified position. It would mean that unelected judges unfamiliar with the situation on the ground and inexpert at making intelligence assessment and operational decisions could prevent the commander-in-chief from taking action designed to protect Americans from terrorist attacks—even if such preventive action would be entirely lawful under both American and international law—if the people happen to have been American citizens. This is not Minority Report. These are cases where there is clear evidence that somebody in the past has joined al-Qaeda or its affiliates, has been an operational leader of al-Qaeda, and has participated in the planning of operations against the United States. That's not Minority Report. Our opponents argue that a terrorist commander planning an imminent attack on the United States that can only be prevented by a drone attack has a constitutional due process right to a judicial predetermination. But consider the following relevant analogy: what if an American citizen wearing a T-shirt emblazoned with his passport on one side and the American flag on the other took a series of hostages? You don't even have to imagine it. Just consider if Timothy McVeigh instead of killing so many children in Oklahoma City had taken them hostage, and let's assume that he had said, ""I'm not going to kill anybody for 48 hours until I complete the negotiation,"" but during that 48-hour period a sharpshooter was able to target him, not knowing exactly when he might start killing Americans. Would anybody in their right mind demand a due process prejudicial determination, or would you say that the situation there permits for the use of deadly force? That's not murder. Yes, it's an extrajudicial killing, but extrajudicial killings occur all the time. Every time a fleeing felon runs away with a machine gun from a bank robbery, even though the bank robbery's complete, just on the basis of the possibility they may do it again, the United States Supreme Court has definitively ruled that deadly force may be used without violating his due process rights and without a predetermined judicial authority. In fact, the Supreme Court, just two days ago, heard a case on that issue, andthe report in the New York Times said none of the justices gave any attention to the claim that it would be a due process violation in shooting a fleeing felon under those situations. Of course mistakes are made. There are -- mistakes are made with fleeing felons, and of course every effort should be made to reduce the number of casualties. Some of the people referred to by my distinguished opponent were accidentally killed, including the son. He wasn't targeted. When you drop bombs people are accidentally killed. It's especially the case when terrorists make the decision to hide among civilians. They make the decision to violate the rules of law, the rules of warfare, and, as the result, the only option put to a democracy is to use the drone in the most targeted possible way, knowing that there might be some collateral damage and civilian casualties or allow the terrorists to continue. There should not be a distinction drawn between terrorists who are American citizens and terrorists who are not, except, of course, if they're captured, in which case being an American citizen makes it worse because it's treason. But if they're not captured, if they're on the battlefield, once one signs up to become an al-Qaeda operative, his or her citizenship does not and should not matter. The important distinction is not between Americans and non-Americans, but rather between combatants and civilians. All Al-Qaeda operatives are unlawful combatants. That is, they are subject to being targeted as combatants, because they've joined Al-Qaeda, because they are at war with the United States. But they are not entitled to the benefits of being legitimate combatants because they do not comply with the rules of warfare. So, just use your common sense and ask yourself the question -- does the Constitution really straight-jacket the Commander-in-Chief of the United States Armed Forces? Does it really deny him the constitutional power to prevent an act of terrorism just because the person planning the act of terrorism is an American citizen? I urge you to vote that the president has such power to protect you and your children. Thank you.",1.0
against,"When I was a kid, I really liked to argue. And my parents told me that I should grow up and I should defend civil liberties, like Alan Dershowitz. I don't think they thought -- and I know I didn't think -- that I would eventually have to defend civil liberties from Alan Dershowitz -- But that seems to be where we are. We're on hallowed ground here. Those of you who live in Philadelphia are accustomed to invocations of the Constitution and its importance. But for those of us who are visitors, it's not a trivial thing to come from the airport, get out of the taxi, and see Independence Hall, where the most basic principles of liberty were set down for the United States. And indeed, the Framers believed, that by demonstration, they were setting down those principles of liberty for the whole world. That matters, and it ought to matter to us in thinking about this issue, because it pushes us to ask what's really the most fundamental question you could ask about the nature of liberty and democratic government: What is the essence of liberty? What's it all for? Why do we even have a constitution? And if you boil that down to its deepest essence, the most fundamental component of liberty, going back to Magna Carta, which is 1215 -- if you're counting. Not the time 12:15. The year 1215. The essence of Magna Carta -- the thing that was demanded from King John of England -- was to promise that the government would not kill its own citizens without a trial. That's it. That's the essence of liberty. Your government can't kill you without a trial. And when we say ""due process,"" which is a fancy expression, that's all it means. That means you get a chance to explain that you didn't do it, that it wasn't you. And before that happens, they won't kill you. Now, if you are fighting at the Battle of Guadalcanal in a Japanese uniform, and you suddenly hold in the air your U.S. passport, sure, there is no doubt that in that context, the American soldier on the other side can kill you, because you are on the battlefield in a legitimate war. And to think otherwise would be preposterous. And it is, to be completely blunt, a classic debaters' trick to say that somehow, we have a radical position or that we've modified our radical position for denying that. That's just common sense. And common sense should, I insist, drive your vote in this case -- though not exactly in the direction that our opponents think it oughtto. Now, what is the difference between a person on the battlefield fighting in a war and an American citizen, thousands of miles from home, who is targeted by a government program? The answer is pretty simple, and there are two of them. One is, under the international law of war and under our domestic law, the threat has to be imminent. As Hina explained, imminence is -- means what the word imminence sounds like it means. Imminent. About to happen. And if you read the white paper, what it says -- this government document -- it's nominally a description of an even more secret document -- it says ""Imminence is not imminence. Imminence is where you might have done something in the past and you're a member of Al-Qaeda, and maybe you're a senior member of al-Qaeda, and so you might do something in the future. That's not imminence under the law, and it's not imminence under common sense. The second element is, you have to be in the war. You have to be on the battlefield. Now, the other side has said, quite honestly -- and I give them a lot of credit for saying this -- that in their opinion, the battlefield is anywhere. Anywhere. So you get off the plane at Heathrow, some of you probably travel every so often. You're abroad, so you're under the terms of our motion. You can be killed. Why? Because the president of the United States could determine, secretly, by a secret process, that he believes that you are affiliated with either al-Qaeda or some other force that he says, now, 13 years after 9/11, is affiliated with al-Qaeda. We'll leave aside whether you could be affiliated with an affiliated group, but there's reason to think that even that would satisfy the administration. And when that happens, you can be killed. Now, is that consistent with the idea of a declaration of war? No, it is not, because a battlefield cannot stretch forever in time and everywhere in geographical dimension. That is not war under the meaning of our Constitution. It is not war as our Founding Fathers would have recognized it. It is not war even as Congress would have intended. And it is certainly not war under the meaning of international law as is shared by people around the world. That meaning, by the way, is relevant to our Constitution, because when our Constitution talks about the declaration of war, it's referring to a concept from international law. The word ""war"" means something in our Constitution. It gets its meaning from international law. As a consequence of all this, you have to have ask yourselves, where will it end? So there's a plausible answer, which is, eventually, Congress will say the war is over. When do you think that's going to happen? When do you think it's going to be in the politicalinterests of your elected representatives to stand up and say, you know, 9/11 happened. We fought back. The war against terror is over, and we hereby -- what, peace treaty? There's not going to be a peace treaty. So I think it's quite realistic to expect that from the standpoint of Congress, and therefore from the standpoint of the executive, they're never going to end this war. And the same goes for geographical range. They're never going to say they can't kill you. If that bothers you, you should vote no on the proposition.",1.0
for,"Well, in the old days, they used to actually have battlefields that were marked off. And the battles would occur on the battlefield. Obviously, over time, the concept of battlefield is expanded. Al-Qaeda expanded it even more by declaring that the battlefield was anywhere where they can legitimately operate from and kill Americans. There's no doubt that the battlefield includes Yemen. It includes the Sudan. It includes parts of Pakistan. Of course, it doesn't include Heathrow Airport because we can arrest people at Heathrow Airport. For purposes, functionally, of defining the powers as we discuss it, it includes anywhere where al-Qaeda is operating functionally, where it has the protection of local people, where they can't be arrested, and from where they can attack the United States. That is a reasonable, functional definition of battlefield, and we have to adapt the definition to our enemies, otherwise our enemies will defeat us through law fare, not through warfare.",2.0
