side,script
against,"Thank you. I want to thank the audience. I want to thank the foundation. I want to thank my opponents. I want to thank Doug Holtz-Eakin in particular for some of the comments he just made about the dire fiscal straits of the country, the importance of trying to get healthcare costs under control because if we don't get healthcare costs under control, we're not only going to bankrupt our government, we're going to bankrupt our entire society. And you know, I agree with all of that. I do. Where we differ you may -- as you may imagine, is that I happen to think the Affordable Care Act, Obamacare, helps us in that regard. Now, you listened to this team over here. You've listened to their argument. And they painted a very dire picture of a program out of control that's going to cost more than anybody thinks. It's going to leave us all paying tons in insurance premiums. And you know, they have to paint an apocalyptic picture because I think the honest truth is most of us, when we hear that -- about the benefits of the plan, that we'll be able to guarantee coverage for people who have pre-existing conditions, the right to appeal treatments when their insurance company turns it down, subsidies for people who can't buy coverage now. People like that. They think that is a good idea. So they focus on this cost question. And, you know, during the healthcare debate, we had all this scare talk about death panels and other things that just were simply not in the -- with all due respect to my -- to our debating opponents here who I know have spent a lot of time talking about it, I think they're giving you, well, I don't want so say they're making things up out of whole costs , but I think they're giving you a slightly, let's say, one-sided picture of things. So I did two things here. First, I want to explain why I have faith that the Obama healthcare bill will in fact reduce costs. And I want to specifically go through some of the arguments they have made and tell you why they are misleading. Now, why do I have faith that this healthcare bill will save money? I mean isn't -- Congressman Shadegg said, isn't it common sense that it won't? I don't think it's common sense. I look around the world. I look at countries like France and Germany and Switzerland and Japan, countries that get just as good healthcare as we do or better,people who have easier access to healthcare, and yet they spend less than we do. Now, is there something about the United States that we're not capable? We're not innovative enough? We can't do that? I don't think so. Certainly it is possible, certainly, to get excellent healthcare, cover everybody and save money. So the question is, will this bill do it? And I believe it will. Let me take a second to explain how the bill is designed to do that. It has three basic approaches. One is to get the low-hanging fruit of healthcare, the waste. A lot of it's corporate welfare. Right now, for example, insurance companies that provide benefits through Medicare, study after study has shown that we pay them too much. They're making too much in profits. So we say we're going to take some of that back. We're going to take back that corporate welfare. Another source of offsetting revenue for the healthcare program is to go and ask people who have benefited the most from our economy, the people who are the very wealthiest in our society, to pay back a little more in taxes. And we get money from there. Now, I don't think either of those propositions are in dispute in terms of that those things will generate money to offset the costs of the healthcare plan. Now, they may not like those ideas. And that's fine. And maybe in the question and answer period they can tell us why they think we need to keep giving insurance companies corporate welfare. Why the richest people in this country, who are enjoying far lower tax rates than they had during the Clinton administration, can't afford to pay a little more. But it's the third part of healthcare reform, the third part of cost control that's the most important. And this is where we really look at the way the American medical care system works. Everybody who is -- every expert left and right says we waste a ton of money in our medical care system. Some of this is administrative waste because everyone's dealing with 10 different insurance companies. Some of this is duplicative treatments because Dr. A doesn't know what Dr. B is doing to patient C. Some of this is the fact that we pay tons of money for treatments that don't work. The Obama healthcare bill, what it does is it tries to attack those, and it tries dozens of different approaches, and it's not a liberal takeover, it is not something crazy extremists cooked up on one side, it's actually the best ideas of the left and the right. It's ideas like not paying hospitals if they run high rates of in-hospital infection. It's things like developing electronic medical records so we can keep track of what patients are getting as they move through the medical system. It's about giving financial incentives to doctors and hospitals that coordinate care and focus on prevention, and efforts like this that together, the smartest people have stated this, all believe will help control healthcare costs. Now, Douglas Holtz-Eakin got up here and said these numbers are crazy, that of course this is going to explode the deficit, and again, commonsense, well, the most reliable authority we have on this is the Congressional Budget Office. Congressional Budget Office is the gold standard of accounting. The CBO -- my reading of the CBO report is that they looked at the healthcare bill and they said, ""You know what? This bill will reduce the deficit. It will reduce the deficit in the first 10 years, it will reduce it by a lot more afterwards."" And by the way, the rate of growth in healthcare spending is going to start to slow down. Now, it is true that the CBO, you can say, ""Well, the CBO ought to use these rules,"" or whatever. Well, what the CBO rules mean is that we are assuming that the laws that we have passed are going to be implemented, and that is the way -- and that is the way the government accounting system works. Douglas Holtz-Eakin says, ""Well, that never works because we've never seen it happen."" Well, you know what? It's happened before. During the late 1990s we tried to control costs in Medicare and we did for a while. We passed very large cuts to Medicare during the Balanced Budget Act. It was the late 1990s, and you know what? Those cuts stuck, and we were able to reduce the growth of Medicare from where it would’ve been otherwise. It’s entirely possible to do this. Now, in order to do this you have to actually stick with a program. As my colleague mentioned, during the Bush administration they passed a different -- they tried to approach healthcare in a different way. They said, “All right, let’s try a different approach, and let’s have a healthcare bill, let's not pay the cost for it.” Well, that did increase the deficit, and that is the sort of choice we’re talking about facing here. Now, my colleague -- my opponent, Mr. Holtz-Eakin, cited a number of authorities he believed, and he said, “Well, John Gruber of MIT says this is not good,” or he said, “The CMS actuary said this."" Well, in fact, if you look at the written record, the people -- the list of experts who have endorsed this, it’s not just the Congressional Budget Office, it’s people like David Cutler, a professor at Harvard University, who won the John Base Clark Medal for the most accomplished economist under 40. It's people like Jonathan Gruber from MIT -- I know he quoted Jonathan Gruber -- Jonathan Gruber has said many times he endorses this bill. He thinks it's our best shot right now to get healthcare costs under control. It's people like Mark McClellan, who hasn said that he believes the Affordable Care Act will start to reduce healthcare spending, and why do we care about Mark McClellan? Because Mark McClellan ran Medicare in the Bush administration, and it’s people like the Simpson-Bowles Commission, the bipartisan fiscal commission said, ""The cost control in the Affordable Care Act will be affected, and we need if anything to double down on it."" This is not my opinion, it’s not some crazy opinion, it is in fact the opinion of the best experts of left and right.John Donvan: Jonathan Cohn, your time is up. Thank you."
for,"I’m thrilled to have that question because I think it’s vitally important. I think we’re already -- we’re a nation that does support taking care of those who can’t care for themselves. We’re a nation -- and my legislation covers every single American -- we’re a nation that thinks it’s outrageous that anybody would lose coverage because there are pre-existing condition like my heart condition or my sister’s breast cancer. But we’re also a nation that honors limited government and honors individual choice. I think on theone hand what you hear from the other side is that the government can manage this issue better. And what I would suggest to you is we are in this problem because the government made changes that took you and I out of the equation. The government said health insurance is available only if your employer buys it and you get a tax deduction. But if you go out and buy it, it’s one-third more expensive. If you can’t hire and fire somebody’s who delivering a service to you, you can’t hold it accountable including its costs. Absolutely. The individual freedom is tied back to the cost of the service and because we can’t control it, you are controlling its cost."
against,"I do think this is a question of our public philosophy and the obligations that we owe to one another. And it is, I think, a sad commentary on us that we remain the only advanced country that doesn’t provide protection to all of our citizens. Now the reason that we have -- let’s go back to why we have this employer-based system. If you don’t have government share, spread the costs of healthcare, there needs to be some organization that serves as the pool for risk. And the employer is the most convenient way to do it. That’s actually why this first developed in the 1930s and ‘40s before we had the tax advantages. It’s simply going to default from the government to employers. It’s not as though the government took this away from individuals. That individual market that the Congressman loves is phenomenally inefficient."
for,"All the Republicans are arguing is that you ought to give that choice to people. I do not favor individual purchase. That was the attack made against Senator McCain throughout the campaign and it was absolutely unfair. I favor a plan which says I as an individual can buy an individual plan, I can take my employer’s plan or I can buy from a whole group of expanded choices. We could have my social club. The Kiwanis Club can offer a plan. My university alumni can offer a plan. Give me that choice, force those insurance companies to compete. They don’t compete right now. They don’t care what you and I pay for health insurance and they don’t, quite frankly, care whether it treats us well. They only care that our employer bought the plan."
against,"Well, I would say I think all of us favor choice. Choice is a wonderful thing. We want to give choice. People who buy, I mean, we need to realize that the employer -- people who are getting private insurance are now divided into two groups. There are people who get it from their employers and there are people who buy it on their own. Neither of them has choices right now. You’re buying insurance on your own? Good luck buying a coverage policy. You’re going to have trouble finding one, particularly if you have pre-existing conditions."
for,You’ve got to shop across state lines.
against,"We’ll talk about that in a second. This Affordable Care Plan, what it does is it says, all right, let’s create a market, a real market, a place -- kind of like Expedia, like they have in Massachusetts now where everybody who’s buying one actually gets a choice ofinsurance programs, a set of plans that they know they can afford that will be made available to them regardless if they’re a cancer survivor and let all of those people shop. Meanwhile, employers who have insurance for their employees will continue to provide that. Look, at some point it is very easy to say we want to open up exchanges for everybody and let everybody shop. You can build on this system to do that. You can do that. But you’re never going to get to that system you’re talking about. You will never get to a system where people have choice and a choice of actual plans that are available to everybody, that cover what they need, until you build these exchanges that are in the affordable care act."
for,"I have no idea. Let me just -- I would never speak for 300 million Americans. And that's one of the beautiful things about this country. And I think the -- you know, I agree, obviously, with a lot of what Jon has said. Go back to the beginning of the evening when we were asked to think about end of life care. Now, do you really think that Americans want an insurance company making decisions about the end of life care? No. They've already seen that model and rejected it -- That you can't do that. They told us, I’ll read that evidence. I don't think they want the government making those decisions. I think we know who makes those decisions. It's the family. It's -- those are the only people who are ethically well situated to make those tough calls. And so we must, in the end, invest in families, the authority to make decisions, invest in them, their insurance. Invest in them the information and the ability to make those decisions and center this system around families and Americans, not around these large government entities. What does that mean in practice? I'm an economist. I mean, economists are practical people. You follow your nose and incentives. If I have an insurance policy when I'm 21, and then I develop an odd thing where I have to have my kidneys transplanted, I'm stillon that insurance policy. Any insurance company now has to recognize they've got me for life. It's not a one-year sign-up proposition where they can minimize on preventive care or they can try to cut off covering some things. They have to deal with the right lifetime incentives. Pay for the cheap prevention up front. A lot of them eventually want to do that. And align the insurance and the medical incentives to transform the way we deliver medicine in America. That's what we need. And in the process, guess what? My insurance goes with me from job to job, job to home when I stayed home with my kids. You don't have to spend the whole time fighting over who works full time to get the insurance. It's madness. Americans are rearranging their lives for the insurance. Let's rearrange the insurance so it fits American lives. That's what this system will be."
against,"Sure, absolutely. Well, first of all, to start, there's a pilot program funding for malpractice reform. You know, believe it or not, people who wrote the Affordable Care Act, and I would include myself among this, actually believe that there is some money to be saved by reforming the malpractice system. So there's money out there for --"
for,"Can I just say the big problem -- I will stipulate late one thing I want to get very clear on the table. I support exchanges. I support -- I always support good competitive markets. And you can build exchanges that enhance competition left to do that. There is a lot in the bill that is bipartisan. It's in the delivery system reforms, not in the coverage expansions which are madness. But they're all tiny. They're pilots. Pilots have a terrible track record of actually turning into real policy. In fact the road to healthcare hell is paved with pilots and demonstrations. And that's a pilot and a demonstration for a known problem. If you've got a problem, fix it. The problem with this bill, it doesn't fix what we know is the issue, healthcare costs. Instead, it's got a bunch of pilots that Congress will never actually implement. And it doesn't fix the biggest source of our problem, which is the Medicare system which pays for fragmentation, pays for overuse. It's a fee for service system. We have more problems created by those programs than this could ever solve."
against,"I have to respond to this because really, you know, that's amazing for you to say about the Medicare program. We had legislation under the Republicans to reform Medicare, to introduce private insurance plans into Medicare. And what is the result? We now know that those plans cost Medicare an extra $1,000 per beneficiary compared to what it would have cost Medicare just to deal with them in a traditional program. So."
for,"No. I'd like to -- -- 30 seconds of getting facts straight. The problem is the healthcare bill. Medicare Advantage is one way to shift it from one person to another. Tax policy, which he said would save us money, doesn't. It just shifts the bill around from one person to another. The problem is the bill. This law does not change our healthcare bill. That's its issue.Jonathan Cohn: Can I just say --"
against,"With all due -- did you read the bill? I mean, I -- is. And did you read the -- I know you've cited CBO reports. There are page -- I mean, we all know it's a thousand-page bill. Let me tell you -- Okay. Well, the type's very big. That's how they do congressional -- Okay. Whatever. You know, I think if you condense it -- true story, if you condense it, it actually comes down to about 300 pages, which you know, is less than a John Grisham book so take that into account. I'm actually not a John Grisham fan. But your mileage may vary. But I mean there are -- and you yourself admitted the delivery reforms in there--you think they're not big enough, okay? And you know what? I would agree with you. I would like those delivery reforms to be stronger. So here is a proposition. You're talking about repealing Obamacare.Male Speaker: Yes. How about let's reinforce it. Let's make those bigger. Why do you want to go back and start from scratch?"
for,"I have to raise an issue which your side has raised, and that is you say it gives people choices. It takes a lot of gall to say that it gives people choices. For example, in Medicare Advantage, it repeals Medicare Advantage for millions of Americans and takes them off."
against,It reduces subsidies that are .
for,"No, no. It takes -- it will drive people off of Medicare Advantage. Every expert agrees on that. Two, you say that people will have choice of plans. There is one plan prescribed by the government, actually has three different components, but that's it. Three. Secretary Sebelius can grant exemptions. She already has too many companies. She has the ability to impose new benefit mandates. She has ability to say what premium increase is effective or not effective. The notion that this bill gives the average American more choice is ridiculous. It's going to take away the choices Americans have now, and it's going to force them into essentially a one-size-fits-all plan. When you say, for example, to employers, that your costs are going to up, such as AT&T, to the tune where you could pay the fine for not insuring every one of your employees and still save $2 billion, they're going to have no choice but to drop their coverage and put people into the government-run plan."
against,Can I just respond to this because this is the second time that you've mentioned this. John Shadegg:Let me finish. Let me finish. If AT&T or any of these other companies wanted to drop coverage now --
for,"No, he can go. That's fine. I mean --"
against,"Under current law, if any of those companies wanted to drop coverage, they could do it legally. This law introduces a penalty for dropping coverage. So how can you say that the law encourages them to --"
for,"Precisely because right now they choose to provide that coverage for their employees because that competitive market requires them to do that. People want good coverage. If they drop that coverage, there's no place for those employees to go. Under this bill, they will all get government subsidies. And oh, by the way, AT&T can take that $2 billion savings and add it to people's salaries. So the notion that this is going to give you more choice, when, for example, we don't allow interstate competition in health insurance now. Your employer makes the choice of your plan. You can't hire -- You can't fire."
against,"And you know, it makes sense. And then, gosh, why would AT&T keep providing coverage? If you're right, and I know Doug has written a paper on this also, if you guys are right, that in offering all of these subsidies companies are going to drop, then we should see that in Massachusetts right now because that's what they have in Massachusetts. They offer the subsidies, and companies -- but you know what? It hasn't happened. Employer-sponsored insurance in Massachusetts -- No, no, no, no. Let me... It hasn't happened. And the best estimates from the experts are that it won't happen. And there's a very complicated -- I mean, I could go through all the math -- I read Doug's paper on this, and I know it seems like it makes sense, but it doesn't happen. Would it happen right now with Medicaid? And you know, you don't see company -- half the people who qualify for Medicaid --"
for,"Actually, number one, in Massachusetts, we're down to, I think, to only four carriers. Several of them are in dire straits. Many of them have demanded from the governor that he allow them to raise rates. The governor has said no. And some of them -- -- are on the verge of folding. Now, let me ask you something. The plan, under Obamacare, says that if you're in an exchange, a government-run exchange, and you only offer the policy that the government exchange allows, then you can get a subsidy. Every Republican plan says let's give every single American a tax refund, a tax credit to go buy the plan of their choice. Now, I guarantee you, if we do that, so we say to every American, you get a refundable tax credit, a refund, and for the poor, it's cash, to go buy the plan of your choice. And you can buy your employer's plan. You can buy in the individual market. You can join a new group sponsored by the Kiwanis club. You can join a new group sponsored by -- No, I would not mandate it because I think freedom is a hallmark of this country. And I think if we offer great -- Well, let me tell you how my plan works. It offers every single American, every single American that refundable tax credit if they don't make enough money if they do not enroll because they are homeless and don't get the notice we automatically enroll them because we know their Social Security number and we knew it as one point, they show up for care somewhere, and they say, ""What plan did you enroll in?"" And the individual says -- she's a mother of three that was moving from Idaho to Arizona on the day that the notice came to her, she says, ""I didn't enroll.""They look her up on a Social Security number and they say, ""Oh, yeah, you're in the pool."" ""And you're covered."" That's the way Paul Ryan's bill works, that's the way Tom Coburn's --"
against,"I want to respond to this whole notion that it's a complete individual free market here, to talk a little bit about the way insurance works. Healthcare is very different from other kinds of services and commodities. Seventy percent of the healthcare costs in any year are concentrated in 10 percent of the people. So insurance companies have a very strong incentive to cherry pick, to go out and to look for the 50 percent of people who actually account for only three percent of the costs. And when you have this market where supposedly everybody has individual choices, you also have a market where the insurance companies are going to cherry pick and avoid the sick people. They will do everything in their -- it is the best business model for them. Rather than try to control healthcare costs, it's just to avoid sick people. The way the exchanges work is that if you want to sell insurance in the exchange, you have to agree to take anybody. That’s the bargain. And what the exchange does, so the people pay in on a community rated basis, but the insurance companies get paid according to the risk of the population they enroll. So if they enroll an older population, if they enroll a sicker population, they get paid more. That’s what goes on through the exchange that won’t go on through this market. I realize this is complicated. Insurance is a complicated business, and this law is trying to take account of the way this business characteristically malfunctions. That’s why we end up with millions of people uninsured."
