side,script,round
against,"Only when they deserve it. You’ve got to vote for our side. I have to tell you, you know, there’s plenty of blame to go around, we all agree, there’s plenty of blame to go around. You know, there’s Washington, there’s Wall Street, but all of us know who really is to blame here, it’s gotta be Jim Cramer. Listen, I’m willing to blame everybody, I’m even willing to blame that Bachelor guy, I— everybody, everybody deserves— it takes a village to create this problem. Or put it another way I’m gonna quote Pogo, who said, “We have met the enemy and he is us,” every one of us bears some responsibility for what went on here but I’m gonna tell you today, why it’s Wall Street that is primarily responsible. First of all, it’s a bit of a false distinction, between Wall Street and Washington. And one of the things I’m going to talk about today is how inextricably they are linked. We talk about Fannie and Freddie. Those were public corporations, after all. They were a little bit the better, the worst of both worlds, a little bit of a duck billed platypus because they had a little government edge there. But those were public corporations with Boards of Directors and they behaved like public corporations. They behaved badly. And that is what is wrong with Wall Street. So you may noticed already, even in this few minutes that I’ve been up here, I’m different. I’m not like anybody else on this panel and that is why, and the primary difference, as I’m sure you’ve noticed, is I’m the only one on the panel who is from Washington. I have to say, none of these people know anything about Washington except some addresses. That’s all we know. I see he’s got a GPS, is all he’s got. And you know, and the other thing is, I’m not an economist. I am a capitalist. I, uniquely on this panel, I have created businesses. I have created businesses, had them grow and sold them. I have worried about making a payroll. So I know something. I’m not like an economist who, it works in theory, it doesn’t work in practice. So I know what it is to be a capitalist. And I know what it is to be a bureaucrat. I worked in the government. In the Reagan administration I was at OMB. And let me tell you, one of the big shocks in my life was all these people who espouse and rhapsodize about the free market kept trooping over to me to get me to give them limits on liability and erect barriers to entry. Everybody is all about the free market except when it benefits them not to be. So I’m going to tell you the three things that Wall Street did that are unforgivable and that really weigh the balance in favor of their responsibility. What is the one thing we want from Wall Street? We want just one thing. We want them to be able to do math, right? The math was wrong. Their math was bad. They put too much reliance on something called the Gaussian copula formula. Yes, the Gaussian copula formula is at the heart of what created the derivative securities, the credit default swaps. They all relied on it. They all got on one leaky little boat. They didn’t take out their slide rules. They didn’t do the math. So they relied on bad statistics. They left out one big variable. Yes, they heard music, but what dance were they doing? They heard music for the minuet. They were doing the boogie, okay? And what is the address of all of those forms? I believe it’s on Wall Street. Second thing, bad incentives. They were getting paid based on the quantity of transactions, not the quality of transactions. Now, it doesn’t take a rocket scientist to figure out that’s going to have a very bad result. Look at what we’ve seen about the pay just in the last couple of days. Look at The New York Post with its headline today: AIG Is a P-I-G. These people were getting paid regardless of what happened. You heard about Anthony Mozilo? Six hundred million dollars as he took the stock down seventy-eight per cent and took the economy down with it. Fuld didn’t have to give any of it back. I testified with Fuld before Congress in Washington when they called him in to account. And he said, up until last year the performance was pretty good. So he should be allowed to keep all that money. Only thirteen percent of companies on Wall Street have claw backs, meaning they have to give back the money when the numbers that were reported, that they got their bonuses on, turn out to be wrong. That is on Wall Street. What are they doing now? Watch them carefully. They are repricing their options. That is disgusting. And that is Wall Street. Okay, next. Terrible oversight as shareholders. Yes, the shareholders should have done more. Guess who the big shareholders are? Yeah, they’re on Wall Street. Who was it that was voting in favor of these insane pay packages? Well, look at the firms on Wall Street. They’re the big shareholders. They’re managing all that money. They are enablers for the addiction of bad pay packages on Wall Street. And yeah, Washington behaved badly. Washington behaved very badly. Do you think the fact that from 1998 to 2008 over six hundred million dollars was spent on lobbying to get rid of regulations, like Glass-Steagall, to get rid of capital requirements on banks – do you think maybe that might have had an effect on it? Yeah, Washington is nice to its friends. Who is responsible for that? Who are its friends? I would like Wall Street to make the same disclaimer that is required of mutual funds. Past performance is no guarantee of future performance. And who is it that requires them to say that? That is Washington. Wall Street has expected us to bet on them for a long time. They have not lived up to our trust in them and they are more responsible than Washington for this mess. ",1.0
for,"Well, I think one way of answering that question is to ask whether every country in the world is having a financial crisis comparable to the one that’s being experienced in the United States. Now, most countries in the world are experiencing an economic crisis, largely as a consequence of what is happening here. But they’re not all experiencing a financial crisis. You don’t have to travel terribly far, actually, to get to a country where banks are and have been adequately regulated. That country is called Canada. So if you simply look at what’s happened there it becomes obvious that something was egregiously wrong with the regulatory environment in the United States. And that is our central point. It’s not difficult to see that there was a grotesque failure on the part of regulators and politicians here. You only have to look north of the border.",2.0
against,,2.0
for,That’s always a good sign.,2.0
against,"You know, the fact is that the banks are supposed to be able to respond to whatever is provided for them in some kind of a rational way. And they didn’t do. As I said, they all relied too heavily on the same set of numbers. But I’m not sure that I think that more regulation is the answer. Is that what you’re arguing for?",2.0
for,"On the contrary. I’ve never said I’m in favor of more regulation, simply better regulation.",2.0
against,"Well, in what way is it better?",2.0
for,"Can I conclude my point? If you think back to the highly regulated financial markets of the 1970s, it’s not as if that was a period without financial crisis. I’m old enough to remember stagflation and the secondary banking crisis in the U.K. and the problems of that period were in many ways as serious. Certainly the recession of the early 1970s was as serious as anything we’ve experienced so far, though I don’t rule out that this is going to get worse. So, no, I’m not in favor of more regulation. The heavy regulations that were imposed during and after the Great Depression didn’t actually prove to be that benign. The trouble is that the deregulation, much of which was justifiable, was taken to excess. This, I think, is the point that John Steele Gordon, Nouriel Roubini and I want to stress. And it’s not difficult, if one compares different regulatory frameworks around the world, to see why the U.S. was so bad.",2.0
against,"But don’t you think the fact, the point that I made about six hundred million dollars being poured into Washington, they don’t have that system in Canada, either, for lobbying and for political campaign fundraising.",2.0
for,"But you understate the case. think there is a strong correlation that goes to history between degree of proper regulation and financial crisis. You know, after the Great Depression we imposed a system of strong regulations of the financial system, capital controls and for a few decades there were not that many financial crises and banking crises. It’s not just the U.S. If you look around, for the last twenty years, you have had financial crises and banking crises and so on in a number of countries. And what has been changing over the last twenty years, starting with Ronald Reagan and then Margaret Thatcher, the ideology became of deregulation at any cost, first in advanced economies and then in emerging markets. Now, some deregulation was good. Nobody is in favor of excess. Even probably we swang the balance too much in the direction of too much regulation after the Great Depression and that led to not enough financial innovation. But deregulation without a proper institution and so on has been known to lead to financial crises, like in East Asia, like in Mexico, like in Argentina and so on. And therefore, there is a strong correlation between the quality of the regulatory and supervisory regime and whether financial crisis occurs. There’s a trade off between the two, but that’s what’s really the fact that now in spite of the great moderation, low inflation and growth, these financial crises are occurring now more frequently. These should occur once every thousand years. Now occur every other year – more frequently, more virulent and more costly in every way.",2.0
against,"Certainly there has been a huge amount of deregulation in the last twenty years. There’s also been major changes in the structure of Wall Street. Firms, you know, Wall Street was essentially a set of partnerships, largely, until the Seventies and by the Nineties, I think, Goldman was the last big firm to give up the partnership model. So, again, it’s not your capital at risk anymore. It’s your shareholders’ capital at risk. You don’t own your firm anymore, you own a portion of it. I don’t think it’s an accident that there are some small partnerships out there that have essentially thri -- Well, thrive may be too strong a word. But they have survived this crisis. The other very, very important change, really the most important change, is the egregious increase in compensation. It’s one thing if you’re making five hundred thousand dollars a year. Let’s say you’re making some multiple of an average American’s salary, where if you do that for ten years, you’re, you know, you’re very well off. It’s another thing if one good year makes your life and makes your children’s lives. It really skews your incentives. You know what? Washington has its own market system. And, people have got to get re-elected. That’s what accountability is. Yeah, they took the money. But, you know, you’re blaming the victim there. Yeah, sure. If, look, if -- MAN The victims are the people who pay taxes here. If you want to, if you want to make this about campaign finance reform, I’d be happy to turn this into that debate and I’d be happy to come back and have that debate. I’m totally in favor of that. But the United States is the only country in the world that has this level of corruption coming into politics from money because this is the only country in the world that doesn’t free television time and forces politicians to buy the time. So you want to take money out of politics, I think that would be a great thing. I think it would be hugely beneficial in Washington, believe me. But you cannot blame, you cannot blame Washington for the fact that all this money comes in from Wall Street. ",2.0
for,"You know, Washington might be corrupt but you have to think about the international dimension of this phenomenon. There are many countries with totally different laws about lobbying and so on and there have been about fifty banking crises in the last twenty years and have occurred in very different political regimes. And if there is something in common among all of them, it’s that in most of these cases you had a controlled financial system and then deregulation occurred too fast and in ways that did not provide prudent regulations provision of the financial system. As I said, you know, capitalism is based on greed. Greed is just about incentive, about maximizing returns. We’re all greedy, you know. First of all, you said you are the only one from Washington. I spent two years at the White House in Treasury and also ran a successful business. So I know about policy. I also know about business. I tell you, in my business I’m greedy and I react to incentives but I want public policy to be setting rules and regulations so that I don’t misbehave and I don’t cheat and I don’t lie – ...and I don’t take excessive risks with taxpayers’ money because— Nell, I’m still struggling to understand how the recipients of bribes are victims. I’m sorry.",2.0
against,"It is not a ...and in fact, if you look at the lobbying statistics you’ll see that half of the people that took the money voted against them anyway, which is part of politics, too. But the point is, as you well know, people ran...",2.0
for,"Well, hang on.",2.0
against,People ran for office and were elected on policies of deregulation. ,2.0
for,Hang on one moment.,2.0
against,,2.0
for,"You’ve hit the nail on the head here. AIG, P-I-G, AIG spent 9.7 million dollars on federal lobbying last year, in one year. And that was down on the previous year. It’s contributed directly to candidates, to elected officials and parties, 9.3 million dollars since 1989. It would have been much more but for campaign finance limits. And the top recipients of the money include the Chair of the Senate Finance Committee and the Chair of the Senate Banking Committee. Now, if that doesn’t tell you that something is morally rotten at the heart of Washington, I don’t know what we have to show you.",2.0
against,"If it doesn’t tell you that something is -- Well, just because the Keystone Kops couldn’t catch the gang that couldn’t shoot straight, doesn’t absolve that gang from its guilt. In -- in not only looting the system with material intent but materially abrogating their fiduciary responsibility to their clients and the nation.",2.0
for,"Well, the regulation that seems to be more important than that, actually, has to do with bank capital adequacy. I don’t think one can simply say that this financial crisis is a result of lobbying. That would be a stretch. This crisis is much more to do with excessive leverage. And if one simply regulates bank capital adequacy better, moves away from the self-regulation of Basel I and Basel II, I think many of the problems will be resolved. I’ve written on this --",2.0
against,"You don’t mean, are you saying that there was no lobbying involved in reducing the capital requirements? There was tremendous lobbying involved.",2.0
for,On the contrary. I couldn’t agree more.,2.0
against,"No, I think what we all would agree on is that in a very real way, Wall Street has set the conditions of its own regulation in the last fifteen years. And clearly, that has gone too far. And Washington, I mean, to me, seems to work best when there are two strong sides debating an issue. When it came to deregulating the banks there really wasn’t anybody saying, Don’t do it. I mean, there were a few people who didn’t have any money. But the commercial banks wanted it and the investment banks went along with it and nobody really disagreed. So when you have a condition where the industry is essentially creating its own regulation, that’s no regulation. And then it falls even more on the people, the executives, the managers in that industry to act like adults, which they did not do.",2.0
for,"One, one question’s for you, Alex. You represent the fourth estate here, the press. What, where was the press when these things were being done? I don’t remember extensive coverage of the relaxation of bank capital adequacy rules in 2004 in The New York Times. But perhaps I missed that Krugman column. Frank Raines of course was a Washingtonian to his fingertips. ",2.0
against,He’s the CEO of a public corporation.,2.0
for,,2.0
against,"think, listen, as I said there’s a lotta blame to go around, there’s a lot of incompetence to go around but when Paul Volcker says that he does not understand the derivative securities it seems to me we should have a Paul Volcker rule that if Paul Volcker does not understand it you should not be able to sell it.",2.0
for,"And in 2000 we decided to completely deregulate any credit derivatives. They should be over the counter, not on exchange, no settlement rules, no clearing rules, no counterpart rules, nothing. That was a mistake of policy, there were people in policy, the CFDC were against it and SEC, the Fed, everybody else said no. Should be a free market not regulated and that led to the disaster—",2.0
against,,2.0
for,—of credit derivatives —,2.0
against,But Dr. Doom— —wouldn’t that have—wouldn’t that have just driven—,2.0
for,"—policy procedure, we could have put them on an exchange—",2.0
against,"But if we had done that, wouldn’t the firms have just traded those overseas.",2.0
for,"No, because, that’s why you have international rules and we have rules about avoiding—",2.0
against,,2.0
for,"—that jurisdictional , you do—",2.0
against,So it’s now Brussels—,2.0
for,—we do —,2.0
against,—is the problem?,2.0
for,,2.0
against,It’s now Brussels that we’re debating—,2.0
for,"Listen, capital, we have international rules, there is a agreement, there has to be coordination of international regulatory policy, ‘cause otherwise things are gonna go offshore. But instead of cracking down on offshore centers, we’re stimulating them, that was again a mistake of policy—",2.0
against,"Well, actually after LTCM in 1998, Jerry Corrigan and others were charged with the effect of looking at credit derivatives, and basically went to the industry, who went down the self-regulatory route for clearing and other mechanisms. So again we have a case of Washington going to the industry and the industry doing what it could, to drag its feet or skirt—skirt what was probably good policy all along. No, no— Aside from— Aside from alcohol I don’t know— No…I, no, I think that’s a really good question. As I said at the very beginning of my statement, that is not the question we’re debating, tonight. We’re debating whether or not these firms should have behaved better, under the regime that they had. That said, I do think—I mean I think that what Niall says about increasing capital requirements is at the core, it’s a very, very good idea. I can imagine, and I don’t know whether this could work in reality, there’d have to be some very, very smart people to figure out if it could work— Sort of a dual system where there’s one group of very, very heavily regulated, essentially postal banks, that have, that have explicit government guarantees of insurance, that offer sort of plain vanilla products, that are, you know, essentially national, quasi-national institutions. And then there’s another group where, anything goes. And you can make or lose whatever you want, you can pay your employees whatever you want, but if you go under, you are not getting one dime and that is the explicit charter that you’re operating under. And the difficulty is figuring out how those two systems would interface. But if you could do that, then, hopefully we could avoid this problem in the future.",2.0
for,"There is a regulatory capture in almost every industry, the lobbyists take over the regulators and change things into their own interest. But there’s only one industry, the financial industry, in which this thing leads, over and over again, to financial crisis, banking crisis. They’re a disaster, they cost trillions of dollars. And ask yourself what happens, and why that happens. It happens for two reasons. One because banks have deposit insurance and deposit guarantees. Should we take some of the asset people money, you leverage like crazy, do crazy things. If you gain it’s your money, otherwise it’s the taxpayer. Two, we have lender of last resort support. When banks get in trouble the Fed comes to the rescue, and it’s a variant of this moral hazard of the bailout. And that’s why these banking crises occur over and over and over again, and they’re becoming more disrupting, more expensive and so on. That has to do key, with exactly our regulatory system, there is something wrong about it and if we don’t fix it these things are gonna happen, and the costs are gonna come even bigger, again, people are greedy in every industry, people in every industry try to avoid regulation sometimes with lies, sometimes by cheating or avoiding, whatever. That’s human nature, why it leads to disaster in financial industry, because we have the system. This isn’t— This isn’t rocket science. One set of people under discussion, owes a duty to the public interest. Those are the politicians and regulators. That is why we call them public servants. And the other group, let us take the investment bankers, because of course, Wall Street is composed of many different institutions, but let’s take the investment bankers. They owe a duty, to their shareholders, and also to bondholders. Now it’s quite interesting though the point hasn’t been made yet, that to all of these investment banks performed equally badly. The fate of Bear Sterns and Lehman Brothers illustrates that egregious bad management can achieve. But the performance of Goldman Sachs was really significantly different. Goldman actually didn’t lose substantial amounts of money, though its shareholders have certainly taken some punishment. And the punishment has been meted out by the market, to the people who invested in those banks. They will almost certainly end up with nothing, I’m fairly clear, that those people who invested in financial securities will end up with very little indeed. And I think that’s particularly true in the case of the big commercial banks.",2.0
against,"But, Niall—",2.0
for,And can—can I finish—,2.0
against,—that is exactly the point—,2.0
for,"—‘cause this is a really important point, Bank of America, and and of course Citigroup. But the interests of the public are to be defended by people in Washington. That is the big difference between these two groups, and that is absolutely clear, that we have to lay the blame on Washington. The failure of Bear Stearns, was a disaster from the point of view of people who invested in it. But it became a disaster for the entire US economy, and indeed the world economy, because of failures of regulation. And those seem to me to lie very squarely in Washington",2.0
against,"—that not every bank, failed, not every bank behaved equally badly— Not every bank is as responsible as every other bank for this crisis, Goldman is gonna get by a—you know, Goldman’s gonna get along fine, there are gonna be commercial banks that get along fine.",2.0
for,It helps that AIG has been bailed out of course—,2.0
against,"Well, that’s true, that’s true—",2.0
for,—let’s not lose sight of that.,2.0
against,,2.0
for,The twist in the tale.,2.0
against,"But wouldn’t you agree that that shows that there were distinctions made on the street? I’m not really sure I agree with that, I mean there were not whistle-blowers jumping up and calling the New York Times to tell us about things, and even Enron, and Jim knows, you know, Jim certainly knows more about Enron than anybody— The whistle-blowers really were a— Also Sarbanes-Oxley gives huge, huge protections to whistle-blowers and incentives to whistle-blowers. So I really don’t think that’s the problem. And there is under Sarbanes-Oxley. Well…let’s just look at the response of this crisis. In following, immediately following what Bear—the demise of Bear Sterns, you had the CEO’s of our major banks and brokerage troop down to Washington. What are the two things they requested, from Washington, following this stunning collapse almost out of the blue of one of our major brokerage firms. Was it tightened regulatory surveillance, was it more regulators on the trading desk, was it something like that, no. They asked for two things. They asked for short selling to be stopped, or curtailed, and they asked for a loosening in the accounting rules. And on both cases, one was done, and changed, the other’s under consideration now. So rather than tightening up things and making things more transparent, and giving incentives to market forces like short sellers, to ferret out fraud, and malfeasance, what has Wall Street done? It’s come running to Washington to ask for more help, and more obfuscation and more opacity. And that’s about as telling as you get.",2.0
for,Washington could say no.,2.0
