side,script,round
for,"I --it's funny . I actually think of myself as fairly mild -mannered . I mean, besides free speech, which I do get very worked up about, I mostly only get worked about how bad the ""Star Wars"" prequels were, the canceling of ""Firefly,"" and, of course, that people really don't appreciate Beyoncé enough.John Donvan: All right, thank you, Greg Lukianoff. And tell us, who are you debating side -by -side -- who's your partner? The fabulous Kirsten Powers. They do . They call me up usually to tell me they saw me --you know, cheer me on for brawling with Bill O'Reilly . And they always claim that they accidentally saw Fox News when they were flipping through the channels.",nan
against,"Actually, I was sitting quietly in a stude nt lounge discussing blood donation policy. The incredibly erudite Jeremy Mayer. Hey, it makes me feel pretty good . A college professor shou ld not tell you what to think . He should give you -- he or she should give you the tools to think for yourself.",nan
for,"Let me start by whisking you back to a magical time -- 2001. A conservative would have dismissed me as a liberal cliché . I was a floppy-haired, Burning Man regular, San Francisc -ite who turned down big law salaries to work for social justice . I had worked in refugee camps in Eastern Europe, for an environmental justice mentoring program in D.C., and for the ACLU of Northern California. And most of all, I loved the First Amendment, the quintessential liberal cause -- or so I thought. 2001 was also the year I started working at FIRE, which proudly defends speech and academic freedom for speakers of any political stripe . As soon as I started at FIRE, however, I was inundated with hundreds of pleas for help. It wasn't long before I learned this unfortunate truth : if you're going to be censored on the modern college campus for your opinion, chances ar e you're going to be censored by the Left. And this is what we mean by the Left, and most Americans mean when we say ""Liberal"" these days, either people on the left side of the political spectrum or people who self- identify as liberals, and people to thei r left. I have been -- I have seen so many crazy examples of politically -correct censorship. A student at Indiana punished just for publicly reading a book, a sorority sister forced to publicly repent for insensitivity for a Taco Tuesday event, and Yale students banned from calling Harvard students ""sissies"" on a t -shirt, which was a quote from F. Scott Fitzgerald by the way . This is heartbreaking to me and my teammate, since both of us consider ourselves liberals . Of course there are many, q uote, good liberals out there who still support free speech, both on and off campus . These include former ACLU President Nadine Strossen, The Nation's Michelle Goldberg, renowned First Amendment attorney Floyd Abrams, and many more . But one thing all of these liberals have in common is that they also believe that the campus liberals have become distressingly intolerant of dissent. Take any hot topic in America today and I can point you to examples of students and faculty members getting in trouble for being on the conservative side of the issue . Take abortion. While FIRE has proudly supported the free speech rights of pro -choice students, we are far more likely to have to come to the defense of pro -life students . How bad is it ? At Northern Kentucky University, a professor actually led her students to destroy a pro -life display . The display was only dozens of little white crosses to protest Roe V .  At Dartmouth, a similar pro -life display -- this time involving tiny American flags , was considered so offensive that another student ran it over with his car . That reckless censor -- have you any guess about what his politics were ? He had a COEXIST sticker on the back of his car .",nan
for,"Or take immigration . At UCLA, a student group faced ferocious protest and a massive fine when they simply attempted to invite someone to come to campus to debate against their pro -immigration stance . And though I'm an atheist, I have been horrified by repeated attempts to cens or campus evangelicals. Kirsten will tell you more about those cases. Last year, campus liberals made national headlines for demanding that speaker s they did not like be disinvited from campuses across the country . This problem has been growing for years . According to extensive research by FIRE, if you're going to face a disinvitation push arising from campus, it's about three times as likely it's going to come from your left . This is especially shocking when you consider how rare it is for a conservative to be invited in the first place . Last year's commencement season saw 25 Democratic political figures speech -- speak at the commencements of 60 of America's top universities . And how many Republicans were invited to speak ?  And this statistic comes from Nate Silver's decidedly non -conservative FiveThirtyEight website . Some conservatives were invited to talk at universities outside the top 60, including Rutgers . However, even there former Secretary of State Condoleezz a Rice bowed out after months of pressure from faculty and students . Even mild satire from conservatives isn't tolerated . Take the case of Omar Mahmoud, a Muslim conservative at the University of Michigan . When this past December, he wrote a satirical c olumn poking fun at micro aggressions and privilege theory -- very mild . He was not only fired from the student newspaper , but his dorm room door was vandalized . This prompted famous liberal writer Jonathan Chait to criticize the rise of a new wave of political correctness . If Angus and Jeremy concede that there is a problem with free speech on campus, they may blame the massive corporatized modern university . And on this we agree. Much of the censorship does come from out -of -control administrators . However, we must understand that liberals so thoroughly dominate the current academy, as Kirsten will show, that if they were serious about freedom of speech on campus, this kind of administrative outer -- overreach would no t be possible despite liberal dominance on campus or maybe because of it . 55 percent of over 400 colleges surveyed last year maintain wildly unconstitutional speech codes while only 4 percent maintain codes that fully meet First Amendment standar ds. And this in spite of nearly three dozen lawsuits against politically correct speech codes since 1989, successful lawsuits . And we can't forget that the tools that are most often to silence dissent on campus are the brain children of professors, i ncluding Katherine McKinnon, Mary Matsuda and Richard Delgado, all of whom were liberal leaders of the speech code movement in the 1980s . Though it gives me no joy to say it, you must vote in favor of the motion, y es, liberals do stifle intellectual diversity on campus. ",1.0
against," The picture that Greg drew is a common one . It is the conservative picture of the modern university . Perhaps best summarized by former Pennsylvania senator Rick Santorum who called universities ""indoctrination mills."" In this picture, we are -- higher education is infused with an overly liberal professoriate, biased classrooms and stifled campus debate. If this picture is true, it is indeed very serious . If it is an accurate portrait of higher education in America, then we should all be alarmed, and we should all donate money to Greg's group . Is it, though? I will handle those first two, are professors liberal? And why ? Is the classroom a biased place ? And mostly leave the third to Angus . So, are professors liberal? Well, yes. When we did the research, a national random sample survey for our book, we found that 61 percent of college professors are left or liberal. But this is nothing new . The very first time we looked at college professors in a structured survey in 1933, we found almost the same number. So , it isn't like the '60s : radicals all went into faculty positions and moved young minds to the left. So, why -- what explains this ? Well, the conservative explanation for the overwhelming liberal campus is simple: Conservatives are squeezed out of grad school, convinced that their ideas aren't w orthy of a PhD. And those few that escape this thought police then find it very hard to get a job because liberals discriminate and won’t hi re conservatives . And then those few conservatives that get through this gauntlet are denied tenure by bitter liberal colleagues. This simplyis not so . When we surveyed faculty members, 85 percent argued that ideology played no role in tenure in their department. And this was true of 87 percent of conservatives we surveyed , so -- of the very conservative . So, it is not the case that conservatives need not apply for jobs . Why aren't there more conservative professors to fight the good fig ht? Well, the first answer I ’d give you is money . If you are someone who believes in the market uber alles , you might want to make more than $29 .5 k, which is what I made my first year as a young college professor in 1996 . If you work four years for a PhD like I did, you might think you deserve something better . That's what we got. So , I think the market keeps conservatives from wanting to be in the academy . I also think there's a pocketbook issue here . Professors depend on two sources of government for their income . One is those many professors like myself who work for state government. If conservatives win, you may not get a raise for four years . And a lot of professors also work on federal grants . The Republican party is not the Republican party of 1955, which was very supportive of higher education. It is a party that is devoted to cutting government spending . We aren't surprised when oil executives vote Republican. It's in their economic interest . The same is true for college professors. We also have seen the conservative movement have a hostility to science which it didn't have 40 years ago . So , in our survey, we found, contrary to earlier ones, that natural science professors were moving to the left. 18:22: 24 Well, if a party attacks evolution, you're going to lose a lot of natural and social scientists because we happen to believe in the scientific method. It's good politics for Republicans . I give them that. There's a lot more people who think the worl d was created in seven days than people with PhDs . So it's a good move, but it h urts them on college campuses . There's also another thing that we found is conservatives on college campuses are pretty much like other professors . They're also very, very p ro gay rights. While one party has embraced that social movement, the other party is fairly fervently against it . So , that is again moving professors away from any tendencies to be Republican or conservative . Finally, an anti-intellectualism is occupyin g certain wings of the Republican party . It used to be that that was more the Democrats that were anti -intellectual . Anyone remember George Curly Wallace ? When George Wallace ran for president as an I ndependent after being a Democrat, he almost got no faculties’ support -- in '68 . The inheritors of the Wallace movement today are in the Republican party . It is that kind of anti -intellectualism that turns off college professors . So, I don't think that college professors are becoming liberal out of a viewpoint discrimination . Is theclassroom biased against conservatives ? I would argue no, that if you ask students, do you feel that your viewpoints aren't welcome on your college camp us? In survey after survey, the majority of students say no . So , I think this portrait of an overly liberal campus can be discredited with Greg's own research, that in his work where he identified the 12 worst campuses in 2013, and he said, ""These are ex amples of liberal viewpoint discrimination, conservatives being squelched."" Well, in fact, of the 12, three were nonpolitical, entirely conservative, small “c” conservative administrators just saying, “O h, I don't want people talking about sex on my campus . We might lose donations .” Three of them were conservatives squelching liberals . And finally, there were four of the classic where liberals were being -- were squelching conservatives . There is a place in this very city where I would not be allowed to speak on any topic at a ll. It's Catholic University . Catholic University, like many conservative campuses, is very explicit about not allowing liberals to speak . I'm not exactly a liberal, but I am pro choice . Catholic Universit y has an official policy: No one who has ever publicly advocated for the right to abortion is allowed to speak.  ",1.0
for," Thanks to Intelligence Squared for doing a debate on such an important topic . And I'm always happy t o be anywhere where Bill O'Reilly can't interrupt me, so I'm happy to be here . Our opponents are telling you that liberals are not stifling intellectual diversity on campuses . Sadly, this could not be further from the truth. A perfect example of this is a 2013 case that happened at the University of Alaska, Fairbanks, where I'm from. My parents were professors there . A feminist professor filed multiple sexual harassment complaints against the student university -- the campus university there -- because of an April Fool’s Day issue of an article that was mildly mocking feminism. The professor filed another complaint after the newspaper published an article that was critical of hate speech. The university's repeated investigations dragged on for almost nine months and -- and it only really ended when FIRE had intervened an d informed them they were violating the First Amendment . Ironically, the editor- in-chief, who wrote this article, was herself a feminist and thought she was doing a very mild , mocking , April Fool’s Day story . And she told F IRE that the chilling investigation that was launched by the University of Alaska prevented her from publishing stories on important issues, including sexual assault . Recently, at Milwaukee's Marquette University, a political science professor t here, John McAdams, blogged about an exchange where a Marquette philosophy professor had told a student that debating gay marriage in class was, quote, ""not appropriate and homophobic."" For this, Marquette suspended the professor, McAdams , who blogged about it, banned him from campus, and they are now in the process of trying to revoke his tenure . Greg and I both support gay marriage, but this is an extremely chilling way for Marquette to handle this issue . As Jeremy acknowledged, the decks are stacked against those who express non -liberal views on campuses . And I would just point out, to the point that campuses have always been liberal, liberals are very -- liberals -- the liberals in the past actually supported free speech, and I think that would be the big difference of today, is that the liberals that we're talking about today are enacting very hostile policies against free speech . And so there's a big difference . They may be voting for the same people, but they are behaving in a very different way . And many studies will back up the fact that there are vastly more liberals on campuses . There was one study that found that 72 percent of college professors identify as liberal , while only 15 percent identify as conservative . It's gotten so bad that several prominent social psychologists have written an article recently arguing that the field of psychology is being badly hurt by the lack of political diversity . One of the papers -- and, by the way, none of them are conservatives who wrote this -- one of the paper's authors is NYU Professor Jonathan Haidt. At a 2011 social psychologist symposium, he asked the audience to show hands for their political leanings . Out of a thousand people only three rai sed their hands to say that they were conservative . And Haidt points out that, of course, there were more conservatives in the audience -- that can't be the actual ratio -- but they were too afraid to identify themselves, which speaks for itself. He expl ained that this gross political and ideological disparity is evidence of a, quote, ""tribal moral community that actively discourages conservatives from entering."" He explained that there were -- in preparing for his speech, he wanted to talk to some non -liberal graduate students . He was able to only identify two in the -- of social psychology graduate students, and that he said that he -- they reminded him of closeted gays from the 1980s . And he referred to them as ""closeted conservatives"" because they were -- they felt that they were forced to hide their identities and -- from their colleagues and from their professors, and it really affected the research that they did . And so Haidt argued that more ideological diversity would lead to, quo te, ""better science and freer thinking."" The ideological slant, it's not just a passive preference . During the 2012 election, 96 percent, which is almost 100 percent as we all know, of political contributions from Ivy League faculty and staff went to the Obama campaign . And during the 2004 election, professors donated $19 to John Kerry's campaign for every dollar that went to George Bush. And as sociologist Neil Gross has pointed out, o ur colleges and our universities are one -party campuses. Last year at the University of California at Santa Barbara, one of the worst cases probably that we'll talk about tonight, a feminist professor's study -- she was found guilty of grand theft, vandali sm, and battery after a physical altercation in which she stole and destroyed a 16 -year -old pro -life demonstrator's sign . The professor claimed she was triggered by the poster's graphic images, called the demonstrators ""terrorists,"" and told police she had a moral right to her behavior and was just setting a good example . She still has a job and was basically defended by scores of professors. We've also seen discrimination against Christian groups on campuses – it’s getting much worse at Vanderbilt . Fourteen campus groups lost their organizational status in 2012 because they wanted to choose their own leaders based on religious belief. A nd there are just many more campus fellowship groups from University of -- State University of New York or the Cal State system who've lost -- have been driven off campus . And, you know, Harvard Professor and former Obama administration appointee Cass Sunstein has warned that when a group becomes ideologically homogenous, it tends to drift farther and farther in that direction and become more hostile to outsiders. But it's reason . ",1.0
against," My adversaries have made some really cogent points this evening, and so as an actual campus Leftist, I look forward to denouncing them as bigots . But before I do that, I'd like to take a step back and talk a little bit about the campus . What the actual, average American campus is like today . The American campus today, as it has been in the past, is a site of robust and passionate debate . And that's true not only because it's a place of learning, but also because it is a haven for young people . And the reality is that most of us, a t some point in our lives, give up on debating people we profoundly disagree with . We decide that it's too hard, it's too uncomfortable, it doesn't usually work. And so, we give up . But college students haven't given up yet. And so, they argue, incessantly and angrily . But here's the thing. In my experience, on campuses across the country -- and this is backed up by my opponent's o wn data -- where free speech is curtailed on campus, it's overwhelmingly not by students or campus liberals, but by administrators who are motivated not by ideology, but by opposition to disruptiveness and clamor. A perfect example of this is a case that many critics of campus leftism and campus liberalism have talked abo ut -- the case of Robert Birgeneau , the former chancellor of the University of California Berkeley, who, as Berkeley chancellor, presided over the arrests of dozens of peaceful, non- violent student protestors on multiple occasions, including one occasion in 2011, where students who were demonstrating peacefully were beaten viciously by campus police with batons . After he stepped down as Berkeley's chancellor, Birgeneau was invited to give a commencement address at Haverford College in Pennsylvania. And some Haverford students were understandably not so happy about this . So, what did they do ? Did they burn down the building ? Did they lock him out? Did they beat him with batons ?  They did none of those things . What they did is write a letter. They wrote a long letter expressing their concerns in which they offered suggestions for how he could repair the harm that he had done to civil liberties at Berkley . And they urged -- that was their word -- ""urged"" him -- to -- as they put it, ""confront the issues be fore you."" If he didn't do that, they said, they would ask the college to withdraw his invitation, a request that they had no power to enfor ce. In a two -line reply, Birgeneau said that he would not respond to what he called their “violent verbal attacks. ""  He wouldn't meet with them . He wouldn't respond to the claims that they had made . He wouldn't debate them . And in fact, he wouldn't even come to their campus . He withdrew his decision to come and speak at their commencement. Now, FIRE has written about this incident many times . Op-ed writers all over the country have written about this incident. And every time they do, Birgeneau -- an administrator who presided over the beating and arrest of student protestors -- isportraye d as a free speech martyr. Well, the students who had just wanted to talk to him about that -- are portrayed as his oppressors . And I say that that is absolutely wrong . I say that is absolutely backwards . Now, I'm not asking you to embrace every argume nt made by every member of the campus Left, because frankly, some of their arguments are really bad arguments . But speech that nobody opposes is not speech that needs protecting . And there's a recurring tactic that we see in critics of the campus Left in which students who are engaging in free speech are condemned as violent or condemned as censors . And you know, hyperbole is free speech, whether it's the hyperbole of students calling a speaker who said something unfortunate a racist or the hyperbole of an administrator calling a polite letter a violent attack . Demonizing your opponents is free speech . But so is refusing to demonize them . And that's what I'm asking you to do today . I want you to vote against this motion, because it's not liberals who are stifling free speech on the American campus, but bureaucrats . Bureaucrats who are scared by the rowdy, messy vitality of the marketplace of ideals -- ideas . So, what I'm asking you to do here is to stand up for free speech on campus -- the freedom of speech of the Left and the Right and the Center by voting against this ill -conceived and prejudicial motion . And I'd just like to close by saying one thing . A few days ago we lost a champion of speech and debate and dialogue in this country, David Carr, who wrote for the New York Times. And on the stage at the Intelligence Squared debate s a couple years ago, he said something that I would just like to quote to you now . He said, ""I urge you to vote against, against, against this motion which is per se dumb."" ",1.0
against,"Oh, yeah, sorry. I will do that . That's right, you are -- you are my actual audience as well as ""the"" audience . So, okay, so the folks who have drawn up these speech codes are for the most part not intending to impose ideological conformity . They are trying to keep trustees happy, they are trying to keep alumni happy . They are trying to avoid having parents feel like their kids who they think of as still children are living in a den of iniquity . And so there is certainly a tremendous amount of pressure from the top to keep things calm on the campus . But that's a very different thing than an attempt to impose ideological conformity . And in fact, in the 2015 speech code report that Fire just produced, they cite that the setting aside speech c odes which are not currently being enforced, they cite 15 examples of freedom of speech violations and 12 of those are nonideological, things like people getting -- students getti ng written up for passing out constitutions on campus . That's not anti - conservative. -- that’s anti -free speech.John Donvan: -- your opponents respond to it. Who would like to take that?",2.0
for,"I'll -- I think I can start with that. I mean, it was interesting to have your own research sort of cited, because when we watch how these codes are written, you know, as I said, they came from liberal thinkers, they came from the C atherine MacKinnons. They are used disproportionally against conservative points of view consistently . And the idea that, yes, absolutely, administrators are largely the big problem, and they have been, and I'd be willing to say that. But the administrators themselves lean overwhelmingly left . It's 96 percent donations to the Obama campaign came from --when you take staff and faculty together . So, they're using the same tools . And just -- and I really have to say, the -- I have seen genuinely heartbreaking case of things that you should never do to people coming from administrators that are very much left. There was the University of Wisconsin case where they were telling a student he couldn't have a Bible study meeting in his own room on his own time because people knew he wa s an Evangelical Christian . They might find that offensive . Again, I'm an atheist, but that's wrong.",2.0
