,Speaker,Script
0,Andrew Keen,"Well, I certainly expect a better outcome, because our voters are humans rather than machines . So I'm trusting you to do a good job tonight, all of you out there."
1,James Hughes,"Transhumanism is the belief that our descendants will be strange and wonderful, that humanity is a work in progress, that we can use technology to be smarter and happier and live longer and healthier."
2,James Hughes,"My partner is the renaissance woman, Martine Rothblatt."
3,Martine Rothblatt,Thank you.
4,Jaron Lanier,"Hey. I can't possibly be talking about artificial intelligence right now without remembering Marvin Mi nsky who is my dear mentor who just passed away very recently. And Marvin was infinitely sweet to me. And decades ago we would have the same argument, more or less. The spirit was a little different though because back then it seemed a little clearer where the line was between the philosophy and the technology. So Marvin would argue the hard AI position and he was largely the author of a lot of the ideas that I suppose I find myselfarguing against now. Oh, but he loved to argue. And I just remember these arguments with such joy. And I wish that people who have come along since retained that sense of open -mindedness and didn't take it all so seriously. I feel as though the ideas about AI have evolved into something of an o rthodoxy, where they started off as an element of good humor and camaraderie. And I regret seeing that. And I wonder if similar progressions happened with some of our great religious and philosophical traditions. It's been interesting to see it. So, fr om my perspective, as a practitioner, I must add, I -- my friends and I sold the Machine Vision company to Google. I'm in the thick of it. I'm not anti -AI algorithms. I make them, you know ? And I'm fascinated by them. So, from my perspective, there has to be a division made between the work itself -- the engineering and the science on the one hand, and then on the other, the storytelling about it, the narrative that we have about it, the fantasy life of it -- perhaps the religion of it. These are two distinct things. It doesn't mean one is good and one is bad, but they're just different sorts of beasts. So, to say, ""What is the promise of an area of research?"" We fundamentally don't know. It's research. It's basic research. We just ob served gravity waves for the first time. Does that mean we'll suddenly have anti -gravity devices ? Well, you know, maybe someday. We have absolutely no clue what we're going to discover. And in the same sense, we currently don't know what a thought is, in terms of scientific description. We can kind of find collections of neurons that seem to active at certain times. It's provocative. We can replicate certain functions. It's provocative. Do we understand how brains work? No. And yet, the work is fascinating, the work is important. A lot of our existential threats as a species involve great complexity. We wouldn't even know about climate change if it weren't for masses of sensors networked together that would allow us to get a big picture. We would be blind to our perils without it. So, to say that there isn't promise in pursuing science information systems and sensing systems, and algorithms to understand it all, like the -- it would be crazy to argue that. I can't imagine any serio us person taking that position. So, the only form of this proposition that I can possibly argue against is this other realm, th e fantasy life, the culture. And here, I do find myself not enjoying it. And I'd like to just say a few things about where it fails. And this is rather personal, perhaps , but I will share it with you. One issue is, as an engineer, if I say, ""Oh, I'm making this algorithm into something that's intelligent,"" or conscious, or whatever -- or cultured, or whatever it is -- form an engineering point of view, I can't define those terms. So, it makes me nuts. I have no baseline. And this is a really crucial, crucial point. A lot of the systems you call smartsystems are kind of derailed from the empirical process. As an example, I frequently review student work. And some people say, ""Well, here I've made an intelligent system. For instance I saw a machine that makes beverages."" And it had quite fancy software. And it's to choose the beverage for a person. People found it hard to use. And what I'm saying is nobody cares how fancy your algorithm is. The only thing you can measure is how well the machine works, in the end. So, if you don't define a baseline that's measurable, you're off in fantasy land. And this -- t his might seem like a bit of a wonky point to you, but it's absolutely crucial. Engineering without clear concrete grounding in reality goes off the rails and does become dangerous. So, for a more important example, if you have some sort of d rone that goes around killing the wrong people, whether it did so because of an intelligent algorithm that made the wrong decisions, or just because it's malfunctioning -- who cares ? That distinction is not actionable or meaningful. The only thing that m atters is whether people can use machines that we design responsibly, with intention. That is the meaningful question. Everything else is fantasy. And so, adding this whole layer about power transcending and everything, it's -- it just confuses matters. There is an economic angle to it. I love automatic machine translation. I love that you can go online and get something converted to German automatically. My own lab does that. We have real -time Skype translation now. But the only way we do it is by scraping the efforts of millions of translators who don't even know what's happening to them to get the examples. And in order to have the fantasy that this thing is a free -standing creature, we're pretending t hese other people don't exist and we're creating potentially a massive wave of technology -driven unemployment that doesn't need to happen. We shouldn't be shrinking the economy over a fantasy, if we just acknowledge that the people are just contributing in new ways. Their Go games are informing a Go algorithm. Pay those people instead of having to resort to some sort of weird socialist solution. You know, this fantasy of these artificial creatures makes us ignore our own lives, our own contributions. And so, it creates a needless eco nomic peril -- absolutely silly. But then I have to say something else. I understand that for many people, these ideas of AI have become very tender and dear to them. They've become part of the way they think about their lives, and their loved ones, and their future. They think they might become immortal or something. I have absolutely no interest in ridiculing or opposing that. I absolutely believe in religious free dom, and I would never, never, never speak against somebody's beliefs. I respect them. All I askfor is the separation of church and state. Without a separation of church and state, there can be no religious freedom. Never more true than when it comes to AI."
5,Martine Rothblatt,"Thank you. It's my pleasure to speak on -- in f avor of the motion that we should trust the promise of artificial intelligence. And in thinking about this question, I thought the major theme sort of orbited around three key words. And these words came to me when I asked myself, ""Well, what do we mean by the promise of AI?"" As Jaron said so well, there are so many different words thrown around. Define your terms. So, to me, the promise of AI revolves around the three terms: replication, and application, and then fascination. So, with regard to replic ation, the promise of AI is that we will be able to replicate the human mind. And that is a -- you know, a startling statement. It's a -- kind of an awe -inspiring statement, because, I think, for most of us, for all the beauty and credulousne ss that we have about life around us, human minds are just like the most awesome things anybody can imagine. So now we're talking about replicating. The promise of AI is that we can replicate the human mind. But I believe that this promise will be fulfilled because we're not talking about replicating the structure of the human brain with the hundreds and billions of different subtle neural connections, of which, as Jaron says, we have slight knowledge. Instead, we're talking about replicating the functi on of a human mind, much in the way that we're not able to replicate a bird, that we're able to replicate flight. And certainly, the flight that we have with an airplane or helicopter is not the same as the flight of a hummingbird, but it's flight nonethe less. And the promise of artificial intelligence is not that we will replicate every little nuance of a biologically -human mind, but it will be a replication of human consciousness,nevertheless. The second term that to me kind of embraces the concept of the promise of artificial intelligence is the term application. So, from replication to application. What do we mean? The promise of AI is that this stuff will be good for things, that we will really have uses for artificial intelligence. Otherwise, why bother developing it? And in fact, lots of people all over the world are enthralled with the promise of AI. We talk about it being helpful in helping to navigate our airspace, our ground space, our traffic. We talk about it being helpful in terms of health care, discovering cures for new diseases -- for -- new cures for diseases. The application of artificial intelligence that I find most amazing is the application of it to diseases of the mind, specifically diseases such as dementia and Alzheimer's. And if we are able to go ahead and de velop artificial intelligence so that it can serve as a kind of mental wheelchair, something that a person that has lost a lot of the faculties of their mind can instead rely upon because it provides a pretty damn good replication of their thoughts, of their responses, of their ability to recognize loved ones and respond to one, the ability to talk and form sentences and have an interior sense of reality. That promise of artificial intelligenc e, I believe, will come to pass because there's an enormous demand for it. Everybody who thinks about it wants to contribute to it in some part, small or large, depending on their capability and their skills. So I think it's all of the incredible applica tions of AI that will pull AI forward into the future and realize its potential. Finally, once we've replicated our minds and once we've been able to develop applications that makes these AIs so useful to us and such an important part of our l ife, far more than a personal digital assistant, far more than a great educational tool. In fact, it's a mind. It's something that we develop a relationship with. The next thing that comes to me is fascination. We will love these AIs. We'll love them in the same way that we love our cats and our dogs, that we love our friends, ones that we see distantly or the ones that we see frequently, because if it is a replicated human mind it'll have all the cool features of human minds, being able to answer ques tions, be able to really frame the rest of the sentence before a sentence is finished, be able to feel empathy and when we're sad help us feel better and we're happy join in that joy. Now part of the fascination of AI is that I believe the fas cination part will only attach to the friendly AI, and this is why I believe when people offer a promise of AI as it being friendly and not be kind of the scary AI that you see out of Hollywood, I think that is a reality that we can expect to pass. Our fascination with AI will be for the AI that is friendly to us. We have no fascination with cars that don't stop when you put on yourbrake. In fact, we run from them. We have no fascination with stoves that when you turn on the stove they explode. We don't buy those. AI will arise in a natural environment in which humans are the agents of selection. We will select for the friendly AI and we will stamp out the unfriendly AI. So I believe that the promise of AI will be a good one and we should believe it because the environment in which AI evolves will be a human selection environment and the mass activities of hundreds of millions of people will select for the friendliest AI. This does not mean that there will never be bad AI. This does not mean that there will never be broken applications and that some replicated minds will be as messed up as people who are suffering from something like an antisocial personality disorder, but ultimately it will be the efforts of millions of individual hacke rs throughout the world in a decentralized process drawn forward by the promise of the positive applications of AI, such as helping to save relatives and loved ones that will result in a beautiful AI that will be the fascination of all of us and therefore will be a definite survivor in the future to come. Thank you."
6,Andrew Keen,"Thank you, John. So this is a big deal. V ery, very big deal. You just heard Martine given an extremely good speech in which she talked about replicating the human mind. Nobody laughed. You all sat there. You took that seriously, the notion that wecan replicate our minds, that they'll live forever in the cloud or some other digital space is not outrageous. Jaron might argue it's not practical at this very moment, but it isn't outrageous. This is a huge issue. The notion that we can replicate ourselves, our intelligence, our bein g, our identities, our souls, whatever other word you want to use. So this is not a debate irrel evant to the future. Indeed, it is probably the central debate of the 21st century for better or worse. Important to remind ourselves of this debate, we are not talking about trusting artificial intelligence. That is not what Jaron and I are arguing against. We're arguing that we shouldn't trust the promise of artificial intelligence. We're not against the technology in itself. That is not the subject of the debate tonight. Jaron talked about the Separation of Church and State. We talked about this over lunch today. What I think he means is that we need to separate the science from the belief. And, all too often in this enormously important debate about whether or not we should trust the promise of artificial intelligence, of smart machines that are indeed so smart that they are able to replicate us as a species both collectively and individually, Jaron is arguing that we're muddling them up. Jaron is arguing that there's too much state in the church and too much church in the state. And the philosophers are intervening. The philosophers are telling us that this science is good, is moral, is liberating. And that's, I think, the argument that our team is making, or certainly that I am making. It is that there's a problem not with the technology but with its promise, with the ideology around that technology. We already heard a little bit about it from Martine who talked about so mething called ""good versus bad "" AI. I have no idea who she can make those moral judgments. I have no idea how you moralize I -- AI unless you humanize it, which itself is deeply problematic. But the problem today, I think, is that the philosophers ha ve got hold of this technology and they're presenting it as liberation theology. At least some of them are. We've been through this, of course, before in the middle of the 19th century in the midst of industrial revolution. The philosophers got hold of that. Marx thought the Industrial Revolution would free us from work, would free us from inequality. He was of course entirely wrong. And we have a similar kind of discourse, a similar kind of philosophical debate emerging today about the promise of AI. We're told that this AI will liberate us from our bodies. That's really what Martine is saying, that we'll live forever, that our minds will be replicated, they'll be up in the cloud. We'll never die. If we go insane, if we get Alzheimer's , somehow our essence, our kernel will remain. We're told that AI will liberate us from work because we'll have these smart machines which will do our labor for us. They'll drive our cars. They'll do our medicine. We'll go to an artificial intelligent agent, an algorithm to be taught. Perhaps one benefit is we'll avoid lawyers, but apart from lawyers, I worry deeply about the impact of AI on the expert professions of the 19th and 20th century. T he very professions that represent the backbone of our economy. The problem with this promise is it's not being thought through. It's being thought through philosophically, idealistically. We're not thinking about it in the context of the real world. We're not thinking about it in the way in which these technologies -- and we've already had a great deal of example of this during the digital revolution, that in spite of all the great promise of the Internet, and I've written extensively about this -- in spite of all its great promise of democracy and egalitarianism and opportunity, it's actually created new elites. The promise of artificial intelligence, these grand philosophical frameworks, they forget about the realities. Jaron already talked about the art -- the AI of language being owned and peo ple of labor being appropriated. Who is going to own these platforms ? Will it be Google ? We all love Google, of course, in some ways. And yet, Google is the largest, the most valuable, the most powerful company in the world. Google are the ones who just made the breakthrough when it comes to this artific ial agent being able to play Go. Google is pouring billions of dollars into AI, as is Facebook, as is Amazon, as are the other giants of Silicon Valley. Do you trust these guys to benefit mankind? Do you think they care about us ? These aren't bad people or bad companies, but they're focused on profit. They're focused on monopoly. They're focused on owning that technology. We haven't t hought this stuff through. The promise is scary. The promise is that the technology is moving way faster than we are -- politically, culturally, existentially. We're not ready for this yet. We're not ready to replicate ourselves, whether it 's in 50 or 100 years. We haven't thought it through. We can't imagine the cultural, the social, the economic impact. We haven't thought about AI and the way it will destroy labor, destroy jobs. What are we going to do when we have these machines that do everything for us ? How are we going to create value ? How are we going to feed and clothe ourselves in a world where all this technology will be owned by increasingly monopolistic companies ? So, we can't, at themoment, trust AI. We can't trust its promise. One day, perhaps. But there are a lot of problems still to be resolved. And for the moment, I would strongly argue that you should not trust the promise of AI. Thank you."
