,Speaker,Script
7,James Hughes,"So, it's been very useful. We've narrowed down to, I think, what is an intelligible question, because obviously, Martine and I don't want to defend the most extreme hyperbole in this debate. But there is an ideological question around promise. And it's an ideological question that I would frame as the promise of human intelligence itself. And that is that artificial intelligence is a crystallization, a condensation, a manifestation of human intelligence, an extension of our capacity. And the promise is the same promise that we have been suggesting since the Enlightenment, that human beings, by taking control, by understanding how we think, and understanding the world -- that we can take control of the natural, and political, and social circumstances that determine our affairs and make a better world. Now, the anarchist philosopher John Zerzan , I think, has the most trenchant critique of this. He thinks we went off the rails when we invented symbolic thought. As soon as we began to have lan guage, we were downloading the contents of our minds onto external storage media and uploading them again through our eyes -- we became cyborgs. That was the beginning of the end of the human project. I would argue that if you share my intuition that it' s better to be alive in the 21st century than to have been one of our hunter -gatherer or peasant ancestors, an intuition that it's better not to have a gutful of intestinal worms, better to live to 80, better to have literacy, better to be less likely to b e killed in a violent death, less likely to live in a life of slavery and oppression -- there is something about modernity, and this promise of the Enlightenment, that I think we should explore. And artificial intelligence, I would argue -- I have a slightly different definition that Martine does. I would argue that artificial intelligence has been with us for a while. Artificial intelligence can be reframed as the codification of the way that we do things together. Civilization is a form of artificial intelligence. It's what allows us to build cathedrals, and aqueducts, and banking systems. It's what allowed us to create laws and universities, and standard operating procedures. And today, that crystallization is taking the form of workers figuring out how to make things faster, and better, and smarter. And yes, change in the nature of work and ways that we should discuss. Today, artificial intelligence is applied to our genomes, to our healthcare systems, to trying to figure out how to diagnose and treat disease in ways that yes, no one physician or nurse will ever be able to comprehend, that we will be able to put in the hands of every healthcare provider and in the hands of ourselves. Those tools which will allow us the empowerment of understanding our own bodies. And this AI today is allowing us to understand the ecosystem, allowing us to understand the myriad of consequences that we are wrought -- that we have wrought on the ecosyste m, to mitigate, to predict, and to reverse those trends. It is also armies figuring out who to kill and how to kill the most efficiently. It is also advertisers and totalitarian governments figuring out how to suppress dissent and how to manipulate opini ons. It is stockbrokers trying to figure out the best ways to exploit workers and accumulate wealth into the hands of the .1%. So, reason and technology can be applied to all these different ends. And the question of the difference between one end and t he other is a value difference. It is a difference that comes out of the values, as I said, of the Enlightenment. If we fight for free and equal societies in the future, the applications of technology -- including artificial intelligence, will be applied in free and equal ways. But our decisions to be pessimistic about artificial intelligence will have no effect on the application by China or North Korea, or other authoritarian regimes. It is our own embrace in liberal democracy of these pow erful tools, making our society as strong and as effective as possible that will determine its future. So, future AI will allow us to understand the complexity of the genome, unlock health and longevity for our children. It will not determine whether the re's universal access to health care. That is on us. Future AI will allow us to displace routine labor and make possible abundance and leisure for all. But it will not tax the rich. It will not determine if we create a safety net, and universal basic income so that we can all benefit from that universal abundance. That is on us. Future AI will allow us to make better collective decisions, to understand the consequences of our actions. But it will not determine whether we have a totalitarian governmen t or a democratic one. That is on us. Focusing on AI as either a panacea or a cause of social ills is a distraction from the political project that will allow us to use AI and all technologies for good versus ill. It's the flip side. Technol ogy itself does not determine these outcomes. We need to focus on creating the political contexts so that these powerful tools, the productive tools that we've been working on for tens of thousands of years, will be applied in the best possible way. So, I urge you to vote against this proposition, the proposition that we not trust the promise of AI, because if you do vote for it, you are voting against the promise of human intelligence itself. Thank you. John Donva n: Thank you, James Hughes. And that concludes Round 1 of this Intelligence Squared U.S. debate, where our motion is Don't Trust the Promise of Artificial Intelligence. Now we move on to Round 2. And in Round 2, the debaters address one ano ther in turn and they take questions from me and from you, our live audience here in New York, at the 92nd Street Y. The motion is Don't Trust the Promise of Artificial Intelligence. We've heard Jaron Lanier and Andrew Keen argue that ""don't trust"" side. They're saying that the central debate of the 21st century will be this one -- that they are not against the technology itself, but they are against the promise, as it has been laid out. They just say that the implications of this world of AI are not be ing thought through, that -- it's less about the technology, actually, than about a belief system -- and a self -deluding one, they say, at that. They also point out that most of us -- or those of us who are in the expert classes are very likely to be out of a job, that the whole issue has been oversold. The threat to expert professions is real, and that the promise itself is actually scary. The team arguing against the motion -- and that is to say, they are arguing to trust it -- Martine Roth blatt and James Hughes -- they are actually describing artificial intelligence, when all is said and done, really, as no more than a set of tools -- tools equal to other tools that we have used throughout history. They say that the promise of artificial i ntelligence itself is obvious. It's the promise that the human being can create technology that can make a better world, not a new story. They laid out the vision of replicating a human mind, not in its structure, but in its function. And they say that an artificial intelligence -- if managed by us, and the choice to manage is ours, has the potential to be good, to be useful, to navigate, to cure -- especially to cure diseases ofthe minds, and that it can evolve in an organic and friendly way. So, what we have here is obviously already a discussion, and quite a complex one that is as much about physics as it about metaphysics, and as much about technology as it is about philosophy. And we're going to cut through -- cut some of the arguments that have been made into smaller pieces and present them again to take some of what each debater has said to the other side. And I want to take first to Jaron Lanier -- your opponents have said, quote unquote, ""We will love the artificial intelligences in our lives."" A really powerful assertion of their bottom line that what's there has great promise. It's going to do great good. We're going to become comfo rtable. We're going to become familiar. They will not be alien. They will be part -- something that is part of our world such that we are glad they are there and they are not unnatural. Will we love the artificial intelligences ? Or at least can you respond to your opponents ’ assertion to that point?"
8,Jaron Lanier,"You know, people are -- we're social. We want to be decent and if we're presented with an artificial character, even the ones that exist today, the Siri or the Cortana, we'll be deferent to them. We'll give them a shot. We find it funny. They're cute. And it can be harmless. If you take it too seriously the problem is that you kind of lower yourself to make the computer seem smarter and we see zillions of examples of this. A big one going on now in education i s teaching to the test because the -- you know, you teach to make yourself look good to the algorithm rather than the actual teaching and the algorithm doesn't quite capture it, and that's just one example of many. I'd like to respond in sort of an unusua l way. If you're interacting with Siri or Cortana you might think well, I'm not that different. I'm just a more complicated version of a Siri, in virtual reality this other technology you might be familiar with, I've had exactly the opposite experience. When you're in VR you can turn into some weird creature. You can turn into some weird crab or something and the whole world can change and yet you remain there hanging and I feel as if you notice that your consciousness is this real thing. And I find th at experience just amaz ing. When everything becomes mutable suddenly you realize wow, there is some consciousness thing that's not j ust mechanism, at least to me, and I understand this is a personal belief and we can argue ourselves into the ground round and round about this thing. But what I want to say is that if what technologists are doing is telling people hey, you're not so special, our machines are just like you, we shouldn't be surprised if people then respond by saying well, we don't trust your medicine. We don't trust your modernity ,and I see kind of a unified backlash against arrogance in everything from the anti -vaccine movement to fundamentalist --"
9,Martine Rothblatt,"Thanks. I have no doubt that we will love o ur AIs just as much as we love our pets, which we also create and end up making themselves into a relationship with us. I could not disagree more with Andrew. I mean, I just imagine that he's creating AIs , this fearful creature that will take our jobs away and it reminds me of somebody standing up in the middle of the 15th Century and saying you know, don't trust the promise of the printing press. The scribes shall have nothing to inscribe. And instead -- and you could paint this whole same parade of horribles, you know, the church will control all the printing presses. Instead we've had a of cognization. We have a new type of person called a bibliophile that loves books and we will have AI philes that will love our AIs. This is, as James said, an enormously empowering and liberating force of AI, and what's most important is that we the people make sure that access to AI is available to everyone and since it will be the hackers, millions of them, d ispersed throughout the world that create this AI out of open source software, I think there is nothing to fear and I would argue against the motion."
10,Andrew Keen,Sorry. Say that again. John Donvan:Was -- were you fairly characterized there ? Are you against printing presses ? Or would you have been ?
11,Andrew Keen,"As a writer absolutely. So, yeah, this is a typical kind of argument that we always fall into in these kinds of debates. Jaron and I will say we have to worry about this stuff. We have to worry that it's not doing what it says it's going to do. And then someone like Martine will come along and say oh, you're just whiners, pessimists. Just look at history. Just look at the history, for example, of the printing press. I don't know how many jobs, by the way, the invention of the printing press caused and one of the consequences , of course, of the printing press was the reformation and the Hundred Years War and a lot of other kind of suffering. So, it's a rather muddy consequence firstly. That's the first problem. The second problem is more substantial. Because he's making an evangelical spiritual argument. His argument is hopeful. He's saying well, in the past it's always worked out okay, so it will work out again in the future. And he's absolutely wrong when it comes to technology and jobs. The fact is most major economies, most researchers, most people who spend their living figuring out what we're going to do in this world cannot figure out what people are going to do. He talks about cuddly AIs. That's not a job. There's no labor there. He talks about open source , absolutely nonsense. Open source technology has had no successful in today's digital world. The four largest companies in the world today, the four most valuable companies in the world today are Facebook, Google, Microsoft, and A pple. And these four companies are the owners of the platforms of our networked age. Where's open source at ? Open source is just another ideological dream. It never happens and it -- I doubt it will ever happen."
12,James Hughes,"Sure. Well, see, I believe in technological unemployme nt. It's actually -- I've been trying to make the argument for a decade now that -- of the inevitability of technological unemployment and that we need to start anticipating it. It's actually a hard argument to make right now because employments beginning to pick up again. But I believe in this inevitability. But I'm one of those lefty folks who I've heard the last 200 years think that eventually freeing us all from wage slavery might be a good idea. And that if, in fact, people started to see that -- the inevitability of the elimination of work, that we might all wrap our minds around the concept that there might be something better to do than all have wage slave jobs. Just as we wrapped our mind around social security and Medicare and Med icaid and the British National Health Service and so forth, the progress of social welfare legislation is, yes, that bad stuff happens like the industrial revolution and then we responded. So I think that we have to sort of imagine that we'll be able to do that again because people are already talking about what the necessary response is to technological unemployment should be."
13,James Hughes,"Like to see go away ? I don't -- I think there is probably no definition of futility of it other than -- no worse definition than knowing that the machine next to you could do the job that you're doing faster, better, and safe r, but that you're forced to do it because somebody says, ""You can't use that machine."" So, yes, I think in the future there will beall kinds of machines that do all the jobs. I basically -- I think that everything that we do will eventually be done bet ter and faster and safer by machines. But the things that are most immune right now are the creative jobs. So, you know, my daughter's an opera singer. She's probably relatively immune. I -- you know, if opera could be replaced, it would ha ve been replaced by record players and radio a long time ago. So I think, ye s. I think there will be many things that will be replaced. And what it will do is free us up like Andrew proposed to the Marxian vision that we'll be able to be farme rs in the morning and poets in the afternoon if that's what we want to do, a life of true choice. That's the vision of the future I have."
14,Jaron Lanier,"So, look, there are two problems with this. First off, there's a pheno menon I call, ""premature mystery reduction,"" which is when we pretend we have something working that we really don't. So right now, most AI actually depends on scooping up things that people do, including the Go program today which is looking at people's Go games, and the machine translation example. Now -- we want to pretend that there's this AI behind the curtain that's freestanding. But, actually, there's millions of people there, too. Now, the problem with saying, ""Well, we'll ju st pay everybody a basic income and then pretend they're not valuable,"" when they are is -- it's -- first of all, it's a lie. Secondly, it --"
15,Jaron Lanier,"It's a lie because they're still needed. I mean, this is like crazy."
16,Jaron Lanier,"Well, he's wrong, technically. I'm sorry I have to pull that on you. The truth is that in order to make machine language work, you have to scrape millions and millions of real translations every single day to keep up with current events and frameworks. So what -- so you're factually wrong to say that they're not needed. Now, if someday -- you could say, ""Well, somebody maybe they wo n't be needed."" But, you know, the problem ofthat is this premature mystery reduction. I mean, yeah, someday we might be able to float because we understand gravity better o r something. I am an optimist. I don't want to believe that we'll always be stuck with our current level of knowledge. So I'm -- in a sense, I'm a transhumanist. But I just believe that it's a fundamental unknown what the timeline is. That's what science is. Science is what we don't know. So we don't know. A nd so we shouldn't pretend we know. That's lying to ourselves. It's undignified. It's petty. It's silly. It's childish. But also -- I'm sorry, but -- you know, but -- -- the other -- the other --"
17,James Hughes,"But there are things -- J aron Lanier: But, but, but, but, but, but, but no, no, no. There's a peril. T here's also great peril in what you're suggesting. If we say, ""Instead of taking the dignified path and admitting that people are still needed, if we pretend they're not needed and then we have some agency that doles out basic income to them as if they weren't needed, you really think that thing's not going to be a magnet for corruption? Every history lesson teaches us that, that's a huge peril. J ohn Donvan: Okay, I'm going to break in there."
18,Jaron Lanier,Don't step into that problem.
19,Martine Rothblatt,"we’re down talking about facts and figures here, because I don't think that the facts support the idea that new technological innovation, such as AI, result in mass unemployment. In fact, there are today, with our global population of almost 8 billion people, vastly more pe ople employed doing things than there ever were in the annals of history. You could imagine that before the turn of the 20th century, back in the 1900s, over 95 percent of all people were on farms. And somebody would make a very sensible argu ment, saying, ""We can't allow in tractors and things that steal our techniques for harvesting vegetables and food, because then all these farmers would be out of work."" Instead, now we have less than 10 percent of the global population raising food. The average nutritional content of everybody, on average, is much higher. And there's vastly more people doing vastly more interesting jobs and passions than ever before. We are an intelligent, creative species. It is in our DNA to solve problems . We wouldn't be here today if we weren't super good problem solvers. In the past, we were farmers, and then carpentry. Now, coding is the new carpentry. We will figure out new and amazing things to do."
20,Andrew Keen,"No I . Look, there's nothing wrong with -- John, there's nothing wrong with optimism. I mean, as long as you're optimistic about -- and you're realistic. And by the way, Jaron , I didn't know you were transhumanist. If I'd have known, I wouldn't be on your team. Jaron Lanier I meant, you know, within the context of how unknown it all is, you know?"
21,Andrew Keen,But the unknown unknown. Right? That's transhumanism. Jaron Lanier Yeah . I’m a Rumsfeldian transhumani st.
22,Andrew Keen,"now. And by the way, I have no idea --"
23,Andrew Keen,"-- what our te am -- our t eams seem split . On the one han d, we have one guy saying that he's celebrating the elimination of work. And then Martine is saying that actually, we're going to innovate so much that everyone will have new jobs. So, you guys have got to make up your mind, whether you're for or against --"
24,Andrew Keen,-- jobs.
25,James Hughes,And we will have artificial intelligence taking care of us.
26,Andrew Keen,But can -- John Donvan:All right. Andrew --
27,Andrew Keen,"Can I just say one thing? That -- we're sort of talking -- in these kind of debates, everyone's throwing, you know -- we know this from the presidential debates -- everyone's claiming the facts are on their side. But the reality is is when you look at the numbers, when you look at the serious research, you will find that the vast majority of economists are deeply worried with this, Martine. What -- give me some example s of economists who say, ""Yeah, there's going to be millions of jobs in the future. We don't need to worry about this?"""
28,Martine Rothblatt,"You know, I'm reminded of the famous quotation from Arthur C. Clarke , who said that if you ask a lot of experts in their field whether or not something is possible, and they say no, they're almost certainly wrong. And it's the same thing about the economists. They have been wrong repeatedly throughout history. So, going to a source like e conomists -- I would look at the bare fac ts. We've got eight billion people in the world, fewer people starving than when I was growing up. Vast ly more people employed. T hose are the bare facts. And furthermore -- furthermore , let me just say one more thing. We're just at the beginning of what we can do as a human species. We've got things like electric cars from Tesla that just 10 years ago, all the economists, and the technocrats, and the bureaucrats dismissed as impossible. Now people are saying, ""Hey, soon the whole economy is going to be electric."" If you are a person who loves life, you will never run out of cool things to do."
29,Jaron Lanier,"Martine, I want you to be right. And I think you probably are, in the sense that there will be new things for people to do. All we have to admit is that people need to do them and that they could be paid for it, and then we can still have dignity. The only danger is not so much that people become obsolete. The danger is that we'll pretend they're obsolete."
30,Martine Rothblatt,"Absolutely. And already, the Europeans are leading the way to -- J aron Lanier : So, you agree --Martine Rothblatt: -- guaranteed annual income -- J aron Lanier : You know, the is screwed here."
31,Martine Rothblatt,"There will be social dividends that -- it's just like Bernie Sanders says. Medicare for all. Social Security for all. So, there will be a basic social dividend that's paid for everybody. We can afford it. Let's do it."
32,James Hughes,"Well, I do think that there's a great deal of mystification about the nature of artificial intelligence in the future. Martine has a fairly embodied notion of what artificial intelligence would be. Mine i s much more diffuse. I think that the potential space of what artificial intelligence will be in the future is , it's very difficult for us to imagine. So far we have a lot of anthropomorphic projection onto that state. Those who expect that something is going to jump out of a box is going to take over the world, the world has 10 seconds to defeat it -- I mean, that's an anthropomorphic projection of an adolescent, you know, male fantasy onto, ""Well, if I w as king of the world."" And I think, you kno w, it could be like -- a n artificial intelligence might just want to communicate with the -- with whales, or with the stock market, or with the stars. And grow like moss on the side of a mountain. I mean, we just have no idea what artificial minds are going to be like. So, yes. I think, if the project is to replicate a human mind and put human mind emulation into a machine, that's one kind of project. I f, on the other hand, self- awareness emerges out of the Internet or just through all the communications and information in the world, we have no idea what it's going to be like.John Donvan: Let --"
33,Martine Rothblatt,"I agree with James, because, you know, contrary to what Andrew said, the mass of people throughout the world are the ones who are creating our Internet. Websites were not created all by Google, and Amazon, and Apple. They we re created by literally millions of people creating the -- J aron Lanier : But then these things are appr opriated by --"
34,Andrew Keen,"All right. Let's use -- okay. Martine, let's use --"
35,Andrew Keen,"-- the example of Google. Google has created -- you know, J aron has defined artificial intelligence, I think, very intelligently, as the algorithm. Google owns the most valuable algorithm in the world. There's no secret sauce to that a lgorithm. It's not as if Larry Page and Sergey Brin at Stanford suddenly figured out, ""We're going to create this remarkably intelligent algorithm."" And --"
36,Martine Rothblatt,--
37,Andrew Keen,"Well, let me finish. No, l et me -- let me --"
38,Martine Rothblatt,You let him hold the most valuable --John Donvan: Do let him finish.
39,Martine Rothblatt,"-- operating system in the world, and they --"
40,Martine Rothblatt,-- that --
41,Martine Rothblatt,-- Google is today.
