id,title,date,for,against,For_Main_Points,against_Main_Points
d20120508,Ban College Football,2012-05-08,"['Buzz Bissinger', 'Malcolm Gladwell']","['Tim Green', 'Jason Whitlock']","['Football has no place in institutions of higher learning, where it essentially functions as a minor league for the NFL.', 'It is a billion dollar business that grows increasingly corrupt, where the average salary for major-college coach was $1.47 million and players see none of the revenue.', 'Growing evidence for brain injury and elevated dementia rates for football players—violence and suffering for the entertainment of others—have led critics to compare the sport to dogfighting.']","['Players learn discipline and teamwork, and unlike professional athletes, play for history, tradition, and school pride. For colleges, football teams help to build a sense of community and tradition among students and alumni.', ""Scholarships allow many young men to attend college who wouldn't otherwise have the opportunity, and playing for a university gives them access to first-class coaching and game experience."", 'There will always be risks involved in playing a contact sport, but education, rule changes, and better equipment can make it much safer without affecting the integrity of the game.', 'Revenue from sports like football and basketball go toward academics as well as subsidizing the cost of other college sports.']"
d20120417,"When It Comes To Politics, The Internet Is Closing Our Minds",2012-04-17,"['Eli Pariser', 'Siva Vaidhyanathan']","['Evgeny Morozov', 'Jacob Weisberg']","['The personalization of the internet—the use of algorithms to filter and individualize our search results—effectively insulates us from opposing points of view, reinforcing our beliefs, and making us more close-minded.', 'Before the internet we relied on gatekeepers to filter the information we received, making sure we got what we should know along with what we wanted to know. But algorithms, unlike newspaper editors, do not adhere to a set of journalistic ethics or a sense of civic responsibility.', 'We are being pushed in the direction of passively receiving information rather than actively seeking it out.']","['The effects of personalization have been overblown. Differences in search results are minor, at most, and Google, the dominant search engine in the U.S., actively works to limit personalization in its algorithms.', 'The internet has opened us up to new sources of information outside of the monopolies—three major news networks and local newspapers—we once relied on.', ""Living in an echo chamber is a choice. With so many so many news sources available, literally at our fingertips, you can't blame personalization for the narrowing of minds.""]"
d20120207,Obesity Is The Government's Business,2012-02-07,"['Dr. Pamela Peeke', 'Dr. David Satcher']","['John Stossel', 'Paul Campos']","[""Obesity is an epidemic. According to the CDC's National Center for Health Statistics, over 1/3 of adults and 17% of children are obese in the U.S."", 'Obesity is a major risk factor in some of the leading causes of death in the U.S., like heart disease, diabetes and cancer.', 'The government can and should provide leadership, education, and funds to fight obesity.', 'Obesity is a substantial burden to health care systems and economies. Medical costs related to obesity in U.S. adults are estimated to be nearly $147 billion per year.', 'We must decrease the availability of unhealthy food and increase its cost.', 'Studies have shown that taxes on unhealthy food and beverages and restrictions on television advertising can reduce long-term health costs.']","['Government has no business regulating private behavior; it should give people information to make their own decisions.', 'People do not bear the full cost of an unhealthy diet. If people are forced to bear the costs of their choices through privatized health care, they will have financial incentives to make healthier decisions.', 'There is no clear-cut way to determine what is healthy and what unhealthy food is.', 'We are unfairly singling out and punishing a group of people.', 'The obesity ""epidemic"" is overblown, and the scientific evidence to support claims of higher mortality is lacking.']"
d20120110,The U.N. Should Admit Palestine As A Full Member State,2012-01-10,"['Mustafa Barghouthi', 'Daniel Levy']","['Dore Gold', 'Aaron David Miller']","[""Even if nothing happens on the ground, becoming a full member state would elevate Palestine's status politically and morally."", 'Two decades of negotiations have gone nowhere, and Israel continues to build settlements. What are the other peaceful alternatives?', 'Negotiations have become counterproductive, and by going to the U.N. Palestinians are seeking a multilateral solution. Of the 193 members of the General Assembly, more than 120 support a Palestinian state.', 'According to the World Bank, ""if the PA maintains its performance in institution-building and delivery of public services, it is well-positioned for the establishment of a state at any point in the near future.""', 'A Palestinian state should be recognized along 1967 borders, including Gaza, the West Bank, and East Jerusalem.']","['The bid for full membership is largely symbolic. The Palestinians would first need 9 out of 15 votes from the U.N. Security Council, and the U.S. has already promised to use its veto power.', 'The only way to peace is through direct negotiations. Full membership to the U.N. would change nothing on the ground.', 'Going through the U.N. is a unilateral act that will derail peace talks, aggravating relations with the U.S. and provoking punitive behavior from Israel.', 'Declaring a Palestinian state along 1967 borders undermines future negotiations by taking away the necessity to compromise.', 'The Palestinian Authority is not in full control of the West Bank and Gaza, and therefore does not meet the requirements for a state.']"
d20111115,The World Would Be Better Off Without Religion,2011-11-15,"['Matthew Chapman', 'A.C. Grayling']","[""Dinesh D'Souza"", 'Rabbi David Wolpe']",,
d20111025,Congress Should Pass Obama's Jobs Plan - Piece by Piece,2011-10-25,"['Cecelia Rouse', 'Mark Zandi']","['Richard Epstein', 'Daniel Mitchell']",,
d20111012,Too Many Kids Go To College,2011-10-12,"['Peter Thiel', 'Charles Murray']","['Henry Bienen', 'Vivek Wadhwa']",,
d20111004,Grandma's Benefits Imperil Junior's Future,2011-10-04,"['Margaret Hoover', 'Mort Zuckerman']","['Howard Dean', 'Jeff Madrick']",,
d20110920,Men Are Finished,2011-09-20,"['Dan Abrams', 'Hanna Rosin']","['Christina Hoff Sommers', 'David Zinczenko']","['The era of male dominance is coming to an end. Women are increasingly seeking political and social power in the workplace, in government, and in their own homes.', 'Women are taking higher education by storm. Today, female students are the majority on most university campuses.', 'The modern economy, which prizes communication and creativity, is better suited to traditionally female skills and will likely continue to benefit women, over men, in the future.']","['Women are underpaid and underrepresented in the American workforce. Despite notable gains in the ability for women to seek and maintain careers, they are still a minority in the nation’s highest paid and most sought after jobs.', '\u200bFrom Capitol Hill to governorships to executive offices, men maintain the majority of economic and political power in the United States. Until women take the nation’s top seats of power, men are not finished.', 'Society will always rely on physical strength and brawn, traditionally associated with male workers, for critical occupations in fields like construction and the military. As long as those jobs remain in demand, men will be recruited and favored for jobs in the workforce.']"
d20110907,It's Time To End The War On Terror,2011-09-07,"['Peter Bergen', 'Juliette Kayyem']","['Richard Falkenrath', 'Michael Hayden']",,
d20110608,Freedom of the Press Does Not Extend To State Secrets,2011-06-08,"['Michael Chertoff', 'Gabriel Schoenfeld']","['Alan Dershowitz', 'David Sanger']","['A press that can publish state secrets without fear of prosecution endangers the nation.', 'Groups like WikiLeaks should not be able to, in the name of transparency, indiscriminately dump thousands of state secrets onto the Internet.', 'The press can be a flawed judge of what is in the public interest. It is no better at separating itself from its own interests than anybody else is, and unlike the organs of government, which are accountable to the public and each other, the press is accountable to no one.']","['There are secrets that should be kept, but it should not be up to the executive of the U.S. government alone to decide which of those secrets are worthy of keeping.', '""State secrets"" encompasses far too much. You cannot have a system in which you keep state secrets from being published if almost everything is a state secret.', ""Secrets are not merely published because they are interesting stories. They are published because there's a worthy debate that the public should conduct.""]"
d20110510,Clean Energy Can Drive America's Economic Recovery,2011-05-10,"['Bill Ritter', 'Kassia Yanosek']","['Robert Bryce', 'Steven Hayward']","['The current administration expects its clean energy policies to generate 800,000 jobs over the next two years, laying the foundation for lasting economic growth.', 'Consumers can save billions of dollars relying on clean energy sources and increasing energy efficiency, leaving more money to be spent on other goods and services.', 'Major investment in clean energy will lead to innovation and new technology.', 'Reducing dependence on imported energy frees us to spend our limited resources domestically and protects us from fluctuations in oil prices and climate change.']","[""The Department of Energy's own job creation estimates are far more modest than those of the President's Council of Economic Advisers."", 'A significant portion of clean energy funding has gone to foreign companies who have the advantage of having been heavily subsidized by their own governments for a number of years.', 'Clean energy jobs face the same problems any other industry faces—competition from cheap foreign labor.', ""A real green economy wouldn't rely on government regulation and taxpayer financed subsidies.""]"
d20110503,"Don't Give Us Your Tired, Your Poor, Your Huddled Masses",2011-05-03,"['Kris Kobach', 'Tom Tancredo']","['Julian Castro', 'Tamar Jacoby']","['While corporations benefit from the cheap labor illegal immigrants provide, American citizens are left with depressed wages and higher taxes to cover illegal immigrants_ use of government services.', 'Amnesty only rewards illegal behavior and punishes anyone who has gone through the process of entering legally.', 'The majority of illegal immigrants are here today for economic opportunity and this leads to a lack of assimilation that is essentially destroying the ideas and ideals that bind us together as Americans.', 'We need to enforce the laws that we have and secure our borders. The Center for Immigration Studies has used the government_s own numbers to deduce that simple, consistent law enforcement can reduce the number of illegal immigrants to half within five years.']","['You can_t wish away the millions of illegal immigrants who are already here, and prohibition has already shown the difficulty in enforcing unrealistic law. They must be given a path to becoming legal.', 'We must increase our immigration quotas. Even in this economic downturn there is a need for both high-skilled and low-skilled immigrants, and as the economy improves, this need will grow.', 'We need to help immigrants assimilate and we cannot underestimate the appeal of American values and our democratic way of life.']"
d20110405,It's Time To Clip America's Global Wings,2011-04-05,"['Peter Galbraith', 'Lawrence Korb']","['Elliott Abrams', 'Eliot Cohen']","['America will continue to take the lead, but the time for unilateralism is over.', 'Mired in two wars, our armed forces are already stretched dangerously thin.', 'The financial crisis has been a humbling check on the American economic model, and puts us in the position of having to make hard choices and reign in expansive foreign policy.', 'With torture, rendition, two unpopular wars, Abu Ghraib and Guantanamo, America has lost the moral high ground.']","['The effects of America withdrawing would be calamitous as there is no other country willing and able to take on the burdens of leadership.', 'We have not devoted vast energy and treasure to overreaching around the world and, in fact, we need to increase defense spending to support our global responsibilities.', 'We should do more to promote political and economic freedom.']"
d20110315,China Does Capitalism Better Than America,2011-03-15,"['Orville Schell', 'Peter Schiff']","['Ian Bremmer', 'Minxin Pei']","[""China has emerged from the global financial crisis seemingly unscathed. Europe's hope that it will tap into its $3 trillion in reserves for a bailout only solidifies its newfound economic dominance."", ""In contrast to the political gridlock in the U.S., China's authoritarian government has the ability to mobilize its resources—impressive investment in infrastructure is one—and to make difficult decisions quickly, without fear of political retribution."", 'Since introducing capitalist economic reforms in 1978, China has lifted $300 billion people out of poverty.', ""With the 2nd highest corporate tax rate in the world, 35%, the U.S. is not business-friendly. China's rate is 25%.""]","[""A weak economic foundation, widespread corruption and growing inequality, will bring an end to China's unprecedented growth."", 'With its gross national income per capita at 7,570, China trails Ecuador, Kazakhstan, and Romania, and falls well behind the U.S. at 47,120.', ""An authoritarian government means that there are no checks and balances; gridlock or not, America's divided government was created for a reason."", 'Companies rarely pay the full 35% in corporate taxes. In fact, once adjusted for deductions, the average corporate income tax is on par with other industrial nations.']"
d20110215,The Two-Party System Is Making America Ungovernable,2011-02-15,"['David Brooks', 'Arianna Huffington']","['Zev Chafets', ""P.J. O'Rourke""]","[""The American people want alternatives, and what we've seen with the Tea Party and the election of an upstart like Barack Obama are grass roots, anti-systemic movements."", 'The two-party system has produced politicians who govern to the extremes of their political parties and there is a silent middle that is left with nowhere to go.', 'Both parties are beholden to large corporations and can no longer be trusted to serve the public interest.']","[""We've had choices outside the two-party system—libertarians, Ralph Nader, Ross Perot—but at the end of the day, people vote for the major party candidates."", ""Multi-party systems look good from the outside, and yes, governing coalitions can be made, but much of the time it's a prescription for a stalemate."", 'Conflict encourages the policing of power.', 'Americans like divided government. For 38 of the last 60 years, presidents have had to work with legislatures controlled by the opposing party.']"
d20110111,Repeal Obamacare,2011-01-11,"['Douglas Holtz-Eakin', 'John Shadegg']","['Jonathan Cohn', 'Paul Starr']","['Instead of reducing the deficit, the health care act will increase the deficit by $500 billion.', 'Insurance will become more expensive and health care costs will rise faster than they would have otherwise.', 'Millions could lose the insurance they already have and because of Medicare cuts, many seniors will lose access to care.', 'The mandate that all Americans obtain health insurance coverage is unconstitutional.']","['The health care act will reduce the federal deficit by $143 billion over 10 years.', 'The bill will expand coverage to 32 million who are currently uninsured and insurers would not be allowed to deny coverage to children with pre-existing conditions, cancel policies without proving fraud, or put lifetime limits on benefits', 'Exchanges would allow people not covered by their employers to shop for insurance at competitive rates.', 'While not perfect, this is an important first step toward providing universal health care.']"
d20101122,U.S. Airports Should Use Racial And Religious Profiling,2010-11-22,"['Robert Baer', 'Deroy Murdock', 'Asra Q. Nomani']","['Hassan Abbas', 'Debra Burlingame', 'Michael Chertoff']","['Continued investment in Afghanistan is economically misguided. After nearly a decade of combat, the U.S. has committed substantial financial and military resources to the war with few positive results: Afghanistan is increasingly violent and unstable.', 'Tribal divides threaten the agency of any singular governing body, and the Karzai administration has proven to be hopelessly corrupt and inept at creating a cohesive centralized government.', 'The threat of a Taliban insurgency pales in comparison to the global rise of al Qaeda. The United States should transition its efforts to combating terrorism around the world rather than investing its limited resources in the failed occupation of Afghanistan.']","['If the military fails to defeat the Taliban in Afghanistan, the region will again become a safe haven for terrorists and America’s defeat will embolden its enemies to engage in future aggression toward the United States and its interests.', 'While Hamid Karzai is a problematic leader, his administration has cooperated with Americans on key initiatives and has forgone mass violence in the name of political power, which marks progress from previous Afghan leadership.', 'Under General Petraeus’ leadership, the United States has begun a counter insurgency operation that promises to sway Afghan public opinion toward U.S. intervention and build effective governance structures in the country.']"
d20101110,Afghanistan Is A Lost Cause,2010-11-10,"['Matthew Hoh', 'Nir Rosen']","['Peter Bergen', 'Max Boot']",,"['', '']"
d20101006,Islam Is A Religion Of Peace,2010-10-06,"['Zeba Khan', 'Maajid Nawaz']","['Ayaan Hirsi Ali', 'Douglas Murray']","['There are over a billion Muslims in the world, and the great majority of them are peaceful, moderate practitioners of mainstream Islam.', 'The Muslims who have succumbed to violence are motivated by politics, not religion.', 'The word “jihad” has different meanings. It can be translated to “holy war,” but its primary meaning is “struggle,” and in the Koran, this refers to the internal and external effort to be a good Muslim.']","['No monotheistic religion is a religion of peace—they know lengthy periods of peace, but they also know lengthy periods of war. The militaristic history of Islam is well documented.', 'In 21st Century Islam, there are more occurrences of violence and war and subjection of women than there are in other religions.', 'The leaders of Islam, the heads of religion in Saudi Arabia and Iran, are the ones speaking for the religion, not Islam’s moderates.']"
d20100914,"Treat Terrorists Like Enemy Combatants, Not Criminals",2010-09-14,"['Michael Hayden', 'Marc Thiessen']","['David Frakt', 'Stephen Jones']","['We are a nation at war with al Qaeda and its affiliates. This war is global in scope, and only the laws of armed conflict will keep us safe.', 'The President, the Congress through the Authorization for Use of Military Force, and the Supreme Court through its Hamdi decision, have all declared that we are a nation at war.', 'The opposing side would like to give Geneva Convention rights to terrorists, even though they violate all rules of war.', 'The reason there hasn’t been another terrorist attack since 9/11 is because we abandoned a law enforcement approach to terrorism.', 'If you are taking the law enforcement approach to interrogation, patience is a virtue. If you are trying to stop a terrorist attack, patience is deadly.']","['We have a robust criminal justice system. Law enforcement works hand in hand with intelligence—they don’t wait until after a crime has been committed, they are working to detect crime before it happens.', 'It’s a misperception that reading people Miranda rights means they’re never going to talk. It’s true that some are advised to remain silent, but quite often, people will divulge a great deal of information.', 'Locking people up indefinitely without charge and subjecting them to a full range of interrogation techniques is fundamentally un-American.', 'Ask yourself: Should we sacrifice our ideals, our history, and our beliefs as a nation for security? And is this security real, or temporary?', 'We do have the power to detain and remove from the battlefield people engaged in active conflict. The problem is that the war has been defined in such amorphous terms that there’s a claim of a global battlefield that includes the United States.']"
d20100608,The Cyber War Threat Has Been Grossly Exaggerated,2010-06-08,"['Matthew Rotenberg', 'Bruce Schneier']","['Mike McConnell', 'Jonathan Zittrain']","['It is highly unlikely that any party would engage in a large-scale cyber attack on the United States unless they were also prepared to engage in the conventional warfare that would undoubtedly follow.', 'Nations are unlikely to attack a civilian computer infrastructure, even if it is vulnerable, because targeting civilians constitutes a war crime, and would likely lead to international retribution.', 'Though the threat of cyber war can be mitigated through diplomacy, international agreements, and improved national security technology, cyber war is used as propaganda to justify Washington’s control over, and regulation, of the Internet.']","['Cyber attack simulations have shown that America would be crippled by a cyber attack; not only is its critical infrastructure extremely vulnerable, but the government is also unprepared to respond to an attack.', 'Militaries must be prepared to address enemy offensives on all fronts, particularly given the devastating effects cyber attacks would have on individual nations and the global economy.', 'While non-state actors currently lack the capability to carry out massive cyber attacks, over time they will likely gain that capability and may be contracted by governments to attack hostile nations without formal declarations of war.']"
d20100511,Obama's Foreign Policy Spells America's Decline,2010-05-11,"['Dan Senor', 'Mort Zuckerman']","['Wesley Clark', 'Bernard-Henri Levy']","['Obama has slighted numerous American allies and brought into question not only the strength of American alliances, but the fate of existing international organizations.', 'The Obama administration has stepped back from America’s traditional role as a dominant global leader and allowed the growth of Russia and China, weakening the United States both at home and abroad.', 'Under President Obama, the United States has failed to halt Iran’s nuclear ambitions and it has failed to invest the resources necessary to succeed in Iraq and Afghanistan, thus contributing to the ongoing destabilization of the Middle East.']","['Since President Obama took office, the U.S. has enacted a series of stabilizing measures in the Middle East, including extending the withdrawal of American troops from Iraq, increasing troop presence in Afghanistan, and galvanizing the United Nations to increase sanctions on Iran.', 'The Obama administration rightfully embraced the role of other nations in global leadership and reduced international distrust of American leadership and interests.', 'Under Obama, the United States has been at the forefront of calls to unify the world in combating shared challenges, including climate change and nuclear proliferation.']"
d20100413,Organic Food Is Marketing Hype,2010-04-13,"['Dennis Avery', 'Blake Hurst', 'John Krebs']","['Charles Benbrook', 'Urvashi Rangan', 'Jeffrey Steingarten']","['Organic foods, which are marketed as a healthier alternative, do not provide substantial health benefits compared to foods produced on conventional farms.', 'While general pesticide use does not pose a major health threat to consumers, the natural pesticides used by organic farmers can be more dangerous than the synthetic pesticides used in conventional farming.', 'There are a billion hungry people in the world—we cannot ignore the trade-offs of organic farming, which requires more land and leads to more soil erosion than conventional farming.']","['Because organic farming prioritizes land conservation and biodiversity, it provides consumers the option of purchasing goods produced using environmentally conscious practices.', 'Pesticides, which are banned on organic farms, have been found to harm children and fetuses, and the runoff from their use creates dead zones, areas unable to foster non-algae life, in rivers and oceans.', 'Organic farm practices ensure animals are humanely raised and protect against antibiotic overuse, which has led to outbreaks of antibiotic resistant bacteria on conventional farms.']"
