id,title,date,for,against,For_Main_Points,against_Main_Points
d20141022,Income Inequality Impairs The American Dream Of Upward Mobility,2014-10-22,"['Elise Gould', 'Nick Hanauer']","['Edward Conard', 'Scott Winship']","['With economic growth funneled to those at the very top, the rest of America has suffered from stagnant and falling incomes.', 'According to EPI, ""in 2010, the bottom 90 percent received only 55.5 percent of all income and held just 23.3 percent of all wealth.""', 'As inequality grows, ""the consequences of an accident of birth"" become bigger. Only those at the top will have the resources to invest in their children\'s education and overall development.', 'Economic growth depends on consumption by the middle class, and as more and more Americans fall behind, the more volatile the economy becomes.']","['Gains by some do not mean losses for others. While the wealthiest have benefited the most from economic growth, this point does not cancel out the fact that the living standards of most Americans are better now than they were in the past few decades.', 'Economists have found that despite increases in inequality, social mobility has not changed since the 1970s. In fact, research shows that there is no relationship between high inequality and low mobility.', ""A thriving economy needs income inequality. It's the wealthiest among us who take on risk and invest in the innovation that benefits everyone.""]"
d20141007,Mass Collection of U.S. Phone Records Violates the Fourth Amendment,2014-10-07,"['Alex Abdo', 'Elizabeth Wydra']","['Stewart Baker', 'John Yoo']","['The NSA\'s metadata collection is both ""indiscriminate"" and an ""arbitrary invasion""that violates the Fourth Amendment.', 'The long-term collection of phone metadata ""reveals a wealth of detail about familial, political, professional, religious, and intimate relationships"" that once could only be obtained ""by examining the contents of communications.""', 'Various government officials have made clear that there are alternative means and modes of surveillance available, making such widespread violations of our Fourth Amendment rights even more unreasonable.']","['Once an American knowingly hands over information to a third party (i.e. a phone company), there is no longer a reasonable expectation of privacy. While the content of the calls remains protected under the Fourth Amendment, the metadata does not.', 'A Fourth Amendment search does not take place until the collected data is analyzed, which occurs only with probable cause on a very small fraction of the records.', ""Because this surveillance concerns national security, the government does not need to meet the Fourth Amendment protections reserved for domestic criminal activity. Data mining falls squarely within the president's wartime powers of intelligence gathering; as long as the information is not used in criminal proceedings, there is no need for individualized warrants or probable cause.""]"
d20140930,Flexing America's Muscles In The Middle East Will Make Things Worse,2014-09-30,"['Aaron David Miller', 'Paul Pillar']","['Michael Doran', 'Bret Stephens']","['Intervention often results in unintended consequences. We only need to look at Iraq and Libya, both worse off than before, as proof that American intervention in the Middle East has failed.', 'We need to put the threats from the Middle East into perspective. IS does not represent a significant threat America\'s national security or ""a new danger different from ones that have been around for some time.""', ""We need to work with other countries where there are common interests. If our priority is stability, it is in America's interest to work with Iran.""]","['The Islamic State is a growing threat to the region and the world. American nationals and thousands of Europeans are believed to have joined IS—we must fight IS overseas and not wait for the fight to come to us.', 'Under President Obama we have empowered Iran and its proxies and pushed our traditional allies away—the result will be an America without partners in the Middle East.', 'There is no other great power to step into the void if we retreat.', 'America would be among the last suffer from a breakdown of world order, but by then it will be too late.']"
d20140909,Embrace The Common Core,2014-09-09,"['Carmel Martin', 'Michael Petrilli']","['Carol Burris', 'Frederick Hess']","[""The Common Core is a set of clear and consistent standards, based on extensive research, that encourage critical thinking skills. They are designed to give teachers flexibility in how they teach to individual students' needs."", 'Higher and more rigorous standards will better prepare American students for college and the workplace, and help to close the achievement gap between students from different socioeconomic backgrounds. (Center for American Progress)', 'The Common Core has a great deal of support, from educators, the public, business leaders, and the over 40 states that have freely adopted its standards.', 'While the inaugural curricula face issues, these are growing pains in implementation, rather than flaws inherent to the instructional philosophy.']","['The Common Core was created with little input from teachers or the public, and there is no governing body tasked with oversight now that they are in effect. (New York Times)', 'These tougher, more stringent standards will do the opposite of their intent: instead of creating fairer, more equitable K-12 schools, they are widening the gap between the haves and have-nots.', 'School districts and teachers should have the autonomy to create their own standards and curricula at the local level, rather than being held to national criteria and impossible standardized tests.', 'The narrow focus of the Common Core standards places high value on certain skill sets while overlooking others, such as creativity, imagination, and vocational training.']"
d20140626,Individuals and organizations have a constitutional right to unlimited spending on their own political speech,2014-06-26,"['Floyd Abrams', 'Nadine Strossen']","['Burt Neuborne', 'Zephyr Teachout']","['Political spending is protected under the First Amendment. Of course money is not speech, but it enables free speech and facilitates expression.', 'Organizations corporations, unions, media outlets, and other voluntary organizations have the same First Amendment rights as individuals.', 'Limits on spending would mean less political speech in the public square.', 'Many campaign finance laws serve to protect incumbents.']","['Corporations and labor unions are artificial entities and should not be viewed as First Amendment speakers.', 'Without spending limits, the wealthiest among us have disproportionate political power.', 'Super PACs and the loopholes that allow for anonymous contributions have given rise to shadow campaigns, groups that are essentially extensions of a candidates campaign.', 'To argue that independent spending does not lead to, or create the appearance of corruption, relies on a narrow definition of corruption.']"
d20140507,Death Is Not Final,2014-05-07,"['Dr. Eben Alexander', 'Dr. Raymond Moody']","['Sean Carroll', 'Dr. Steven Novella']","[""Human consciousness remains a mystery. People may claim that it's produced by the brain and bound by the laws of physics, but the truth is that the origins of consciousness is a mystery."", 'Previously established by respected philosophers, from Plato to William James, mind-body dualism and the immateriality of the soul have been further supported by recent studies on the afterlife.', 'Near death experiences (NDEs), as well as psychic phenomena—experienced throughout history—provide strong evidence that consciousness exists independently of the body and thus, independently of physical life.']","['Humans, composed entirely of atoms, are part of the natural world and subject to its laws. Individual life and consciousness are not immaterial and thus cannot extend beyond physical death.', ""NDEs, the centerpiece of recent research, are purely anecdotal, descriptive accounts, which, despite some commonalities, are not evidence of a universal experience but rather reflect the subject's cultural background."", ""NDEs are simply altered mental states akin to the complex brain phenomena that occur in delusions, hallucinations, oxygen deprivation, and drug-induced experiences. There is no evidence that they have occurred while subjects' brains were inactive.""]"
d20140409,Millennials Don't Stand A Chance,2014-04-09,"['Binta Niambi Brown', 'W. Keith Campbell']","['David D. Burstein', 'Jessica Grose']","['Their financial outlook is bleak: Millennials have entered adulthood during a time of recession while burdened with unprecedented levels of student loan debt.', 'Millennials have been raised to be narcissists, ""characterized by overconfidence, entitlement, unbridled competitiveness, and lack of empathy.""', ""Millennials' tech savviness is superficial—they are no better or worse than at using technology than everyone else.""]","['Millennials are more optimistic, civic-minded and politically engaged.', ""They are the most educated generation in American history, and for those with a bachelor's or an advanced degree, it is paying off."", 'Millennials bring their tech savvy, adaptability and collaborative skills to the workplace.']"
d20140402,"More Clicks, Fewer Bricks: The Lecture Hall Is Obsolete",2014-04-02,"['Anant Agarwal', 'Ben Nelson']","['Jonathan Cole', 'Rebecca Schuman']","['Online education will modernize our academic institutions, which have relied on the same stagnant model for centuries.', 'MOOCs have the potential to democratize and equalize education at a global level, breaking down financial, social, and physical barriers to entry.', 'The internet provides spaces and tools that are far less costly and far more innovative than what the traditional classroom is able to offer and accommodate.']","['Online education cannot adequately supply the invaluable elements of the traditional classroom—direct interaction, guidance, accountability, and community building.', 'To enroll in online classes, students must already have access to computers and high speed internet. Rather than democratizing higher education, MOOCs reinforce educational barriers.', 'With its disparate accreditation systems and tenuous financial model, online education is not a sustainable replacement for brick-and-mortar institutions.']"
d20140312,Russia Is A Marginal Power,2014-03-12,"['Ian Bremmer', 'Edward Lucas']","['Amb. Robert D. Blackwill', 'Peter Hitchens']","['Seizing Ukraine will only isolate Russia further, exacerbating the problems it already faces.', ""Russia's economy has stagnated and its reliance on energy revenue—around half of Russia's total budget revenue comes from oil and gas—leaves it vulnerable."", ""According to a Credit Suisse study, Russia has the highest level of wealth inequality in the world, apart from small Caribbean nations with resident billionaires. 35% of Russia's wealth is owned by 110 people, while 93% of the population is worth less than $10,000."", 'Poor public health has led to a shrinking population.']","['Russia has 8,500 to 10,000 nuclear warheads and is actively working to replace aging devices and modernize its delivery systems.', ""Russia's influence in key regions—the Middle East, Asia, former Soviet republics—cannot be dismissed. Its power to veto on the U.N. Security Council means that Russia can and has blocked international action on many key issues."", ""It is a country rich in natural resources, including oil and natural gas. Gazprom controls nearly 1/5 of the world's gas reserves and currently supplies 30% of Europe's gas.""]"
d20140305,The President Has Constitutional Power To Target And Kill U.S. Citizens Abroad,2014-03-05,"['Alan Dershowitz', 'Michael Lewis']","['Noah Feldman', 'Hina Shamsi']","['The U.S. can use lethal force against a citizen abroad if he/she is a senior operational leader of al Qaeda or an associated force when they pose an imminent threat, capture is infeasible, and it is conducted in a manner consistent with law of war principles.', ""The president's authority to respond to this threat arises from Congressional authorization, AUMF, and the inherent right of national self-defense. The executive branch's weighing of evidence meets the due process requirement. Its decision does not require judicial approval."", 'The U.S. is engaged in non-international armed conflict with al Qaeda and its associates, a fight that is not limited in geographical scope.']","['The public does not know what the selection process is, or who signs off on it. Due process requires that government discloses the criteria by which U.S. citizens could be put to death.', 'Giving the president unchecked authority will lead to abuse. There must be a role for the court in this process, even if it occurs after the fact.', 'Despite what the administration claims, the world is not a battlefield, and the president does not have the authority to kill anyone he wants wherever he wants. ""Imminence"" is one of the standards used to determine whether a targeted killing is lawful, but the administration has redefined it to go beyond how it is used in domestic and international law.']"
d20140227,Affirmative Action On Campus Does More Harm Than Good,2014-02-27,"['Gail Heriot', 'Richard Sander']","['Randall Kennedy', 'Theodore Shaw']","['Despite its noble goals, affirmative action is a counterproductive, and arguably unconstitutional, social policy that depends on the very principle it stands against: racial discrimination.', 'Placing students in schools mismatched to their abilities has led to higher rates of minority failure and attrition.', 'This academic mismatch reinforces negative stigmas and racial stereotypes that have harmful social consequences, resulting in self-segregation on campuses and undermining racial equality in larger society.', 'Color-blind admissions, along with a class-based form of affirmative action, would better achieve the goals of social equality, with far fewer costs and more beneficial outcomes.']","['Affirmative action is necessary to redress past racial injustices—and their ongoing effects—and to fight the present forms of discrimination that pervade society today.', 'The active integration of marginalized groups into mainstream academic institutions more fairly distributes opportunity, access and power.', 'In addition to benefiting individuals and minorities, affirmative action invaluably strengthens entire institutions through diversity, as testified by major corporations and the U.S. military.', 'Color-blind alternatives, while beneficial as a supplement to affirmative action, do not adequately or honestly address the persistent presence of racial inequality in the U.S. To eliminate racial preferences in higher education would have disastrous consequences on the whole of society.']"
d20140212,Snowden Was Justified,2014-02-12,"['Daniel Ellsberg', 'Ben Wizner']","['Andrew C. McCarthy', 'Ambassador R. James Woolsey']","['Edward Snowden\'s leaking of top-secret government surveillance programs have sparked much-needed debate, and have raised what even the president concedes are ""legitimate policy questions.""', ""Snowden has done this country a great service by exposing the NSA's abuse of authority and illegal programs. Proposed intelligence reforms from the president, Congress, and the White House's own task force only underline the fact that his actions were justified."", 'Snowden has stated that he reported his concerns to superiors. No action was taken, and he was forced to take his information public.']","[""Snowden's leaks have been damaging to the U.S. Beyond the NSA's domestic surveillance programs, he has also released information related to international spying; information that has compromised our security and tipped off our enemies."", 'The programs and operations Snowden revealed are legal, and it is unlikely that any significant changes will be made at the NSA.', 'Snowden should have taken his concerns through proper channels or to a member of Congress before leaking to the press.']"
d20140115,Obamacare Is Now Beyond Rescue,2014-01-15,"['Dr. Scott Gottlieb', 'Megan McArdle']","['Jonathan Chait', 'Dr. Douglas Kamerow']","['With the loss of public trust and the weakening of the Democratic Party, Obamacare cannot survive its escalating political crisis, which will likely break down the law piece-by-piece through delays and legislative cuts.', 'With the botched launch of healthcare.gov, its main consumer interface, Obamacare lost many of the customers its success depends upon: the young and healthy needed to balance the costs of the old and sick.', 'Due to the absence of major insurers in the majority of exchanges, the marketplace is failing and will only worsen in 2015.', 'As written, the Affordable Care Act has inhibited competition, disincentivizing the full participation of insurance companies with its severe restrictions on what kind of plans can be offered. Despite promises to increase and improve health coverage, Obamacare has severely limited provider access and jeopardized the quality of medical care through its ""narrow networks,"" a challenge which will repel patients, doctors, hospitals, and insurers alike.', 'Though the website is largely fixed on the consumer side, massive problems are still unresolved—mainly, the lack of any technical infrastructure to provide insurers with the consumer information required to launch plans and provide coverage.']","[""While the launch of healthcare.gov was an unmitigated disaster, the bulk of Obamacare's rollout over the past three and a half years has been largely successful, from the coverage of people with pre-existing conditions to evidence-based preventive services."", 'Obamacare has had better-than-expected results on many fronts, decreasing costs through pay-for-quality reforms, rapidly lowering medical inflation, and sparking a new tide of innovation.', 'The alarmist anecdotes of rising medical costs and lowered provider access under Obamacare do not indicate its failure; while unfortunate, these issues are few and insignificant compared to the increased coverage that Obamacare will provide to previously uninsured Americans. Millions of Americans will have signed up in the exchanges by the time the open enrollment period ends, with even more following for 2015.', 'Major medical organizations, as well as many in the health-care industry, believe that increased participation is far more likely than a death spiral. From its doomsday scenarios to its constant rhetorical attacks, the Republican Party has waged a relentless war on Obamacare in hopes that constructing a narrative of its failure will induce its failure. Their attempt at sabotage is a political fantasy—the democrats will remain united behind it.', ""The successes of certain states' exchanges (such as Kentucky), as well as health care reform in Massachusetts, signify Obamacare's workability on the federal level. As with any large and complex enterprise, it will continue to face hurdles, but these do not signify its failure.""]"
d20131204,Don't Eat Anything With A Face,2013-12-04,"['M.D. Neal Barnard', 'Gene Baur']","['Chris Masterjohn', 'Joel Salatin']","['A meat-free, plant-based, whole foods diet, low in fat and high in fiber, can have immense health benefits, controlling diabetes, heart disease, certain cancers, kidney failure, obesity, and other life-threatening ailments.', ""The majority of meat today is produced on inhumane, industrialized factory farms. And just as it is unthinkable to kill one's dog or cat, the slaughter of farm animals—sentient beings, capable of suffering, happiness, sadness, and intellect—is not ethical."", 'Farm animal production, one of the leading causes of global warming, has disastrous effects on the environment, including waste, water pollution and shortages, dead zones, deforestation, and soil degradation.']","[""The most environmentally friendly, ethically responsible, and healthy diet is a not a meat-free one, but rather a locally sourced, sustainably produced one. It is not meat consumption that must end; it is agribusiness's factory production of foods."", 'The meat, bones, skin, and organ meats of healthy animals provide a balance of nutrients necessary for optimal physical and mental health.', 'Meat is only unhealthy when it is produced in factory farms where animals are unnaturally fed grains and hormones, infested with bacteria, and pumped with antibiotics.', 'Animal husbandry is critical to sustainable agriculture, which depends on the balanced, regenerative ecological cycle between humans, the land, vegetation, and animals.']"
d20131120,"Spy On Me, I'd Rather Be Safe",2013-11-20,"['Stewart Baker', 'Richard Falkenrath']","['David Cole', 'Michael German']","['We cannot identify terrorists in real time, and without bulk collection, there would be no way for our intelligence community to track and connect their movements.', ""Under the Foreign Intelligence Surveillance Act and the Patriot Act, the NSA's actions are legal."", ""NSA surveillance has made us safer. In 2009, intelligence officials were able to connect an email from a known terrorist in Pakistan to Najbullah Zazi, thwarting Zazi's plans to bomb the New York Subway system."", ""Terrorists dispersed around the world make use of our communications infrastructure. If we don't allow government to use this data, what is the alternative?""]","['Whether the current government is trustworthy and acts with good intentions is irrelevant. Building the capacity to collect and store the communications of every American is a capability open for abuse.', 'The NSA has overstepped its authority by conducting suspicionless surveillance of Americans, violating our First and Fourth Amendment rights.', 'By demanding or creating back doors into encrypted systems, the NSA has weakened internet security for everyone.', ""The sheer volume of data collected is making the NSA dysfunctional, and the agency's purported successes have been exaggerated; instead of a previously reported 54 terrorist plots thwarted by phone surveillance, the real number is only 1.""]"
d20131114,The Constitutional Right To Bear Arms Has Outlived Its Usefulness,2013-11-14,"['Alan Dershowitz', 'Sanford Levinson']","['David Kopel', 'Eugene Volokh']","['The social costs of widespread firearm distribution—foremost, the high murder rate in the U.S.—outweigh whatever degree of liberty gun ownership is seen to protect.', ""When the practical consequences of a right becomes counterproductive to society, it has outlived its usefulness. While armed citizens ensured the security of a free state in 1789, personal guns are no longer a civilian's main protection or democracy's best safeguard. Today, the U.S. has a standing army and a well-trained police force that provide for our security and protection."", 'When the values of society at large have significantly changed, a stubborn allegiance to the constitution should not blind us to the incompatibility of certain tenets with modern society.', 'Technological advancements have created guns with capabilities far beyond those envisioned in 1789, and the Second Amendment is not capable of regulating such arms.']","['The individual right to bear arms, like free speech and trial by jury, is fundamental to our American identity. It safeguards democracy, guaranteeing that all citizens have power relative to the state and to each other.', 'The Bill of Rights is meant to place certain rights beyond political controversy. Authorizing judges to nullify a constitutionally guaranteed right based on it being ""outdated"" puts all constitutional liberties in jeopardy.', 'Stricter gun laws do not necessarily decrease crime or prevent mass killings. Criminals will get their hands on guns legally or not, so we should address gun violence as a social and economic issue, rather than a legal one.', 'Technological changes have not rendered other constitutional rights useless over the past two centuries (i.e. the internet and freedom of speech), and the same should hold true for the right to bear arms.']"
d20131030,Let Anyone Take A Job Anywhere,2013-10-30,"['Bryan Caplan', 'Vivek Wadhwa']","['Kathleen Newland', 'Ron Unz']","[""Allowing people to move as freely as goods and capital would benefit the world's economy, by some accounts, doubling the global GDP and bringing an end to poverty."", 'Freedom of movement, as well as equal access to opportunity, is a basic human right. Open borders would end the arbitrary discrimination against people based on their place of birth, allowing those trapped in third world poverty to access first world opportunity.', 'Emigrants transfer knowledge and skills back to their developing countries and, via remittances, help to alleviate poverty, develop markets, and increase trade.', 'The free movement of people strengthens global networks that spur innovation, maximize human potential, and reduce international conflicts.']","['Developing countries would not only suffer a brain drain, but tenuous economic development and delayed political and social reform.', 'Remittances are only a band aid for poverty and do not develop economic infrastructure.', 'Immigrants are a net fiscal burden, overwhelming an already strained economy and draining public resources like schools, hospital care, and welfare benefits.', 'Opening our borders would create job competition for native workers, suppressing wages and putting the least-skilled Americans out of work.', 'The free movement of people could threaten the cultural identities of both sending and receiving countries.']"
