id,title,date,for,against,For_Main_Points,against_Main_Points
d20170606,Debating the Constitution: Technology and Privacy,2017-06-06,"['Stewart Baker', 'John Yoo']","['Michael Chertoff', 'Catherine Crump']","['There is a perception that government has the ability to sweep up all of our digital information—but meaningful details gleaned from metadata is limited, and not all data is backed up to the cloud. Access to devices yields information that cannot be obtained otherwise.', 'The 4th Amendment authorizes searches when law enforcement is granted search warrants approved by a judge. With ever-evolving technology, law enforcement is simply seeking the communications it is already authorized to intercept, and end-to-end encryption would subvert this constitutional provision.', 'Encryption is the “equivalent of a closet that can’t be opened, a safe that can’t be cracked,” and there are consequences for law enforcement and national security. It hampers our ability to prosecute criminals, exonerate the innocent, and prevent future attacks.', 'The All Writs Act grants the courts “the power to issue orders to compel people to do things within the limits of the law.” A government request for consumer data is often within these limits, including in the high profile Apple case.']","['We need both privacy and security, but in this “Golden Age of Surveillance,” where nearly all of our communications and movements are tracked by some piece of technology, we need to do more to protect consumers’ privacy.', 'The government is relying on an overbroad interpretation of the All Writs Act that is in violation of the 4th Amendment. Requiring companies to comply with demands to hand over data and build backdoors today will set up a dangerous precedent.', 'Law enforcement’s demands for access to customer data on devices like the Amazon Echo, or iPhone, are in violation of the 1st Amendment and the right to free expression.', 'Our greatest security threats will come from hackers and rogue nations that use cyberattacks and economic espionage to hurt us. In the end, creating “back doors” and compromising encryption only makes us more vulnerable.', 'There are many ways for bad actors to hide their actions from government. The use of encrypted apps would render an unlocked phone useless.']"
d20170510,Video Games Will Make Us Smarter,2017-05-10,"['Daphne Bavelier', 'Asi Burak ']","['Elias Aboujaoude', 'Walter R. Boot']","['Playing action video games can improve cognitive skills like problem solving, the ability to focus, and reaction times—gains that can carry over into other areas of life.', 'Innovators are creating video games that educate and promote social change for the better.', 'Despite their reputation, research shows that there is no causal link between video games and aggression. In fact, video games have been used to fight mood disorders like depression.', 'Game-based learning should be embraced by adults and children alike to both garner interest in learning new topics and to help students succeed in an increasingly connected and digital universe.']","['Video games are not making us smarter. Small improvements are offset by the atrophying of other areas of brain functioning and the stimulation of compulsive tendencies.', 'The observed cognitive gains from gaming have not been found to be transferable to related tasks or cognitive performance overall.', 'Gaming can become all-consuming, leading to social isolation and the shirking of real-life responsibilities.', 'Video games rely on binary win/lose mechanisms for evaluating success. An over-reliance on them as learning tools could impede the development of skills necessary to navigate real-world challenges.']"
d20170406,Long Live Walmart,2017-04-06,"['John Tierney ', 'Richard K. Vedder']","['Nelson Lichtenstein', 'Amy Traub']","['Given its role in providing jobs and career training for low-skilled workers who would otherwise be unemployed, Walmart should been seen as a wide-scale anti-poverty program both at home and abroad.', 'Walmart has revolutionized the way Americans shop. By offering guaranteed low prices, Americans can spend less on day-to-day necessities and improve their quality of life.', 'Walmart is a sustainability leader. Its commitment to renewable energy, achieving zero waste, and supporting responsible production and supply chains have positive impacts on its customers and competitors.', 'When a Walmart store opens in a rural area, it often becomes the center of a growing marketplace and draws customers that will support surrounding local businesses.']","['Walmart is the embodiment of corporate greed. The big box store has a long history of underpaying its workers while overpaying its executives and corporate leadership.', 'Walmart takes advantage of workers, who, with few other employment opportunities, are forced to accept jobs that offer unreliable hours, no benefits, low compensation, poor working conditions, and little useful job training.', 'By operating as a monopoly, Walmart has driven down the price of goods and services and directly contributed to the failure of small, locally owned businesses around the nation.', 'Walmart’s corporate practices are not only bad for people, but for the planet. By selling cheap products not meant to last, it contributes to widespread consumer waste.']"
d20170424,Unresolved: Trump's First 100 Days,2017-04-24,"['Jamelle Bouie', 'Ian Bremmer', 'Kris Kobach']","['Rich Lowry', 'Jennifer Rubin']",,
d20170322,The Universal Basic Income Is The Safety Net Of The Future,2017-03-22,"['Charles Murray', 'Andrew Stern']","['Jared Bernstein', 'Jason Furman ']","['As industries become more automated, the need for human workers will decrease. In the face of such disruption, a guaranteed basic income would be an effective way to ensure economic stability for everyone.', 'In the face of growing inequality, a universal basic income would substantially reduce poverty and address a spectrum of social issues including food security and access to health care and housing.', 'Without the pressure to earn a basic income, people would be able to pursue their career interests, leading to greater societal innovation and professional satisfaction.']","['A guaranteed income would disincentivize work and stifle productivity. Automation in the workplace should be met with innovation in worker training and education rather than financial handouts.', 'Rather than giving money to those who are not in need, the government should direct federal funds to successful existing programs, such as Social Security, Medicare and Medicaid.', 'We can’t afford it: according to CBPP, if everyone received a UBI of just $10,000 a year, it would cost the federal government more than $3 trillion dollars.']"
d20170301,Charter Schools Are Overrated,2017-03-01,"['Gary Miron', 'Julian Vasquez Heilig']","['Jeanne Allen', 'Gerard Robinson']",,
d20170208,The Special U.S.-Saudi Relationship Has Outlived Its Usefulness,2017-02-08,"['Madawi Al-Rasheed', 'Mark P. Lagon']","['F. Gregory Gause', 'James Jeffrey']","['Our diverging priorities in the Middle East and the Saudi’s continued support and funding of religious extremism highlight the differences in our national security interests.', 'Advances in natural gas and oil production technologies have freed us from our reliance on Saudi oil.', 'The U.S. cannot continue to ignore Saudi Arabia’s abysmal human rights record on their treatment of women, religious minorities, and dissidents.']","['This relationship has been mutually beneficial for over 70 years, and we cannot afford to alienate one of the few states holding an unstable region together.', 'Saudi Arabia has been an important ally in the fight against terrorism, especially through shared intelligence.', 'Saudi Arabia is the largest producer of crude oil in the world, and it is to the global economy’s benefit to secure its accessibility.']"
d20170201,Give Trump A Chance,2017-02-01,"['Clive Crook', 'Gayle Trotter']","['David Frum', 'Michael Waldman ']","['Donald Trump’s democratic election reflects the will of the people. American democracy requires the peaceful transfer of power and the opportunity for elected officials to exercise the powers afforded to them by the Constitution and national law.', 'Obstructionism will not only prevent lawmakers from taking the actions necessary to operate the federal government, it will deepen America’s political divides.', 'Donald Trump’s campaign was fueled by a growing sense that Washington had failed the voters. Preventing President Trump from acting would further disillusion many Americans against their government.']","['Donald Trump’s campaign trafficked in bigotry and racism. Allowing him to implement his campaign promises would put American ideals, like religious freedom and civil rights, at risk.', 'Since elected, Donald Trump has proven unqualified to serve in the office through his failures to disclose potential conflicts of interests, routine dismissal of American intelligence agencies and diplomatic traditions, and insistence on nominating highly controversial figures to key leadership positions.', 'Donald Trump lost the popular vote by more than 2.8 million. His Electoral College victory does not reflect the will of the American people and he has not earned a mandate to lead.']"
d20170111,Policing Is Racially Biased,2017-01-11,"['Gloria Browne-Marshall', 'Marq Claxton ']","['Heather Mac Donald', 'Harry Stern']",,
d20161207,Call a Convention to Amend the Constitution,2016-12-07,"['Lawrence Lessig', 'Mark Meckler']","['David Super', 'Walter Olson']","['The framers of the Constitution put a system in place to address an ineffective or failed Congress. By circumventing Congress, an Article V convention would empower states to address issues national legislators will not.', 'In an era of unprecedented expansion of federal government through executive orders and wide-reaching Supreme Court decisions, an Article V convention would allow states to propose and ratify amendments that limit federal overreach.', 'The threat of a “runaway” convention is unsubstantiated. Because 38 states would be required to ratify any proposed amendment, any changes to the Constitution would reflect the will of the majority of Americans.']","['Article V gives us very little guidance on how a convention would actually work. With such an ill-defined process, whatever the end-result, the legitimacy of the Constitution will be called into question.', 'A convention to amend the Constitution would give special interest groups unprecedented opportunity to lobby delegates for their causes, allowing wealthy donors and corporations direct access to the amendment process.', 'Opponents say the only precedent we have to work with is the convention of 1787--which scrapped the Articles of Confederation. With no way to enforce limits on the proceedings, sweeping changes could be made. Are we ready to imperil fundamentals of the Constitution, particularly in our current and deeply partisan political climate?']"
d20161129,Obama’s Foreign Policy Is a Failure,2016-11-29,"['Eliot Cohen', 'Kristen Silverberg']","['Derek Chollet', 'Vikram Singh']","[""America's standing in the world and American security have both deteriorated under Obama's policy of retreat."", 'The president has strained our relationships with allies like Israel and Saudi Arabia, while embracing enemies like Iran.', 'He has repeatedly signaled to our adversaries that red lines and bad behavior will be ignored, when effective diplomacy requires the real threat of action to back it up.', 'The Middle East is now worse off than when Obama first entered office.']","['Obama has used restraint when faced with hard choices, moving away from the ""playbook"" of default militarized response.', ""Proponents of more muscular intervention in the Middle East ignore the risk of getting mired in further conflict, and overestimate our ability to influence the region's trajectory."", 'The killing of Osama bin Laden,the Iran deal, the Paris climate agreement, restored relations with Cuba are all evidence of success.', 'After inheriting two wars and a financial crisis, Obama will leave office having made America safer.']"
d20161114,Gerrymandering Is Destroying the Political Center,2016-11-14,"['Caroline Fredrickson', 'David Daley']","['Nolan McCarty', 'Chris Jankowski']","['By isolating like-minded voters in the same congressional districts, gerrymandering creates a class of highly partisan elected officials that reject compromise and promote ideological extremes to appease their constituents.', 'With established “safe” congressional districts, state and national party resources can be pooled for more competitive districts, creating campaign battle grounds that foster partisan divide in what would otherwise be small, local races.', ""The practice of “cracking” spreads opposing party voters throughout districts, putting them in the minority. This suppresses ideological diversity and ensures that these voters' voices are drowned out.""]","['The polarizing impact of gerrymandering is nominal, and other issues are the real drivers of extreme views in politics.', 'Many districts that strongly favor one party over another are the result of sorting, where individuals choose to live among the like-minded.', 'The success of longtime politicians has less to do with gerrymandering and more to do with the inherent benefits of running as an incumbent.', 'The partisan goal of gerrymandering isn’t to create a few completely safe districts, but as many competitive districts as possible for the majority party. This creates more ideologically diverse districts, not ideologically isolated districts.']"
d20161026,Give Undocumented Immigrants a Path to Citizenship,2016-10-26,"['Angela Kelley', 'Marielena Hincapié']","['Steven Camarota', 'Rich Lowry']","[""It’s not economically or logistically practical to deport 11 million people, and enforcement alone won't work."", 'Immigrants would earn their citizenship by going through a rigorous process that includes background checks, paying a penalty and taxes, and learning English.', 'Bringing immigrants legally into the workforce will stimulate the economy, increasing consumption of goods and services, and increasing tax revenue.', 'The border has never been more secure, the number of crossings has decreased, and we already spend over 17 billion dollars a year on enforcement.', 'Keeping families of mixed immigration status together is the moral thing to do.']","['We need to focus on securing our borders and enforcing the immigration laws that we already have.', 'There is no way to adequately vet 11 million people for citizenship.', 'By granting immigrants who are here illegally a path to citizenship, we are essentially rewarding bad behavior and encouraging more of the same.', 'Wages have stagnated or declined for less-educated U.S. workers, many of whom are forced to compete with immigrants for jobs.', 'Immigrants pay less in taxes than they receive in government benefits and services.']"
d20161013,Blame Big Pharma for Out-of-Control Health Care Costs,2016-10-13,"['Dr. Ezekiel J. Emanuel', 'Neera Tanden']","['Lori Reilly', 'Paul Howard']","['Medical patent laws created to spur innovation distort the drug market to allow large pharmaceuticalcompanies a monopoly on life-saving treatments and the ability to exploit those in need for monetary gain.', 'Due to a lack of transparency around drug production costs and insurance subsidies for buyers, pharmaceutical companies are not beholden to traditional market forces like consumer-imposed price limits.', 'Pharmaceutical companies can charge exorbitant prices for common drugs, even when the actual cost of drug production and distribution are low.', 'Because most developed nations regulate medical costs and allow state negotiation with drug companies, patients in the United States pay substantially more for pharmaceuticals than do their counterparts around the world.']","['Developing life-saving medication requires substantial time and resources; those costs are justifiably passed along to consumers when a drug is viable, and the sale of common drugs subsidizes the development of cures for rare diseases.', 'Given the financial interests of for-profit insurance companies, hospitals, and medical practices, pharmaceutical companies cannot be blamed for the economic burdens of an out-of-control health care system.', 'Pharmaceutical innovation eliminates the need for other costly medical interventions, such as organ transplants made obsolete by drug alternatives, and makes health care less expensive as a whole.', 'Because the American government allows a competitive free market for drugs and does not stifle innovation, the world benefits from American research and development of drugs.']"
d20160926,The First Presidential Debate,2016-09-26,['Hillary Clinton'],['Donald Trump'],,
d20160913,Blame the Elites for the Trump Phenomenon,2016-09-13,"['Timothy Carney', 'Ben Domenech']","['Jennifer Rubin', 'Bret Stephens']","['Elites have pursued an agenda that has benefited corporations and the affluent, but largely ignored the plight of the working class.', 'With growing competition for jobs and manufacturing moving overseas, the pro-immigration and pro-trade elite are out of sync with America’s workers.', 'The establishment failed to recognize populism’s growing strength and essentially did too little, too late, to stem Trump’s popularity.']","['The far right has been sowing the seeds of unrest and anger, paving the way for an outsider candidate who has appealed to voters’ frustration.', 'Globalization benefits the U.S. Retreating from the world through protectionist policies would hurt the average American more than it would help.', 'There is an abundance of easily accessible information out there, and we can blame the people who voted for Trump for accepting his campaign of misinformation.']"
d20160907,Climate Change: The EPA Has Gone Overboard,2016-09-07,"['Charles McConnell', 'Michael Nasi']","['Carl Pope', 'Jody Freeman']","['Pollution is global. As EPA regulations stifle American industry, businesses operating in nations without such restrictions gain a competitive edge and offset any potential environmental benefit created by American emission controls.', 'The economic burden of complying with EPA demands is passed from American companies to consumers and disproportionally affects the poor who cannot afford higher energy costs.', 'EPA emission regulations force the closure of existing power plants and pressure businesses to adopt new, untested, and often unreliable technology, which compromises U.S. energy security.', 'While the U.S. may seek to be a leader in climate change regulations, bringing proposals to the international table that are highly unpopular and contested at home undermines American credibility abroad.', 'Under the Clean Power Plan, states must file plans to reduce carbon emissions or accept a federal plan, which violates state sovereignty protected by the 10th Amendment.']","['The effects of climate change cannot be mitigated by one nation alone. The U.S. must take a leadership role to combat this threat, which will require setting a global standard at home.', 'To avoid overreach, the Clean Power Plan sets state emission reduction standards based on the economic impact of regulation in each state, and offers each state autonomy in how it will address compliance.', 'In 2009, the EPA formally found that greenhouse gases endanger public health and welfare; it has a clear mandate to enforce regulations that will counter this threat, regardless of opposing political or industry interests.', 'EPA performance standards target the sources of pollution, which is a regulation of industry not states, and is both constitutionally sound and aligned with standard federal governance.', 'EPA regulations and incentives encourage innovation and diversification within the American energy industry and make American companies more competitive in the 21st century global economy.']"
d20160608,The President Has Usurped the Constitutional Power of Congress,2016-06-08,"['Michael McConnell', 'Carrie Severino']","['Adam Cox', 'Eric Posner']","['The Framers separated the powers of government into three branches and established a system of checks and balances to guard against abuse of those powers. There has been a pattern of overreach by the executive branch. As James Madison wrote in Federalist No. 51, ""[i]n republican government, the legislative authority necessarily predominates.""', 'With executive orders, administrative regulations, creative interpretations of federal statutes, and executive agreements with other nations, it may seem that the president, not Congress, wields the most potent legislative power.', 'Article II, Section 3 of the Constitution states that the president “shall take Care that the Laws be faithfully executed,” a duty Obama flouted by taking unilateral action to suspend the employer mandate of Obamacare, and through his executive orders on immigration, DACA and DAPA.', 'The Constitution clearly states Congress alone has the power to declare war. Obama exceeded his authority by waging war in Libya without congressional consent.', 'The president’s use of recess appointments is, as Justice Scalia wrote, “[a] self-aggrandizing practice adopted by one branch well after the founding, often challenged, and never before blessed by [the Supreme Court].”']","['Strong executive power has been necessary for an effective and functioning government. The Framers feared the abuse of power, but they also feared a weak executive unable to enforce the laws of our nation. In Federalist No. 70, Alexander Hamilton argued for a strong, “energetic” president, writing that “[a] feeble Executive implies a feeble execution of the government.”', 'Over time, Congress has given the president enormous discretion to determine our nation’s policy.', 'With DACA and DAPA, the Obama administration has exercised prosecutorial discretion to make the best use of limited resources to prioritize the removal of undocumented immigrants who pose a threat to security, and defer the removal of others.', 'The president has authority to use military force without a declaration of war. The Libya intervention fell short of war—it did not involve sustained fighting or ground troops—and fell within the limits of the War Powers Resolution.', 'On presidential recess appointments, Justice Breyer wrote, that we should be reluctant to “upset this traditional practice where doing so would seriously shrink the authority that presidents have believed existed and have exercised for so long.”']"
d20160504,Hunters Conserve Wildlife,2016-05-04,"['Anthony Licata', 'Catherine Semcer']","['Wayne Pacelle', 'Adam M. Roberts']","['Revenues from hunting fund conservation efforts, both within the U.S. and abroad, going toward wildlife refuge programs and preserving national, state, and private lands.', 'Regulated hunting helps maintain healthy animal populations, preventing overcrowding, resource depletion, and the spread of disease.', 'The sport of hunting promotes active engagement with nature and ensures humans are invested in preserving wildlife and lands.', 'Regulatory agencies and industries created around hunting are critical to combating poaching and illegal depletion of animal populations.']","['Hunting alters the natural composition of animal herds and, even when population sizes are maintained, negatively impacts their long-term survival.', 'The global market around trophy hunting is often corrupt and funds raised from hunters are often misappropriated.', 'Domestic and international regulatory agencies that oversee hunters are often pressured to set quotas based on industry demands rather than animal well-being.', 'Endangered animals are already at risk of extinction by poachers and natural predators; legalized hunting exacerbates the problem.']"
d20160406,Eliminate Corporate Subsidies,2016-04-06,"['Jack Abramoff', 'Zephyr Teachout']","['Kate Gordon', 'Michael Lind']","['By subsidizing corporations and industries, the U.S. government is distorting markets and the economy.', ""We've created a corrupt system where industry groups and large corporations lobby the government, and the government in turn rewards them with subsidies."", ""According to Good Jobs First, the federal government has given away some $68 billion in subsidies over the last 15 years, two-thirds of which has gone to corporations that don't need it—giving big businesses an unfair advantage.""]","['Government subsidies have backed important R&D programs that have played a critical role in launching new technology, like the Internet and fracking.', 'Government support is crucial to helping nascent industries break into entrenched industries like the energy sector.', 'Subsidies are critical to helping U.S. companies compete in a global marketplace where countries like Germany and China are heavily subsidizing industries.']"
